,Title,ConRate,DesRate,Author,Date,Content,BookCode
3,이 책과 함께 꼭 합격하고 싶어요~,5,5,숨숨숨,2020-08-20,이 책과 함께 꼭 합격하고 싶어요~시험 특성과 문제 유형이 잘 정리 되어 있는게 정말 좋은거 같습니다.혼자서 처음 시험을 준비하는 사람들도 잘 공부할 수 있을 것 같은 생각이 듭니다. 무엇보다 내용이 알차서 좋고. 이 책으로 문제를 풀어보는 것이 더 좋을 거 같습니다. 문제가 가장 깔끔하고 난이도도 적당하게 잡혀있어 공부하기 참 좋은 책인것 같습니다.꼭 합격하겠습니다 :),9791125477600
0,좋아요,5,5,휘마더,2020-09-30,좋아요 기출 강의도 무료좋아요 기출 강의도 무료좋아요 기출 강의도 무료좋아요 기출 강의도 무료좋아요 기출 강의도 무료좋아요 기출 강의도 무료좋아요 기출 강의도 무료좋아요 기출 강의도 무료좋아요 기출 강의도 무료좋아요 기출 강의도 무료좋아요 기출 강의도 무료좋아요 기출 강의도 무료좋아요 기출 강의도 무료좋아요 기출 강의도 무료좋아요 기출 강의도 무료좋아요 기출 강의도 무료좋아요 기출 강의도 무료좋아요 기출 강의도 무료좋아요 기출 강의도 무료좋아요 기출 강의도 무료,9791190958103
1,숨어있는 행정법 1타,5,5,yoyo,2020-09-28,행정법 1타라는 명성을 가지고 있는 강사들도 이름에 걸맞지 않게 각론을 포함한 모의고사는 출판하는 것을 꺼리는 경향이 있는 것 같습니다. 이 모의고사는 일단 크기부터가 널찍널찍해서 실제 시험에 응시하는 기분을 똑같이 느낄 수 있습니다. 모의고사 내용도 지엽적이거나 억지스러운 부분이 전혀 없고 컨텐츠 구성을 굉장히 잘했다는게 느껴집니다. 몇년이내 행정법 1타가 되시리라 믿어 의심치 않습니다.,9791190958103
2,무난한 행정법 동형,4,4,화이트봉봉,2020-09-17,각론이 포함된 7급대비 행정법 동형문제집이라구매하게 되었습니다9급용 행정법총론 동형은 많은데 7급대비 각론 포함된건몇종류 없어서요너무 어렵거나 이상한 문제는 없는것 같습니다각론이 포함된 7급대비 행정법 동형문제집이라구매하게 되었습니다9급용 행정법총론 동형은 많은데 7급대비 각론 포함된건몇종류 없어서요너무 어렵거나 이상한 문제는 없는것 같습니다,9791190958103
0,좋아요,5,5,lmdjy,2020-10-03,2021 전한길 한국사 합격생 필기노트 좋아요. ㅎㅎㅎㅎㅎㅎㅎㅎㅎㅎㅎㅎㅎㅎㅎㅎㅎㅎㅎㅎㅎㅎㅎㅎㅎㅎㅎ 2021 전한길 한국사 합격생 필기노트 구성도 깔끔해서 보기 좋아요 . ㅎㅎㅎㅎㅎㅎㅎㅎㅎㅎㅎㅎㅎㅎㅎㅎㅎㅎㅎㅎㅎㅎ 분철도 되서 편하게 볼 수 있어서 좋아요 . ㅎㅎㅎㅎㅎㅎㅎㅎㅎㅎㅎㅎㅎㅎㅎㅎㅎㅎㅎㅎㅎㅎㅎㅎㅎㅎㅎㅎㅎㅎㅎㅎㅎㅎㅎㅎㅎㅎㅎㅎㅎ,9791197123306
1,믿고 보는 전한길 필노,5,5,예스이십사짱,2020-09-02,"기다리고 기다리던 2021 필노,, 기대한 만큼 좋습니다 독서대 활용해서 넘겨서 볼 계획이어서 분철했습니다 글씨 짤린 것없이 예쁘게 분철 되었어요 배송도 진짜 빨리 됐구요다들 배송느리다고 걱정했는데 마음 놓고 기다리니 금새 왔습니다 진짜 기다리고 기다리던 2021 필노 좋습니다!이 한권만 있으면 한국사 정복할 수 있을 것 같습니다 한기리보이만 믿고 따라갑니다 화이팅!",9791197123306
2,2021 전한길 한국사 합격생 필기노트,5,5,dbrldh,2020-08-05,"책이 얇음에도 불구하고 중요한 내용은 빠짐없이 들어있어서 공부하기에 덜 부담스럽고 좋아요. 표로 정리되어 있지 않아도 한눈에 알아볼 수 있을 정도로 잘 요약되어 있고 글씨 색깔, 포스트잇 색깔들이 중요도에 따라 규칙적으로 되어 있어서 회독할 때 편하고 좋아요. 글씨체도 가독성 있고 만족합니다. 뒷부분에 지역사 등 알짜배기들이 있어 공부하기에 많은 도움이 될 거 같아요. 두문자암기법도 있고 혼자 공부하기에도 좋은 책인 것 같습니다.",9791197123306
3,정말 좋아요,5,5,tksth83,2020-08-04,주부 공시생으로 수험기간이 길어지면서필노를 여러권 구매했습니다이번 개정판이 제일 좋네요!!!두문자 처리도 되어 있고 사료도 들어가 있어서공부하기가 훨 수월해졌어요!!!워낙 좋은 책이라 보시는분들은 무조건 만족하실듯요국사를 제대로 보지 않아 이번 시험에서 국사 때문에지방직 국가직 모두 고배를 ㅠㅠ내년엔 꼬옥 100점 맞도록 열심히 보고 또 보겠습니다,9791197123306
4,필노,5,5,Som,2020-08-04,글씨체가 바뀌었고 예전보다 글자사이의 간격이 좁아진거같아요 대신 구성이 더 추가되었고 새로운 내용이 많이 추가되어 만족합니다 분철했는데 분철이 튼튼하게 잘 와서 좋고필기노트는 역시나 내용이랑 구성 모두 알차고 좋습니다특이 뒤에 합격생 노트? 같은 개념으로 6장 정도 더 추가되었던데 사료 및 문화재 사진을 같이 볼 수 있어서 더 좋게 업그레이드 된 거 같아 만족합니다,9791197123306
5,2021 필노 받았습니다,5,5,헤지니,2020-07-30,빠르게 받아봐서 좋아요가독성도 좋습니다1쇄라 맞춤법이 다른부분이 있지만 앞으로는 나아지겠죠전 크게 불편함없이 보고있네요 분철도 잘되어와서 좋아요 역시 책은 yes24!!좋아요좋아요좋아요좋아요좋아요좋아요좋아요좋아요좋아요좋아요좋아요좋아요좋아요좋아요좋아요좋아요좋아요좋아요좋아요좋아요좋아요좋아요좋아요좋아요좋아요좋아요좋아요좋아요좋아요좋아요좋아요좋아요좋아요좋아요좋아요좋아요,9791197123306
0,2021 김병태 국왕국어,5,5,안녕?,2020-10-06,안녕하세요 이번에 국어공부를 제대로 해보려고 2021 김병태 국왕국어 올인원 세트를 샀습니다. 일단 표지에서부터 알 수 있듯이 책의 전반적인 색깔은 초록색이 테마인 듯 합니다. 김병태 선생님 수업을 들어보신 분이라면 아시겠지만 수업하시는 순서나 내용이랑 책 내용이 다르긴 합니다. 근데 따로 짚어 주시기도 하고 뭐 굳이 책대로 가야 할 이유는 없으니까 저는 좋아요 집중도 더 잘되고 ㅎㅎ 사실 책이 없어도 될 것 같긴 한데 그래도 심리상.. 없으면 너무 불안하니까^^ 한권 사기는 했네요. 책 분량에 비해서 가격이 비싸다고 생각합니다. 근데 뭐 어쩌겠어요 사야되니까 사버렸네요. 다른 선생님 책도 작년에 사서 집에 있는데 개인적으로 이 책이 더 좋은 것 같아요. 전반적인 디자인이나 순서 배열부분에서요. 저는 마음에 들어요 이번 책. 깔끔하고 보기 좋습니다. 양 날개에는 기출 문제들이 실려 있는데 최신문제 위주로 실려 있는 것 같네요. 배운부분 복습하고 간단하게 풀어보기 좋아서 장점입니다. 깔끔하면서도 군더더기 없는 국어 기본서 필요하신 분들은 이 책 사시면 마음에 드실 것 같아요. 저는 아주 만족합니다! 다들 열공합시다 파이팅,9791165761035
1,"김병태님 믿고가는것이지, 교재는 솔직히 ㅎㅎ;",3,5,핍티센트,2020-09-23,교재가 컴팩트합니다그냥 김병태님+요즘 공무원국어의 흐름에 맞춰서 가볍게갑니다.비문학 문제가 많았으면 좋았을텐데..약간 아쉽네요...강의력이 워낙 좋으셔서강의력만 믿고갑니다...교재를 독학으로 하시겠다?이런분은 진짜 비추인것같습니다 !!솔직한 리뷰적었습니다.그리고 솔직히가격생각한다면 좀 그렇기도해요.비문학같은경우는 약간 좀ㅠ_ㅠㅋㅋ그냥 강의가 있어야빛을보는 교재라고 생각합니다.,9791165761035
2,국왕국어 좋아요.,5,5,shin203kr,2020-08-31,"병태요정님 강의 듣다 좋아서 구매했어요. 문법, 문학 2권으로 구성되어 있고요. 강의 내용이 눈에 잘 들어오게 정리가 잘 되어 있어요. 재시라 교재 안 사고 버티려다 문법 강의, 문학 강의 너무좋아서 교재로 제대로 공부해 보려고 구매했어요. 타 강사 올인원 1회독 했어도 뭔가 정리가 안 되서 문제 풀이가 안 됐었는데 병태요정님 강의 듣고 보니 문법도 문학도 틀이 잡혀가는 느낌이에요. 외계인 탈출을 위해 열심히 해보려고요.^^",9791165761035
0,좋아요,5,5,lmdjy,2020-10-03,2021 써니 행정법총론 좋아요 .  ㅎㅎㅎㅎㅎㅎㅎㅎㅎㅎㅎㅎㅎㅎㅎㅎㅎㅎㅎㅎㅎㅎㅎㅎㅎㅎㅎㅎㅎ 2021 써니 행정법총론 책 구성도 깔끔해서 보기 좋아요 . ㅎㅎㅎㅎㅎㅎㅎㅎㅎㅎㅎㅎㅎㅎㅎㅎㅎㅎㅎㅎㅎㅎㅎㅎㅎㅎㅎㅎㅎㅎㅎㅎㅎㅎㅎ 2021 써니 행정법총론 책 배송도 빨라서 좋아요 . ㅎㅎㅎㅎㅎㅎㅎㅎㅎㅎㅎㅎㅎㅎㅎㅎㅎㅎㅎㅎㅎㅎㅎㅎㅎㅎㅎㅎㅎㅎ,9791160182354
1,책,5,5,pp0036,2020-09-27,법과목이다 보니 낯설수밖에 없고 걱정도 많았었는데 써니쌤의 강의는 쉽고 이해하기가 쉬워서 너무 좋습니다 교재도 확실히 2020년 교재보다 더 알차고 좋네요 가독성도 좋고 내용도 깔끔합니다 써니 행정법 교재는 단원을 배우고 단원마다 배치되어 있는 ox문제로 바로바로 확인이 가능하다는게 가장 큰 장점인거 같아요 이게 복습할때도 굉장히 편합니다 열공할게요!!,9791160182354
2,의심하지마시고 구매하시면됩니닷,5,5,핍티센트,2020-09-23,"솔직히 행정법한다?무조건 써니 행정법입니다.그냥 교재수준자체부터가 이미.바이블, 교과서 수준입니다.솔직히 써니행정법 사시는분들이강의들으면서 교재로 많이사실텐데.저는그런분들을 위한 리뷰를 쓰지않겠습니다.당연히 사야되는거니까.하지만 독학으로 준비하시는분들무조건 써니행정법사셔야되요그냥 책이 돈이 안아까워요...일단 두꺼운건그렇다쳐도이 안에 진짜 내용이 뺵빽히 다들어가있습니다....막말로 독학하실떄써니에있는 ox,숲그린만풀어도아무것도모르는 사람도 70점은 나올것같습니다.그정도로 책의 구성,편집,문제등이완벽하다고 보여집니다.솔직히 다른 교재들은돈주고사면 돈값못하는 교재많습니다.근데 써니행정법은 X그냥사세요일단사요ㄹㅇㅋ의심ㄴㄴ ㄹㅇ",9791160182354
3,리뷰,5,5,북냠냠,2020-09-21,2021 써니 행정법총론 리뷰입니다. 행정법이 아무래도 법과목이다보니 시작부터 낯설고 어렵게 느껴졌는데 써니쌤 강의를 차근차근 따라가다보면 어느새 지문들이 공식처럼 잘 읽히더라고요. 단원마다 있는 숲그린과 매 페이지마다 있는 ox퀴즈 덕분에 강의를 들은 뒤 혼자 복습하기도 편했습니다. 두껍지만 내용도 알차고 여러모로 활용도가 높은 책이라고 생각합니다.,9791160182354
4,행정법,5,5,해리,2020-09-14,처음엔 낯선 과목이다 보니 법 과목이 어렵고 무서웠는데 지금은 써니행정법 책 보면서 기초가 탄탄히 잡히기 시작했어요. 책도 이해하기 쉽고 중간중간 내용들을 점검 할 수 있어서 좋아요. 유명한 강사랑 책은 역시 유명한 이유가 있더군요ㅎㅎ아 그리고 책은 다른과목과 비교해서 생각보다 두껍지 않은 편이에요.  행정법 기본서로 정말 손색이 없는 최고의 책이에요. 정말 강추합니다,9791160182354
5,ㅇㅇ,4,4,shown777,2020-09-13,"가장 많은 수험생들이 보는 박준철 교수의 『써니 행정법총론』은 행정법 분야 1위의 공무원 대표 행정법이다. 『2021 써니 행정법총론』은 내용 및 구성의 질적, 양적 강화를 통해 책의 완성도와 수험 적합성을 제고시키고, 교재 활용 면에서도 학습 효과를 극대화하였다. 우선 내용 면에서는 최신 개정법령과 판례, 최신 기출문제(2020 국가직 9급 시험까지 최다 반영)를 본문은 물론 숲그린과 기출지문 OX, 필수 개념, 오답노트, 조문노트 등에 촘촘히 반영함으로써 최적의 단권화를 도모하였다.",9791160182354
6,역시 써니,5,5,godms1210,2020-09-09,책도 이해하기쉽고 배운 내용을 기출 문제 통해 복습하기 수월하도록 만들어 있어요써니쌤 수업과 함께 들으면 행정법도 할만하다고 느낌이 옵니다행법 뽀개고 합격수기 쓰러올게요!정말 책 추천할만합니다2021 준비 개정판이 2020 준비 책보다 더 구성이 알차고 효과적입니다 리뷰를 참 많이 써야하네요 기본서가 많은 내용 다 담고 잇지만 써니쌤 수업 들으며 기출 위주로 수업 내용 위주만 소화하면 고득점 충분하다고 봅니다,9791160182354
7,써니행정법,5,5,옥수수라떼,2020-09-08,"2021 써니 행정법총론, 원래 교재 있었는데 2021년 최신판 구매함.작년 책보다 훨씬 보기 좋네요. 만족합니다. 분철 신청해서 받았는데 정말 너무너무 두껍네요..분철신청은 제 마음대로 할 수 없다는게 단점이긴 하지만... 안하는 것보다는 훨씬 나아요.혼자 공부하는 것보다 강의 들으면서 공부하는게 효율적이에요. 2021써니 행정법총론 리뷰 ------------------------",9791160182354
8,2021 써니 행정법총론,5,5,모아나,2020-09-03,가독성 좋은 교재입니다. 매 페이지마다 옆에 ox 문항이 있는것과 숲그린이 이 교재의 최고 장점인 것 같아요. 공부를 하면서 복기를 몇번이고 할수있게 잘 짜여져 있어요. 선지가 있는 기출문제가 포함되지 않는것은 아쉽지만.. 지금으로도 페이지 수가 워낙 많다보니 어쩔수없나봅니다. 저는 분철을 하지않는데 분철을 하지않아도 권당 두께가 적당합니다. (1권 500페이지 2권 600페이지) 이론파트는 3권으로 나누어도 괜찮았을것같습니다.,9791160182354
9,"써니 행정법 ! 책이 진짜,, 완벽합니다",5,5,예스이십사짱,2020-09-02,"2021 사복직 공무원 준비하는 공시생입니다 써니쌤 기본서강의들으려 구입했습니다 책 진짜 완벽합니다!행정법 처음이라 진짜 걱정 많이 했는데 (책만 보면 진짜 까마득합니다 글씨 많음주의)스토리텔링으로 강의해주시니 그냥 저절로 이해되고 암기됩니다 책은 말할 것도 없이 완벽하구요ㅎㅎ 굵게 된 글자가 기본글자보다 포인트가 아주  더  커서 공부하기 좋습니다!그리고 보조문에 있는 o,x 문제도 복습하기 좋습니다!",9791160182354
10,2021 써니행정법총론,5,5,ni79oroicr,2020-08-28,"숲그린을 보면서 체계를 잡고 본문을 보며 개념을 잡고기출지문을 통해 ox문제를 풀며 복습도 할 수 있고, 암기앱으로 틈틈이 암기를 하며 시간 활용에도 도움이 될 것 같아요.책 한 번을 보면서 여러번 회독을 하는듯한 효과를 낼 수 있을 것 같은 알찬 구성으로 되어 있습니다. 중요한 부분은 파란 글씨나 굵은 글씨로 표현 하신 듯 하고 줄줄이 같은 글자로만 써내려간 책보다는 가독성도 좋은것 같아서 마음에 듭니다.",9791160182354
11,[도서] 2021 써니 행정법총론,4,4,ksahn99,2020-08-22,"2021년 대비 행정법총론 기본서로서 매우 유명한 교재입니다. 편저자인 박준철 선생님의 강의를 들으면서 학습해도 되고, 독학으로 학습해도 될 정도로 정리가 잘되어 있습니다. 단원첫부분의 숲그린은 그 단원의 뼈대를 잡아주고 본문에서 중요내용은 굵은 색처리가 되어 있어서 마무리 학습할때 빠르게 정리할 수 있습니다. 그리고 본문옆에 날개부분에는 기출지문이 있는데, 이 기출지문이 본문에 연결되어 있어서 학습후 이 내용이 어떻게 출제되는지도 알수 있어서 수험용 교재로서의 장점이 큽니다. 판례도 제목과 본문정리가 잘되어 있습니다.  교재3권에 있는 법조문은 기출표시 등이 되어 있어서 학습시간을 줄이는데도 도움이 될 것으로 생각됩니다.",9791160182354
12,써니행정법,5,5,나래또,2020-08-13,다른 강사님에서 써니해엉법으로 갈아탔습니다. 다른 과목에 비해 정말 공부가 힘들었습니다. 행정학도 이정도로 힘들지 않았습니다ㅎㅎ 정말 가아타길 잘한거 같아요 공부를 시작한지는 얼마되지 않았지만 아직은 크게 막히는 부분없이 수업을 듣고 있습니다. 교재도 깔끔하지 정리가 잘된거 같네요 개인적으로 행정은 휘발성이 강해서 간단간단하게 체크를 할 수 있는 부분이 필요하다고 생각하는데 OX문제가 그런 기능을 해주고 있어 좋았습니다. 아직 초반이지만 완강 할 수 있을거 같아요^^,9791160182354
13,행정법은 써니에요.,5,5,ㅎㅇ,2020-08-01,"처음 행정법 배웁니다. 3강까지 강의 듣고 오늘 책을 다시 살펴보는데 정말 잘 만든 책이란걸 느꼈어요. 막 받았을 때는 잘 몰랐어요. 보조단 복습하면서 숲그린으로 한 번 훑고, 열대어로 중요한 개념 체크 가능한 점이 정말 맘에 들어요. 낯선 내용과 방대한 양에 길을 잃지 않고 수험에 딱 필요한 내용에 집중할 수 있습니다. 보조단도 회독 체크가 가능해서 정말 좋아요. 잘 만들어주신 교재로 열공해서 꼭 합격하겠습니다.",9791160182354
14,좋아요,5,5,사탕수수,2020-07-31,"행정법을 새롭게 시작하게 되었는데 처음할 때는 써니쌤이 좋다고 들어서 인강 들었는데, 너무나 친절하고 자세하게 설명해주시고 반복해주셔서 생소한 법내용이 쏙쏙 이해가 되어서 선택했어요!!!  개념도 자세한데 보조단에 문제와 단원 끝날때마다 확인문제도 있어 개념이해 후 확인하기에 너무 좋은 것 같네요!!! 3편 법조문과 ox도 우용할 것 같고, 어플까지 제공되서 공부하기에 너무 좋은 교재입니다!!!! 행정법 뽀개기 파이팅!!!!",9791160182354
15,좋아요,5,5,lms568,2020-07-31,군무원 시험 준비생입니다....합격수기 봤는데 써니쌤이 많길래....저도 책 첨으로 구매해봤는데....책이 알차고 보기도 쉽게 구성되어 있네요....큰나무로 큰 줄기를 알수있고. 그 다음 자세한 공부내용이 나옵니다.... 정말 유용할 것 같아요....책 표지도 너무 예뻐서 더 맘에 들어요....또 3권은 Q&A로 잘 설명해주셔서 더 쉽게 행정법에 접근 할수 있습니다....열심히 공부하겠습니다.,9791160182354
16,써니 행정법총론,5,5,해밀,2020-07-30,"이번에 행정법을 처음 공부하게 되었는데, 초심자에겐 써니 선생님이 가장 적합하다는 소문을 듣고 이 책을 선택하게 되었습니다. 책이 오자마자 훑어보았는데, 강의에서 말씀하신 것처럼 책에 모든 내용들이 알차게 들어있는 거 같아서 너무 좋아요. 가독성도 좋구요. 맨 앞의 숲그린이나 중간중간 오엑스 문제 등 공부한 걸 적용해보는 문제들도 세심하게 들어있어서 마음에 듭니다.",9791160182354
0,리뷰,4,4,jhj123,2020-10-01,lh 필기를 준비하면서 처음엔 다른 봉모를 풀었었습니다. 하지만 성희롱과 직장 갑질 등 의 범위가 들어간다 했었는데 다른 봉투모의고사에선 그 부분을 안다뤄서 고민하던중 해커스에선 나온다해서 구입해 풀어보게 되었습니다. 문제도 비교적 깔끔하고 잘 되어있었던것 같아요. 난이도가 엄청 극상은 아니지만 적당한 수준에서 형성된것 같았습니다. 다만 지금은 시험을 보고 난 후에 쓰는 후기인데 확실히 시험은 혼자 봉모를 풀때보다 압박감이 커서 그런지 더 어렵게 느껴지고 약간 멘붕이 오는 경향이 있는것 같아요. 꾸준한 연습만이 답일 것 같습니다.,9788969651792
1,[도서] 2020 하반기 해커스 NCS LH 한국토지주택공사 봉투모의고사,5,5,kimmj824,2020-09-28,많은 봉모 중 어떤 봉모를 구입할까 하다가 해커스가 가장 보통은 된다고해서 구매했는데 이게 쉬운거였군요..^..^ 개인적으로 해커스 봉모는 처음 구매해보았는데 심화도 따로 나눠져 있고 괜찮았던 것 같습니다. 문제지 크기나 그런 것도 만족스러웠습니다. 다음에 구매하게 된다면 또 구매하지 않을까 싶네요. 가격도 만족스러웠습니다. 다 거기서 거기이기는한데.. 어떤 식으로 가격이 책정되는지 궁금하기도 하네요.,9788969651792
2,2020 하반기 해커스 NCS LH 한국토지주택공사 봉투모의고사,4,5,20사번한전신입사원,2020-09-23,"2020 하반기 해커스 NCS LH 한국토지주택공사 봉투모의고사 리뷰입니다. 원래는 그냥 휴노형 경험해볼겸 해서 샀는데 생각치도 않게 서류가 붙어서 좀 더 집중해서 풀게됐네요ㅋㅋ ncs 모의고사 3회분으로 구성되어 있는데 사무 전공 영역인 심화 ncs 문제가 따로 있어서 특이했습니다. 타 출판사꺼 먼저 풀었었는데 거기는 앞에 전공 20문항+뒤에 50문항 구성이어서 풀기 편했거든요. 근데 해커스는 심화문제 1,2,3회분을 하나로 묶고, 일반 ncs50문항을 한 회차씩 구성해둬서 문제 풀때마다 두 권을 챙겨서 풀어야해서 불편했어요. 그리고 이번 하반기부터 심화문제 30문항에 일반문제 50문항으로 문제 수가 변경됐는데 문제수는 여전히 70문항입니다. 아마 공고 뜨기 전에 인쇄해서 그런거겠죠? 내년 상반기 개정판부턴 바뀔 것 같네요. 난이도는 제가 풀었던 타기업 봉모까지 통틀어 최하입니다. 한국토지주택공사가 진행하는 사업관련 지문이 많긴 하지만 난이도가 낮아서 사업에 대해 전혀 몰라도 쉽게 답을 찾을 수 있습니다. 문제 풀면서 완전 문제오류인거는 1개 봤는데 제가 정오표를 확인하지 않아서 정오표에 올라왔는지 모르겠어요. 근데 누가봐도 답지랑 문제랑 다르고 본문 따라 풀면 답이 없는 문제라 아 이거구나 하실거예요. 이게 휴노형 특징인지는 모르겠지만 언어 수리 문제해결 이 순서로 문제가 배치되어 있으며, 가독성도 나쁘지 않다고 생각했습니다. LH준비하시는분들께 추천합니다.",9788969651792
0,추천합니다,5,5,가나다,2020-10-05,기출문제를 많이 돌려보는 것이 합격에 도움이 되었습니다. 기출문제를 많이 돌려보는 것이 합격에 도움이 되었습니다. 기출문제를 많이 돌려보는 것이 합격에 도움이 되었습니다. 기출문제를 많이 돌려보는 것이 합격에 도움이 되었습니다. 기출문제를 많이 돌려보는 것이 합격에 도움이 되었습니다. 기출문제를 많이 돌려보는 것이 합격에 도움이 되었습니다. 기출문제를 많이 돌려보는 것이 합격에 도움이 되었습니다.,9791125476757
1,기출이 답이다 소방공무원 국어 7개년 기출문제집,5,5,glfflddl,2020-09-09,시험 볼 때 기출은 기본이라 확인차원에서 최근 기출문제들을 쭉 살펴보기 위해 샀습니다. 국어가 공부하기 시작하면 끝이 없을 것 같아 이 책을 시작으로 개념을 잡아보려고 합니다.세세한 것보다 전체적인 흐름부터 알고 기출문제들을 풀다보면 어떤 걸 위주로 공부해야할지 파악이 될 것 같아요 기출문제야 어디서든 구할 수 있을테지만 괜찮은 해설이 달렸느냐가 중요해서 이 책을 골랐어요. 기출과 해설만으로 꽉 찬 책이라 맘에 듭니다. 역시 시험에선 기출이 제일 중요한 법이니까요. 문제 하나 하나당 자세한 해설이 들어있고 시원시원한 구성이라 공부하기 편할듯합니다.,9791125476757
2,추천합니다.,5,5,sbmate,2020-09-02,"2021 기출이 답이다 소방공무원 국어 7개년 기출(복원)문제집의 가장 큰 특징은 2020년 6월 20일 시행된 소방공무원 기출문제와 해설을 수록하였습니다. 유형편과 문제편, 해설편으로 구성하여 알기 쉽고 빠르게 학습할 수 있습니다. 유형편을 통해 각 영역의 기출문제 유형을 빠르게 학습할 수 있으며, 문제편을 통해 과년도부터 최신 기출문제를 풀어볼 수 있습니다. 마지막으로 해설편을 통해 핵심을 파악하고 효과적인 해설로 이해를 높일 수 있습니다. 추천합니다.",9791125476757
