,Title,ConRate,DesRate,Author,Date,Content,BookCode
1,"코로나시대 책으로 여행을 떠나다 문학을 따라, 영국의 길을 걷다",5,5,비욘드나인,2020-09-19,"여행 에세이는 아이가 7살 무렵 제주여행을 계획한 후로 오랜만이다코로나로 집콕생활하며 이 시기를 어떻게 넘기고 포스트 코로나를 맞이해야 할까란 생각을 하며 살았다 그런류의 책들을 읽으면 읽을수록 이상하게도 나는 점점 더 무기력해졌었다 자신감이 사라져갔다.그러다 남편이 아들에게 산티아고 도보여행에 대한 얘기를 꺼내는 것을 본 후 나의 눈에 들어온 것이 이 책이었다.영국의 서해에서 동해로 가는 코스트 투 코스트 여행.사실 에세이류를 그다지 좋아하지 않아서 기대를 가지진 않았다.늘 자기 계발서만 끼고 보는 스타일이라남편에게 선물할 요량으로 신청한 책이었기에..그런데 이 책은 나에게 큰 즐거움을 주었다.여행에 대한 즐거움을 다시금 느끼게 해준 책.읽으면서 행복했다.차근차근 따라가며 같이 걸었고저자의 생각을 읽을 때면 피식 웃기고 하고음식에 대한 얘기는 입이 짧은 내 모습과도 같아서공감하기도 했다역사적 증거나 유적에 대한 스토리를 좋아하는 나에게문학을 따라 걷는 저자의 스토리는 또 다른 흥미를 불러일으켰다언제 이런 여행을 할 수 있을까 아쉬움이 아닌다시 할 수 있을 때 해야겠단 기대감을 가지게 해준 고마운 책이다이 책을 읽기 전 도보여행이란?굳이 힘들게 해야 할까? 였다면지금의도보여행이란? 모험을 떠나는 것나에게 생명력을 불어넣어 주는 것으로 생각이 바뀌었다.책을 읽으면서 동행한 듯한 이 기분을 실제로 느끼고 싶다는 생각에서다.이런 초원을 끊임없이 걷는다는 건 어떤 기분일까?안개가 짙어 길을 알아보기 힘든 구간을 만난다던가지도에 나오는 길을 찾지 못해서 몇 시간을 지체하다가해가 지려고 했을 때 저자는 공포감을 느꼈다.그럼에도 불구하고 저런 초원을 끊임없이 가본다는 건내게 용기를 불어넣어 주었다.우리나라의 김소월만큼이나 유명한 윌리엄 워즈워스의 박물관을 찾은 저자는뜬금없이 또 다른 시인 바이런에 대해 언급하는데이 부분이 굉장히 충격적이었다.아이와 함께 프랑켄슈타인과 메리 셸리의 그림책 위인전을 읽었었다물론 아이가 읽는 책이니 자세한 이야기를 할 필요는 없었겠지만 불륜을 저지르고 함께 도피한 남자와자신의 사촌이 좋아하는 방탕한 바이런과 함께 저택에서 보낸 밤에프랑켄슈타인이 탄생했다는 사실은 조금 충격이었다.그냥 우아한 독서토론 모임이 아니었던 것이다이런 걸 이 책 속에서 발견하다니 새로웠다.잉글랜드 호수 중 가장 아름답다는 얼즈워터 호수를 유람선을 타고 보는 장면이다.윌리엄 워터워즈의 시 중 무지개를 떠올리며워터워즈가 이곳을 지나가며 그에게 영감을 준 건 아닐까 하고 얘기한다.My heart leaps up when I beholdA rainbow in the skySo was it when my life beganSo is it now I am a manSo be it when I shall grow old,Or let me die!The Child is father of the ManAnd I could wish my days to beBound each to each by natural piety.하늘에 드리운 무지개를 볼 때면내 가슴은 뛴다내 생명이 시작될 때도 그랬고현재도 그렇고내가 나이 들어 늙어서도 그럴 것이다.그렇지 않으면 내가 죽으리아이는 어른의 아버지이어 자연에 대한 경외심으로 내 생애나날이 이어지기를 바란다.마지막으로 여행의 묘미가 나타나는 대목이 아닐까 싶어 시도 함께 가져왔다.문학의 탄생은 저자의 삶을 떼놓을 수 없음을그 삶을 따라가며 느끼는 문학이라이 책이 남기고자 하는 건 이런 게 아닐까 한다.",9791166030352
2,문학을 따라 영국의 길을 걷다,5,5,forever19,2020-09-19,"문학을 따라,영국의 길을 걷다/김병두 지음아름다운 풍경, 낭만적인 문학, 그리고 사람을 만나는북 잉글랜드 횡단 도보여행 일기CTC(Coast to Coast) 웨일라이트길을 걷다위즈워스를 거쳐 브론태를 만나는 목가적인 여정북 잉글랜드 횡단 보도여행기8월 8일 집을 출발하여 19일간의 도보여행 후9월3일 집에 도착할 때 까지의 여행기를 담은 도서이다.걷기 전 이틀간은 비행기, 기차로도보여행 출발지 세인트 비스를 찾아가는 여정으로 간단하지 않은 경험을걷기 끝나고 난 후의 일정은 하워스 브론테 자매 박물관과 요크 방문 일정의의미를 부여하고 있다.그 후 8월31일 부터는 단순한 귀국일정으로'여행을 마치며' 소감을 전하고 있다.1일차~6일차7일차~12일차13일차~18일차1



19일차도보 여행 기간 손글씨로 일기를 쓴 기록에는날짜와 시간이 맞춰진 카메라와 캠코더로 기록을 위한 사진과 동영상을 찍고,CTC길을 걷고자 하는 독자들에게 도움을 주고자여행안내서 같은 도서를 출간하게 되었다고 합니다.책을 마주하는 순간 기분이 up 된다.신사의 나라 영국몇 해전 2주간의 영국일주를 추억하는 마음과 함께코로나19로 인해 여행에 대한 그림움을 도서 안의 스케줄 대로 함께 움직이는 듯한 살아있는 감정선으로 읽고 있는 자신을 발견하게 된다.글을 읽다보면저자 김병두님의 깔끔하고 온화한 성품이 느껴진다.외유내강하고 젠틀한 느낌,고결하고 자신에게 완벽 완고한 치밀하면서 섬세함이 느껴진다.그러나 책을 읽는 동안 너무나 편안하고안내해주는 듯한 글을 따라가다 보면영국 속의 어딘가를 함께 걷고 있는 듯한 생동감이 넘치고문학도 함께 할 수 있어너무나 흥미있게 읽게 된다.화려한 문구 없이 진솔한 글에서 진정성이 느껴지고인간에 대한 존중과 배려, 사랑이 느껴지는 책이다.일기에 날짜와 날씨, 제목과 도보수치, 경비도 체크할 수 있게도보여행을 통해 상황과 만남 속에서 경험치를 담아실수마저도 세세하게 알려주고 있어영국의 CTC 도보여행길에 너무나 도움이 되리라는 믿음과확신이 든다.연청보라빛 책표지 마저도 설레이게 하는'문학을 따라, 영국의 길을 건다'추천합니다!!",9791166030352
3,문학을따라 영국의길을걷다,5,5,lyusj1021,2020-09-14,"문학을 따라, 영국의 길을 걷다김병두 지음이담북스아름다운 풍경, 낭만적인 문학, 그리고 사람을 만나는 북 잉글랜드 횡단 도보여행 일기!영국 하면 정말 멋지고 아름다운 나라로!정말 꼭 가보고 싶은 나라인데요!사실 영국하면 해리포터, 버킹엄궁전 등 관광명소가 생각났는데 이 책은 영국의 도보여행을 알려주는 책이였습니다.순례길하면 산티아고가 가장 먼저 생각나는데!작가님 역시 산티아고를 끝내고 걷는 즐거움을 잊지 못해 영국으로 걷는 여행을 떠나셨다고 해요.공원, 호수, 황야를 거치며 만나는 아름다운 풍경영문학의 자취를 더듬으며 걸어가는 문학의 길그리고 그곳에서 만난 잊을 수 없는 사람들까지.여행이라는게 다양한 것을 보고 느끼는 것도 즐겁지만그 만큼 그 나라의 사람들을 만나고 그 나라의 문화를 알게 되는 것도 여행의 또 다른 즐거움이라고 생각하는데요, 저 역시 정말 다양한 여행자들을 만나고 싶어 항상 외국 여행을 가면게스트하우스로 잡아 다양한 나라의 사람들을 만나고 함께 즐거운 시간을 보내는 것이행복했었습니다,19일간의 걷기! 걸으면서 손글씨 일기를 쓰시며 다양하게 사진과 영상까지 기록을 하신 책이라고 해요.그래서 정말 여행 안내서 처럼 여행의 정보도 상세히 적혀 있습니다.19일의 여행!매일매일의 글이 나옵니다.다양한 사람들을 만나며 대화내용부터유명 명소에 대한 설명, 그리고 작가님의 마음까지!그래서 정말 재미있게 읽을 수 있는 책인 것 같아요!특히 저처럼 영국 여행을 꼭 가고 싶어하는 사람들은 더욱 재미있게 다양한 정보를 얻으며 읽을 수 있습니다.일기는 날짜와 날씨, 제목!그리고 몇키로를 걸으셨는지,,,마지막에는 하루 경비까지 아주 자세히 적혀 있습니다,1일차를 보면 19km 아무리 걸으면서 즐거운 여행이라지만 엄청난 거리를 걸으시더라구요ㅠ.ㅠ저는 아직 걷는 여행의 즐거움을 찾지 못했지만^^;;저도 나이가 들고 하면 걷는 즐거움을 알게 되지 않을까 싶네요.영국은 항상 비가 자주 온다고 해요.저는 보통 여행을 겨울에 가는데영국은 겨울에 해도 짧고 비가 와서 안좋다는 이야기를 많이 들었는데요.바다 사진만 보아도 약간 흐림 느낌이네요.그래두 푸른 바다와 초록 들판이 보이니 보기가 좋네요.아래쪽 사진은 벽돌과 콘크리트로 된 옛 해안경비초소라고 해요.초소에 철판이 세개 있는데 세개의 철판에 각각 다른 내용이 설명되어 있다고 해요.정면은 만섬과 세 곳의 명칭, 설명오른쪽은 북쪽에 대한 왼쪽에는 남쪽과 동쪽의 레이크 디스트릭트 국립공원 방향의 전망을 표시해두었다고 해요.경비초소는 정말 옛날에 적을 보기 위해 둔거니 모든게 한눈에 보일테니지금 전망대처럼 사용하면 정말 좋을 것 같네요^^왼쪽은 요크섬!그냥 에세이처럼 작가님의 여행하면서의 생각과 느낌을 적어둔 것을 읽는것도 재미있지만오늘 무슨일이 있었고 어디에서 어떤 상황이 있었는지사진이 무엇인지 자세한 설명이 있으니제가 영국에 간다면 정말 큰 도움이 될 것 같습니다.",9791166030352
4,"[문학을 따라, 영국의 길을 걷다] 아름다운 풍경, 낭만적인 문학이 있는 북잉글랜드여행에세이",5,5,도깨비,2020-09-06,"코로나19는 우리의 일상을 바꿔놓았다. 마스크 생활화, 사회적 거리두기, 손씻기 등 개인 위주의 일상으로 바꾸어놓은 듯하다. 그러나 진짜 변화하고 있는 것은 우리 의식의 변화인 것 같다. 어쩔 수 없이 끌려가는 듯한 느낌에 유쾌하진 않지만 이미 물살에 휩쓸려가고 있다는 생각은 든다. 분명 경제적 타격을 입었고, 다가올 타격은 해방 이후 한 번도 경험해보지 못한 마이너스 성장이 예상되고 있다. 정부도, 국민도 사력을 다해 살아내고 있지만 세계적 경제 불황은 당분간 계속될 듯하다. '집콕' 시간이 많아져 TV를 보면 온통 코로나 얘기뿐이다. 그럴 수밖에 없을 터, 혹시 좋은 소식은 없을까 해서 뉴스가 끝날 때까지 기분 좋거나 유쾌한 소식은 없다. 간혹 들리는 의료진의 필사적인 노력과 응원의 메시지도 집단 휴업의 뉴스 속에 묻히고, 남은 의료진의 엄청난 분투도 코로나 집단 발생과 진단마저 거부하는 사람들의 소식에 빛을 잃는다.아무래도 책밖에 없다. 국경 봉쇄 상태에서 해외 여행은 계획도 못 잡고 국내 여행마저 될수록 자제를 당부하는 상황에서 '상상 여행'이 최고다싶다. 꼭 읽고 싶은 책이라고 책상 위에 놓아둔 『문학을 따라, 영국의 길을 걷다』를 집어든다.표지보다 안에 있는 사진들이 더 시원하고 좋은 풍경이 많다. 마음이 한결 가벼워진다. 그러나 관광자료로 만든 책이 아니다. 걷기운동, 문학, 풍경, 역사를 더듬는 '낭만적 걷기'를 위한 책이다. 그래서 더욱 의미가 있다. 그런 의미로 걷기를 한다면 깊은 사색이 있을 것이고, 그 사유는 우리 삶을 더욱 윤택하고 아름답게 가꾸어줄 요인이 되기 때문이다.대학 시절 영문학을 전공한 저자는 워즈워스의 수선화와 무지개를 호수 지구에서 만나고, 헤더꽃으로 뒤덮인 광활한 황야지대에서는 샬럿 브론테의 황야를 노래하는 시와 에밀리 브론테의 『폭풍의 언덕』을 마주한다.이처럼 저자의 여정을 따라, 코스트 투 코스트(CTC) 웨인라이트길을 영문학을 따라 거닐어보자. 문학을 따라 걷는 영국의 길은 상상 속으로만 그려보았던 유명 시와 노래, 그리고 아름다운 풍경을 함께 즐길 수 있다는 일석이조의 경험을 선사한다. 저자의 발길을 따라 걷는 이번 낭만 여행은 대략 세 가지 관점에서 보면 독서의 의미도, 보람도 챙길 수 있을 것 같다. 첫째, 웨인라이트길의 큰 매력 중 하나는 세 개의 국립공원을 거쳐 걸어가는 길이라는 점이다. 레이크 디스트릭트 국립공원(Lake District National Park), 요크셔 데일스 국립공원(Yorkshire Dales National Park), 그리고 노스 요크 무어스 국립공원(North York Moors National Park)을 차례로 지난다. 이 길의 총 거리의 2/3가 바로 이와 같은 공원지대에 속한다. 뿐만 아니라 호수 지구인 레이크 디스트릭트와 광활한 황야지대인 노스 요크 무어스는 도보 여행자라면 상상 속을 걷는 경험을 선사하는 이 길에 금방 매료될 것이다. 둘째, 이 길은 또한 영문학의 자취를 따라 걸을 수 있는 ‘문학의 길’이기도 하다. 길을 따라 걷다보면 워즈워스부터 브론테까지 우리에게 익숙한 영문학의 작가들을 떠올리며, 문학의 아름다움과 함께 목가적인 풍경에 자연스레 젖어들 수 있다. 대학 시절 영문학을 전공한 저자는 워즈워스의 수선화와 무지개를 호수 지구에서 만나고, 헤더꽃으로 뒤덮인 광활한 황야지대에서는 샬럿 브론테의 황야를 노래하는 시와 에밀리 브론테의 《폭풍의 언덕》을 마주한다.셋째, 영국 서해(아일랜드해)에서 시작해 동해(북해)에서 끝나는 뚜렷함이 있는 이 길은 시작과 끝이 분명한 것을 좋아하는 한국인에게 안성맞춤인 길이다. 보다 분명한 목표를 세워 특별한 도보여행을 계획하고 있다면, 이 길을 따라 여행하는 영국 도보 횡단길이 하나의 답이 될 것이다. 이후 그곳을 나와 바로 옆에 있는 워즈워스 수선화 정원(Wordsworth Daffodil Garden)에 들어갔다. 그라스미어는 시인 워즈워스의 마을이라고 할 만큼 그에 관한 장소가 많다. 이곳도 그중 하나다. 2003년에 개장했고, 그라스미어 교구 목사의 아이디어로 교회 유지보수를 위한 기금을 마련하기 위하여 조성한 공원이다. 일정한 금액을 내어 공원에 야생 수선화를 심어 가꾸는 일에 후원을 하면 원하는 이름을 새긴 석판을 공원길 바닥에 깔아주고, 교회에서 발행한 책자에 이름을 올려주는 등의 혜택을 줬다고 한다. 이 사업은 성공적이었고, 그 결과로 이름이 새겨진 약 3000개의 석판이 깔렸다. 그리고 셀 수 없는 수의 야생 수선화가 지금도 자라고 있다. 주변의 야생 수선화와 발밑에 놓여있는 출신지와 함께 쓰인 이름을 살펴보며 가끔 나타나는 워즈워스의 시 수선화의 구절을 음미하며 걸어보았다. 이는 그라스미어에서만이 누릴 수 있는 격조 있는 문학 체험일 것이다.(p. 90) 날씨는 점점 나빠지고 비가 오다 말다를 반복했다. 출발하고 조금 지나자 스피커로 관광안내를 하는데 역시 예외 없이 시인 워즈워스, 얼즈워터 호수, 시 수선화와의 관계를 말해 주었다. 10시 10분을 지나서 관광객들은 환성을 질렀다. 호수위로 선명한 무지개가 피어올랐기 때문이다. 시인 워즈워스 고장다웠다. 그의 시에 무지개가 있지 않는가? 정말 아름다운 정경이었다.(p. 116)다시 몇 분을 완만하게 더 걸어 오르면 헤더꽃이 우리를 기다리는 전형적인 북부 잉글랜드 요크셔 황야지대에 들어서게 된다. 길은 넓지 않지만 석판이 깔려있고 사방팔방이 헤더꽃으로 장관이다. 우리가 보기에는 드넓은 황야가 연이어 전개되지만 어느 곳을 경계로 이름지어 구분되는 모양이다. 처음 만나는 황야는 라이브 무어(Live Moor) 황야다.(p. 224) 저자는 걷기만이 아닌 여행 도중 관광을 한 후 그 후기도 같이 남겼는데, 특히 영국작가들의 시를 옮겨 담으며 그때의 설렘과 느낌을 같이 공유할 수 있도록 해준다. 위즈워스 박물관에서의 여행담을 길게 남긴 것도 독자와의 소통을 염두해 두었기 때문으로 읽힌다. 그리고 이런 여행담으로 인해 나중 영국 여행을 할때에 더욱 깊은 감동을 받을 장치를 마련해 둔 것이라 생각한다. 무지개를 보고 그때의 위즈워스를 생각하는 저자는 멋진 감성 여행작가임에 틀림없다. 길을 걸으며 만난 안내판은 우리나라와 달리 자연을 정말 잘 관리한다는 생각이 든다.  걷는 중간 만난 사람들과는 같이 걷다가 또 헤어졌다가 다시 만나기도 하고, 대학생들과의 만남은 좀더 젊어지는 느낌을 만들어내며, 그들과 함께 걷는 내내 행복감을 느낀 것 같다. 저자의 글이 약간의 즐거움과 행복감이 묻어난다. 독자도 유럽 여행을 한 적이 있는데 일정에 쫒겨 이 여행처럼 사람, 일상을 만나는 것은 꿈도 못 꾸고 관광만 하고 온 것 같아 아쉽다. 브렌스데일 황야를 소개하는 글은 더욱 영국의 문화를 느끼게 해주어 여행 묘미를 톡톡히 느끼게 해준다. 드라큘라의 배경이 된 이스크 클리프 절벽은 실감날 정도로 잘 표현해 놓았다. 그래서 더욱 인상 깊다.여행의 끝이 다가올수록 처음 시작할 때의 설렘이 시작되는 것은 독자도 걷기 여행을 잡아 이 길을 '순례길'처럼 돌아볼까 하는 기대감에서다. 코로나가 종식되고 세상이 예전처럼 돌아간다면 꼭 한 번 가고 싶은 곳을 소개받은 것 같아 마음이 충만해진다. 저자 : 김병두고려대학교 영어영문학과 졸업 후 건설, 반도체 관련 대기업에서 30년을 근무한 후 정년퇴직했다. 현직 때는 해외근무와 출장으로 일찍이 여러 나라를 여행했고, 퇴직한 이후에도 계속 다양한 나라를 여행하며 방문한 나라의 여행기를 글과 영상으로 기록하고 있다. 중남미 등 여러 나라를 여행한 이후 동영상과 자료로 KBS TV <세상은 넓다>에 다수 출연했다. 스페인 산티아고 순례길을 완주한 이후 영국 코스트 투 코스트(CTC) 웨인라이트길을 걸었다. 건강이 허락될 때까지 앞으로도 여행을 계속할 계획이며 사진과 동영상, 그리고 글로 여행을 기록 및 정리하며 보관할 예정이다.신동아 논픽션 공모에 우수작으로 당선 했으며(1999), 출간된 저서로 <산티아고에서 세상과 소통하다>(2016), <역사로 세우고 전설로 채색한 영국 고성 이야기>(2017)가 있다. <출판사로부터 도서를 제공받아 작성된 리뷰입니다.>",9791166030352
5,더 자세할 수 없는 북 잉글랜드 횡단 도보여행 일기,5,5,현준맘,2020-09-03,"대기업에서 30년을 근무한 후 정년퇴직 하고, 여전히 세상 곳곳을 누비는 여행작가님의 [문학을 따라, 영국의 길을 걷다]를 읽었습니다. St Bees에서 출발해 Robin Hood's Bay 까지 북 잉글랜드를 횡단하는 여행길은 사진으로 보는 것 만으로도 여유롭고 아름다웠습니다. 더욱이 그 길위에 문학작품의 배경이, 작가들의 삶이 걸쳐져 있으니 조심조심 걷는 모습이 상상이 되곤 했습니다.어떤 여행에세이를 읽는다해도 이처럼 자세할 수는 없을 것 같습니다. 길에서 만난 특이한 대문들에 대해서까지 설명하시는데 몇년전 영국을 일주했지만 전혀 보지 못했던 '디딤대문'이나  목초지를 가로지르는 경계석들이 옛 기억속에 진짜 있는것 처럼 느껴졌습니다. 때론 사진으로 확인하고, 글로도 표현한 상세함에 놀라울 따름입니다. 시간과 숙소와 비용에 이르기까지 상세하고 자세한 이야기에 푹 빠지다보면 작가님의 열정에 '노인'이라는 생각을 전혀 못하고 있다가 가끔 고생길에 힘들어 하시는 뉘앙스글을 읽고는 아, 그렇지....정말 대단하시구나...하며 혼자말을 하고 있습니다.'문학을 따라' 가는 영국의 길에서 만난 '조너선 스위프트', 영문학 최초의 서사시 [베어울프]속의 '브레카', 시인 워즈워스, 메리 올스톤 크래프트 고드윈의 [프랑켄슈타인], 존 읠리엄 폴리도리의 [뱀파이어(흡혈귀)], [폭풍의 언덕]과 브론테 자매의 이야기들 속에 순간순간 마주치는 운명의 삶이 존재 했듯이 영국의 길에서도 인연을 만나고 친구를 사귀고 아는 것을 나누는 멋진 여행 에세이에 감동을 받았습니다. 이 코스 그대로 정말 도전해보고 싶습니다. 겉모습만 후루룩 보고 오는 그런 여행이 아닌 진정한 도보 여행을 꼭 해보고 싶습니다. 멋진 사진과 문학작품의 여정을 따라 행복한 시간을 보낼 수 있어 덕분에 힘든 현실을 벗어날 수 있었습니다. *출판사로부터 책을 무상으로 제공받아 작성한 개인적 리뷰 입니다.#문학을따라영국의길을걷다 #김병두 #이담북스 #여행에세이 #영국도보여행일기 #북잉글랜드 #CTC #코스트_투_코스트길",9791166030352
