,Title,ConRate,DesRate,Author,Date,Content,BookCode
0,대한민국 자전거길 가이드 - 자전거여행의 모든 것,5,5,인디캣,2020-10-06,"아름다운 자전거길 49코스를 소개하는 <대한민국 자전거길 가이드>. 계절의 흐름을 만끽하며 바람을 맞으며 달리는 기분은 상상만 해도 즐겁습니다. 설렘 가득한 자전거여행이 되도록 도와주는 이 책과 함께 전국 곳곳을 누벼보세요.20년 전 단돈 2만 원짜리 중고 자전거로 무작정 달린 그 희열을 잊을 수 없어 여전히 여행 필수품이 되었다는 자전거. 캠핑을 갈 때도 자전거는 빼놓지 않는다는 자전거여행 전문가 이준휘 저자가 전국을 돌아다니며 자전거 타기 좋은 코스를 소개합니다. 물길, 산길, 비경길 등 여행 스타일과 라이더 수준에 맞춰 다양한 코스를 골라보는 재미가 있어요.자전거여행의 고수라면 다 알만한 내용이겠지만 초보 라이더가 불편함 없이 자전거여행을 시작할 수 있게 도와줍니다. 아름다운 자전거 전용도로 외 일반도로도 코스에 포함된 경우가 많아 안전하게 주행하려면 미리 알아둬야 할 것들이 있더라고요. 주행 시 꼭 갖춰야 할 기본 안전장비와 자전거 여행 기간에 맞는 짐 꾸리기 기술까지 <대한민국 자전거길 가이드> 한 권이면 든든해집니다.자전거여행의 꽃은 동해안 종주! 서울에서 부산까지 이어진 동해안 종주 자전거여행은 중급자를 기준으로 일정 및 준비사항을 알려주고 있습니다. 한 번에 쭉 타야만 한다는 부담감은 내려놓고, 주말만 이용해 코스 끊어 타기 방법도 있다니 일정에 맞게 여유롭게 라이딩을 즐길 수 있겠어요.<대한민국 자전거길 가이드>는 호수, 바다, 섬에서 즐기는 코스와 산과 숲을 달리는 코스, 도심을 포함해 명소를 따라 즐기는 코스로 구분해 소개합니다. 계절 맞춤 베스트 라이딩 코스도 따로 정리되어 있어 선택에 도움을 줍니다.자전거여행 전문가가 분석한 코스 정보는 탁월해요. 코스 길이, 상승고도, 최대경사도, 칼로리 소모량 등을 꼼꼼히 체크하고 소요시간과 전반적인 코스 상태를 기록, 분석한 정보는 알짜배기입니다. 무엇보다 길이 헷갈리는 지점을 세세하게 표시한 부분은 놀라웠어요. 베스트 뷰 포인트도 짚어주고 있어 완전 사랑스런 책입니다. 자전거여행을 하면서 그 지역에서만 맛볼 수 있는 별미 음식과 맛집, 숙박 정보도 있어 일정 내내 즐거운 여행이 되도록 도와줍니다.우리나라의 아름다운 자연 경관을 오롯이 느낄 수 있는 자전거여행. 자전거라면 동네 산책 수준으로만 타는 저는 로망을 안고 랜선 여행하는 기분으로 한 장 한 장 넘겼는데, 어쩜 이렇게 멋진 곳이 즐비하는지. 보는 내내 뇌가 맑아지는 기분이었답니다. 자연을 즐기는 건강한 여행을 하고 싶다면 <대한민국 자전거길 가이드>로 준비하세요.",9788927811510
1,대한민국 자전거길 가이드,5,5,jsasarang,2020-10-05,"물따라 산따라 자전거로 즐기는 생애 가장 건강한 휴가라는 부제가 참 어울리는 책인 것 같아요. 책을 보고 있으면 자전거타고 여행을 떠나보고 싶게 만드는 책이었어요..이 책이 좋은 점은 단순히 자전거길을 소개하는데 그치는 것이 아니라는 거예요. 바닷길부터 도심길까지 라이더의 로망을 자극하는 자전거길 49코스를 소개하면서 코스별 소요시간, 난이도, 고도표, 교통정보도 함께 수록하고 있다는 게 좋더라구요. 게다가 자전거 초심자에 맞춰서 자전거여행을 쉽게 계획하고 실천에 옮길 수 있게 도와주는 정보들이 있어서 좋은 것 같아요. 또 자전거여행에 재미을 더해 줄 맛집, 숙박 정보도 제공한다고 해요.이 책은 베테랑 자전거 여행가인 저자가 직접 라이딩을 해보고 풍경을 즐기기 가장 좋은 코스를 골라 호수길, 바닷길, 섬길, 바람길, 산길, 숲길, 비경길, 도심길 등 8가지 테마로 분류해서 소개하고 있어요. 그래서 그런가 책에 실려있는 사진을 보고 있으면 그 경치를 보기 위해 자전거여행을 떠나고 싶더라구요.이 책의 앞부분에는 자전거여행 BEST OF BEST를 실어뒀는데 꽃비 내리는 봄철 라이딩 코스 BEST 5, 신록이 짙어지는 여름철 라이딩 코스 BEST 5, 깊어가는 가을 라이딩 코스 BEST 5, 업힐의 수고로움은 눈 녹듯 사라지는 전망 좋은 라이딩 코스 BEST 5, 도시여행과 라이딩을 한 번에 공영자전거 라이딩 코스 BEST 5, 자연에서의 하룻밤 휴식 휴양림 라이딩 코스 BEST 5 등에 대해 소개하고 있어서 자기가 원하는 코스를 선택하는데 도움이 될 것 같아요.또한 자전거 여행과 베스트 먹거리에 대한 소개도 하고 있는데 국수 로드와 별미 로드를 소개하면서 여러가지 음식들을 소개해주고 있으니 식도락여행을 하는데도 도움이 될 것 같아요.그리고 난이도별 추천 코스에 대한 설명도 있어서 초급자, 중급자, 상급자가 자신의 라이딩실력에 맞게 코스를 선택할 수 있어서 좋을 것 같아요.한눈에 보는 우리나라 아름다운 자전거길을 보니..우리나라에 자전거로 여행을 즐길 수 있는 코스가 정말 많네요.. 이 코스 하나하나 가보고 싶다는 생각이 들어요.이 책에서 소개하고 있는 자전거길 가운데 제가 가본 곳은 딱 한곳이더라구요. 경주 도심 순환코스..사실 벚꽃 필 때는 사람이 너무 많아서 자전거 타고 가본 적이 없지만 벚꽃 필 때가 아니라도 자전거도로가 잘 되어 있어서 자전거 타고 문화유적을 살펴보기 참 좋은 곳이거든요.지금은 코로나때문에 여행을 떠나기 어려운 시기지만 이렇게 사진으로나마 여행을 떠날 수 있어서 좋았네요. 언젠가 기회가 된다면 정말 이 책에 등장한 자전거길을 따라 여행해보고 싶기도 해요. 그 땐 이 책 한권만 들고 떠나도 좋을 것 같아요..ㅎ",9788927811510
2,"[대한민국 자전거길 가이드], 이준휘",3,3,whyii,2020-10-04,"YES24 리뷰어클럽 서평단 자격으로 작성한 리뷰입니다.  자전거 타는 것을 좋아한다. 잘 하진 못해도 운동하는 걸 좋아해서 그럴지도 모르겠다. 서울에 살 때는 할 일 없을 때면 
자전거를 타고 한강을 달렸다. 집이 동덕여대 근처니까, 내부순환로 밑 개천의 자전거도로를 이용해 청계천까지 간다. 청계천의 
자전거도로를 이용해 한양대 즈음을 지나면 중랑천을 만나고 이내 한강 자전거길을 만날 수 있다. 그렇게 천호 대교를 지나서 까지 
갔다가 돌아 오기도 하고, 여의도나 월드컵 경기장까지 다녀오기도 했었다. 주로 여의도까지 자주 다녀였는데, 나이키 10Km 달리기
 대회날은 자전거로 여의도까지 갔다가 10Km를 달리고 다시 자전거를 타고 집에 온 적도 있었다. 다음날 좀 무리했다는 느낌을 온
 몸을 통해 받았지만 말이다.



  직장까지도 자전거로 출퇴근을 하는 날이 많았었다. 회사에 체력단련장과 샤워장이 있었다. 집에서 조금 일찍 일어나는 날은 
자전거를 타고 회사에 가서 런닝머신을 뛰고 샤워를 하고 출근을 했었다. 재밌으면서도 하루의 시작이 기쁜 날들이었다. 지금은 그렇게
 하지 못한다. 저렇게 내가 체력이 좋았던가 싶을만큼, 이제는 몸이 따라가지 못할것 같다.



  지금은 자전거를 타고 있지 않은 이유가, 서울이라는 지역을 벗어났기 때문만은 아니다. 결혼을 하고 아이들이 생기고, 
자전거를 탈 일이 많이 없어졌기 때문이다. 저전거도 없다. 조카에게 주었는데, 잘 타고 있는지 모르겠다. 결혼과 육아는 삶에 많은
 변화를 주곤 한다.



  첫째 아이가 자전거를 탈 나이가 되었나 보다. 올 해 생일 선물로 자전거를 선물했다. 겁이 많은 아이인데, 처음 타음 
날부터 제법 잘 타는 모습에 뿌듯했다. 2~3번째는 좀 답답함을 주긴 했으나, 요즘은 옆에서 내가 뛰어다녀야만 할 정도가 되었다.
 아빠를 운동시켜 주겠다며, 제법 속도도 내곤 한다. 그러던 차에 이 책의 서평단 모집을 보게 되었다. 조심스레 아이와의 자전거 
여행을 꿈꾸면서 신청해 보았다.



  참 좋은 실용서적이다. 자전거의 종류나 안전장비에 대한 설명부터 자전거여행의 정보를 구하는 방법까지, 세심하고 디테일하게
 설명이 되어있다. 특히 자전거여행 코스별로 가이드가 거의 완벽하게 잘 되어 있어서, 나처럼 여행을 준비하는 초보들에게는 많은 
도움을 줄 것 같았다. 특히, 물길, 산길, 명소로 구분된 자전거 여행 코스와 난이도 및 소요 시간, 주변 식당들까지 꼼꼼하게 
챙기는 글들은 정말 많이 다녀보고 기록해 본 경험들이 녹아 있었다.



  다만, 아쉽웠던 점은 여행지 까지의 이동에 대한 설명이 다소 부족한 느낌이다. 자차는 모르겠으나, 대중교통을 이용할 때는
 어떻게 해야 좋은지, 특히, 전철은 주말만 자전거를 이용할 수 있는데, 주말이 아닌 경우, 버스로 이동할 때는 자전거를 어떻게 
버스에 실으면 좋은지 등등에 대한 이동정보가 추가되면 좋을 것 같았다. 또한, 코스별로 여행지와 코스에 대한 정보는 상세한데, 
저자의 느낌이 빠져 있어 다소 건조하게 보인다. 이런한 건조함이 다른 코스임에도 같은 포맷으로 인한 지루함을 수반하는 것 같아 
아쉬웠다.



  그래도, 좋았던 점이 꿈이 생겼다는 것이다. 저자의 삶과 가족들의 모습 속에서 부러움을 느끼면서, 한켠으로는 꿈을 꿀 수
 있었다. 이젠 만 4살이 지난 아이지만, 조금 더 커서 아빠와 함께 라이딩을 하는 모습을 머릿속으로 그려보면서 말이다. 그때는 이
 책이 더 좋은 가이드북으로 애독될 것이라 생각된다. 얼마 남지 않았다.",9788927811510
3,자전거 타고 물따라 산따라 길 떠나기,5,5,캡,2020-10-04,"자전거를 타고 물따라 산따라 길 떠나기 어릴 때 새 자전거를 타는 것이 소원이었습니다. 비싸다는 이유로 중고 자전거를 받고서는 그래도 좋다고 동네 여기저기 타고 다니던 기억이 납니다. 모처럼 산 새 자전거는 어느날 밤 어느 놈이 훔쳐가버려서 아쉬웠던 기억도 있지요. 이처럼 자전거는 누군가에는 좋은 교통수단이자, 추억입니다. 요근래 코로나 때문에 제대로 운동 못하는 분들이 자전거로 옮겨온 것인지, 자전거를 타는 분들이 더욱 눈에 많이 보입니다. 주말 한강에 나가면 자전거에 치일 지경이지요. 이런 때 한강보다는 전국 곳곳 다른 곳을 찾아가보픈 생각이 듭니다.    이번에 글쓴이의 <대한민국 자전거길 가이드>책이 새로 나왔습니다. 전국에 있는 자전거길을 따라가고 싶은 사람들이 보면 좋을 법한 책입니다. 이전에 펴냈던 책을 제목을 달리해서 새로 내용을 덧붙여서 펴냈는데 중앙북스의 ""대한민국 가이드""시리즈 4권이 휴양림까지 나오면 완성이되네요. 이번책도 가이드 시리즈 책에 맞게 고전적인 여행서의 형식을 충실히 따라서 상세한 정보를 담고 있습니다.   [아름드리 소나무가 반겨주는 계곡에 들어서다, 삼막사 업힐코스(삼성산,삼막천)]에 나오는 큰 바위가 보이는 길입니다. 업힐 코스가 무엇인지도 모르고, 그냥 제가 갈 수 있는 곳 중에서 가장 가까운 안양천 타는 길에 있기에 가보았는데 결국 자전거 타고 끝까지 가지는 못했습니다. 날이 어두워지는 데도 꽤 많은 분들이 자전거를 타고 오르고 또 내려오시더군요. 업힐 코스로 또는 숲길 코스로 유명한 곳인 모양입니다. 206p의 고도표를 보면 400m쯤 되는데 초보자는 오르지 않는 것이 좋을 듯 합니다. 저는 전기자전거로 갔는데도 힘들고 무엇보다 배터리 떨어질 것이 걱정되어서 중간에서 그만두었습니다. 내려올 때도 경사가 있어서 숙련된 분들만 하는 것이 좋겠네요. 어쨌든 오랜만에 수도권 인근 산길을 올라가서 좋았습니다. 안양천을 따라가면 되어서 접근성이 좋습니다.    중간에 이정표 있는 곳에 자전거를 두고 거기서부터는 걸어서 올라갔습니다. 업힐은 함부로 도전하는 것이 아닌 듯 싶더군요. 자전거를 타고 힘들게 올라가시는 분들을 종종 보았는데, 그런 점에 재미를 느끼는 분들은 도전해보시는 것도 좋지만, 무엇보다 안전에 유의해야겠지요.   [생명의 정원으로 떠나는 자전거여행, 순천순환코스(동천 자전거길, 순천만 국가정원, 순천만 자연생태공원)]코스에 나오는 사진입니다. 사진에는 번호를 붙이고 간단한 설명을 붙여서 찾기 좋게 해두었습니다. ""순천의 자전거 길은 아주 쉽다, 오르막 한 곳 나오지 않는다""는 말처럼 평이한 코스로 보이는데 수도권에 있는 분들은 멀리 있어서 가기 어려운 것이 문제일 듯 합니다. 여기에 무인대여소를 안내해줍니다. 순천만생태공원과 국가정원은 자전거 출입이 금지되어 있어서 순천에서는 편한 신발과 평페달이 어울린다는 말도 곁들입니다. 직접 가본 사람의 친절한 설명이 있어서 좋습니다. 사진만 봐도 마음이 편해지는 코스네요.   [영천에 숨겨진 보석 같은 코스, 호수길은 초보자에게 부담 없고, 천문대 업힐과 연계하면 상급자도 만족할 만한 코스가 된다.]는 설명을 곁들인 [영천호 순환코스]입니다. ""말과 별의 도시, 영천 백리 벚꽃길을 달리다""라는 소제목부터 찬찬히 읽어보시길 권합니다. 글쓴이의 작명 솜씨와 함께 이 코스의 대략적인 특징을 알고 들어갈 수 있습니다. 앞에는 전체 풍경이 있고 난이도, 접근성, 소요시간을 설명한 표가 전면에 보입니다. 위의 사진처럼 지도도 충실하고 아래 고도표와 코스 주요지점간 거리 및 시간을 알려주는 표를 두어 자전거길에 충실한 안내자 역할을 하고 있습니다.      [바다와 호수 그 사잇길을 달리다, 속초 고성 종주코스]에서는 바다를 달린다는 바로 그 점이 매력적입니다. 유난히 호수도 많고 그 너머에는 바다도 보이고, 언젠가 한번은 자전거로 달려보고 싶은 매력적인 곳이지요. 멋있는 곳을 보면 당연히 힘을 충전해야겠지요. [보급 및 음식]을 통해 곳곳의 맛집을 소개하고 [즐길거리]를 통해 근처 관광지 소개도 잊지 않습니다. 이처럼 매력적인 자전거길을 크게 1.물길 따라 라이딩 : 호수길, 바닷길, 섬길2. 산길 따라 라이딩 : 바람길, 산길(산과 령, 그리고 재), 숲길3. 명소 따라 라이딩 : 비경길, 도심길으로 나누어 소개하고 있습니다. 한강변은 소개하고 있지 않은데 아마도 그곳은 널리 알려져 있고 많은 사람들이 다니면서 일반화된 곳이어서 그런 것이 아닐까 싶습니다.   사람들은 자전거 여행을 왜 떠날까요. 글쓴이는 이 책의 프롤로그에서 자신의 첫 자전거 여행에 대해서 이야기해주고 있습니다.    ""온몸이 쑤시며 꽤 힘들었지만 하루 이틀 지나니 몸에도 인이 박혔다. 경관이 좋은 곳을 발견하면 그냥 자리를 깔고 드러누웠다. 오늘은 어디까지 꼭 가야한다는 목적도 없었다. 지루해지면 자리를 뜨고 달리고 싶으면 또 달렸다. 시간이 지날수록 안인해변에서 바라봤던 동해바다의 모습과 정동진의 풍경은 뇌리에 박혀 선명하게 떠오른다."" -프롤로그 중에서- 아마도 그냥 좋아서, 경치 좋은 곳을 발견하면 구경하고, 가고 싶으면 달리고! 그것이 자전거를 타는 모든 사람들의 소망이 아닐까 생각해봅니다. 이 책 처음에 나오는 [자전거 여행의 기술]도 꼭 보고 들어가시기 바랍니다. 요즘 자전거 인구가 늘면서 험하게 타는 분들도 많이 계신데 무엇보다 자전거 타기 전에 사전 지식을 충분히 쌓고 들어가는 것이 필요하겠지요. '자전거 브레이크 잡는 법'부터 차근차근 알려주고 있으니 충분히 도움이 됩니다. 여기에 글쓴이의 프롤로그를 읽고 가면, 내가 왜 자전거를 타는가? 하는 물음에 대한 답변이 조금은 될 듯도 하네요. 다들 안전운전하시구요! 저는 이번 추석 연휴에 정서진 다녀왔는데 자전거 타는 사람들이 많더라구요. 서로 자전거 사고 조심하면서 경치 좋은 곳~ 여기저기 좋은 구경하시길 바랍니다.리뷰어클럽 서평단 자격으로 작성한 서평입니다.(위 도서를 소개하면서 중앙Books부터 무료로 도서를 받았습니다)",9788927811510
4,[서평]대한민국 자전거길 가이드(국내여행),5,5,kye1987,2020-10-04,"미세먼지 마저 없는 잔잔하고 시원한 완연한 가을이 다가왔다.이럴 때 자전거를 타고 국내 여행을 한다면 얼마나 좋을까?코로나 때문에 마음대로 놀러 가지도 못하는데 혼자 또는 가족과 실외 자전거 여행을 떠나면 너무나 좋을 것 같아 대한민국 자전거길 가이드 책을 꺼내 보게 되었다.코스 스타일별 자전거 종류, 계절별 라이딩 코스가 잘 정리 되어 있어,초보 라이더 뿐만 아니라 전문가들까지 많은 계층이 참고하기 좋은 책인 듯 싶다.또한 자전거 여행 길 정보뿐만 아니라 맛집, 교통 정보까지 최신 정보를 담아내어자전거 여행을 즐기는 여행자라면 무조건 소지하지 않을 수 없을 것이다.아직 자전거 여행을 제대로 해보지 못한 나는 가고 싶다고 무작정 떠날 수 있는 것이 아님에도코스별로 난이도를 분류해서 초보자도 쉽게 여행할 수 있게 해준 점이 책의 큰 매력으로 다가 왔다.책 속에 담아 있는 작가의 여행 추천지를 사진으로만 봐도 벌써부터 엉덩이가 들썩거린다.나는 워낙 액티비티를 즐기기 때문에 이 책을 보는 순간 다가오는 봄에는 자전거로 국내여행을 꼭 여행 해보리라 다짐하게 되었다.책과 함께라면 자전거 여행길이 더 아름답고 즐거움이 배가 될 것 같다는 생각이 들었다.제대로 된 전문가용 자전거도 없는 나지만 자전거 여행을 할 생각에 벌써부터 마음이 설레이고 기분이 좋아진다.이렇게 여행 서적 하나만으로 기분이 한결 나아지니, 자전거를 사랑하는 많은 사람들이 이 책을 참고 삼아 진정한 자전거의 매력을 느꼈으면 좋겠다.출판사로부터 도서를 제공받아 작성한 리뷰입니다.",9788927811510
5,[서평]_대한민국 자전거길 가이드,5,5,혼란스러워,2020-10-03,"자전거를 많이 타지는 않지만, 자전거를 타고 우리나라 곳곳을 여행해 보고 싶다는 생각은 계속 해왔다. 일종의 로망, 버킷리스트, 언젠가는 꼭 하고 싶은 일이다. 자전거를 타고 다니다가 밤하늘의 별이 잘 보이는 곳에서 캠핑을 하는 상상을 하는 것만으로도 행복하다. 이준휘 님이 지은 '대한민국 자전거길 가이드(중앙북스)는 그런 꿈을 가진 사람이라면 꼭 읽어봐야할 책이다.   작가는 대한시절 우연히 친구와 함께 떠난 동해안 종주가 생애 첫 자전거 여행이었는데, 20년이 지난 지금도 그때의 설레임을 잊지 못하고 주말이면 가족과 함께 자전거 타기 좋은 곳을 찾아 떠나는 열혈 자전거 마니아라고 한다. 자전거 여행을 하면서 블로그에 글을 올리기 시작했고, 여러 매체에 기고를 하고 있다고 한다.  이 책에는 '자전거여행 BEST OF BEST'로 6개의 주제별 각  Best5를 소개한다.  꽃비 내리는 봄철 라이딩 코스 Best5 신록이 짙어지는 여름철 라이딩 코스 Best5깊어가는 가을 라이딩 코스 Best5 업힐의 수고로움은 눈 녹듯 사라지는 전망 좋은 라이딩 코스 Best5 도시여행과 라이딩을 한번에 공영자전거 라이딩코스 Best5 자연에서의 하룻밤 휴양림 라이딩코스 Best5 -대한민국 자전거길 라이드 -                               대한민국 자전거길 가이드 
봄철 라이딩 코스는 모두 벚꽃이 필때 가면 꽃비를 맞으며 라이딩 할 수 있을 것 같다. 각 주제별 사진만 봐도 당장 여행을 떠나고 싶은 마음에 설레인다.  여행에 먹거리가 빠질수 없지. 저자는 각 코스별 맛집을 소개하는 친절함도 잊지 않았다. 나는 막국수를 좋아하니 송정해변막국수의 물막국수와 장평막국수의 물막국수를 꼭 맛보고 싶다.            
저자는 우리나라의 자전거 라이딩 코스를 '물길 따라 라이딩', '산길 따라 라이딩', '명소 따라 라이딩' 크게 세 개의 챕터로 나누고, '물길 따라 라이딩'은 호수길, 바닷길, 섬길로 나누어 곳곳의 코스를 소개하고, '산길다라 라이딩'은 바람길, 산길, 숲길로 나누어 여러 코스를 소개한다. 마지막으로 '명소 따라 라이딩'은 비경길, 도심길로 나누어 각 코스를 소개한다.    라이딩을 하면서 사진을 찍고, 각 코스별 기초 정보를 수집하고, 이를 편집해서 소개하는 글을 쓰는 것이 쉬운일이 아닐 것 같다. 어지간한 열정을 갖고 있지 않으면 불가능한 일이 아닐까?  저자가 소개하는  물길 코스 중 임원-동해 종주코스는 동해안 해안도로를 따라 라이딩을 하다가 장호항, 목호항에 들러 수산물도 좀 먹고, 망상 오토 캠핑장에서 캠핑을 하면 좋을 것 같다는 생각에 꼭 도전해 보고 싶은 코스다.  그리고 바닷길 코스중 흑산도 순환코스, 바람길 중 태기산풍력발전단지 순환코스에 도전해 보고 싶은 생각이 들었다. 저자가 소개하는 3~40여개의 코스 모두 도전해 보고 싶지만 일단 책을 보면서 초보자도 쉽게 접근할 수 있는 코스부터 계획을 세워보면 좋을 것 같다.   
 이 책에 소개된 몇몇 코스는 꼭 자전거 여행이 아니더라도 가보고 싶다. 우리나라도 구석 구석 경치 좋고 운치 있는 곳이 많은데 내가 잘 모르고 사는 것 같다. 저자의 말대로 모든 여행은 설렘에서 시작된다. 현실이 팍팍할 수록 작은 기대와 설레임을 안고 시간 날때마다 소소한 여행을 즐기는 것도 자칫 잃어버리기 쉬운 자신만의 중요한 가치들을 잃지 않고 살아가는 방법이 아닐까 한다.  이 책을 보면서 저자가 책을 만드는데 얼마나 많은 정성이 필요한지 조금 알 수 잇을 것 같다. 직접 여행을 하고, 자료를 수집하고 주제별, 지역별로 나눠서 누군가에게 소개하는 작업이란 그리 녹녹치 않은 것이다. 저자의 소중한 추억들을 담은 이 책을 통해 나 같은 독자가 시행착오 없이 또 다른 추억을 만들어 갈 수 있을 것 같다. 저자의 정성과 성의가 느껴지는 이 책은 두고 두고 여행할때 가지고 다니면 좋을 책이다.           * 이 글은 작성자가 출판사로 부터 서평용으로 증정 받은 책을 직접 읽고주관적인 생각과 책의 내용을 정리한 글입니다.",9788927811510
