,Title,ConRate,DesRate,Author,Date,Content,BookCode
13,우리는 영국에서 일 년 동안 살기로 했다,5,5,ch79h,2020-09-22,"'우리는 영국에서 일 년 동안 살기로 했다'라는 제목이 마음에 드네요. 해외에서 한 달 살기, 석 달 살기, 일 년 살기 등 장기 여행이 각광받는 추세인데요. 저자와 가족은 단순한 여행이 아닌 남편의 유학으로 영국에 가게 됐네요. 낯선 곳에서 일 년 동안 살면서 느낀 점, 만난 사람들, 좋았던 경험 등을 담은 책입니다.어린 두 아이와 함께 해외에서 살다니 대단한 결심입니다. 단순 여행이 아니라 남편의 학위를 위해 간 것이기 때문에 마냥 놀 수는 없었을 텐데요. 저자가 영국으로 떠난다고 하자 주위에서는 아이들이 더 크면 가라고들 했지만 저자는 부부의 계획이 더 중요하다며 출국을 결심합니다. 책에도 언급했듯이 엄마 아빠가 행복해야 아이도 행복하기 때문이니까요.   어린아이 둘을 데리고 간다는 것이 쉽지는 않은데요. 4세, 1세의 두 아이들을 케어하면서 해외 살이를 하는 것이 어렵지 않을까 생각했는데 의외로 영국에서는 아이를 동반하면 많은 배려를 받을 수 있다고 합니다. 유모차를 몰고 가면 긴 줄을 서지 않아도 되고, 대중교통에서도 당연히 양보를 받는 분위기라고 합니다. 부모가 펍에서 열리는 파티에 참석할 때는 아이 동반이 가능하면 데려가도 됩니다. 거기에는 아이들을 케어해주는 공간이 따로 있기에 부모가 미혼일 때 하던 것을 포기하지 않아도 되는군요. 나라에도 운영하는 박물관이나 도서관, 각종 시설에도 아이들이 할만한 것들이 많아 시간을 보내기 좋습니다. 이렇게 아이들이 갈 곳이 많아야 부모가 편하게 다양한 경험을 할 수 있습니다. 이 책에는 언급되지 않았지만 아이를 키우는 부모는 직장에서도 배려 받을 것 같다는 생각이 듭니다. 그래야 아이도, 부모도 발전할 수 있겠지요. 이렇게 아이을 키우기 좋은 나라가 선진국이라는 생각이 드네요. 책을 읽어보면 저자와 남편은 공부도 많이 하고 좋은 직장에 들어갔지만 더 나은 미래를 위해서 해외에서 대학원을 나오기로 결심합니다. 저자는 임신과 출산으로 공부를 포기하고 남편 혼자 영국 유학을 준비하며 계획을 세우게 됩니다. 직장은 그만둬야 했고, 유학 자금이 풍족하지 않은 상태에서 전세금을 빼야 해외 생활이 가능하다 보니 준비 과정도 피가 말립니다. 출국을 얼마 남기지 않은 상태에서 비자가 나오고, 전셋집이 나갑니다. 대학원에 합격하고 나서 영어시험을 치기 시작해 마감 직전 시험에서 원하는 점수를 받습니다. 모든 준비 과정이 출국 전에 가까스로 다 끝나긴 했지만 책을 읽으면서 제 마음이 급해지더라고요. 저자는 낙천적인 성격이라 이런 초조함을 감당할 수 있었나 봅니다.저자는 남편과 아이들을 뒷바라지하며 집 밖으로 나가지도 못하는 현실에 슬퍼하다가 영국에 사는 장점을 이용해 여행 계획을 세우기 시작합니다. 추진력 있게 영국에 사는 일 년 동안 주변 10개국을 여행했네요. 아름다운 풍경을 실컷 감상하고 잘 즐기는 모습이 보기 좋습니다. 저가 항공을 이용해 저렴하게 여행을 한 덕분에 더 만족스러웠을 것 같습니다.보통 영국 물가가 비싸다고 생각하지만 저자는 마트를 이용해 저렴하게 장을 봐서 집에서 요리를 해 식비를 절약합니다. 숙소는 학교에서 운영하는 가족 기숙사를 신청했고, 대중교통을 이용하거나 걸어 다니면서 알뜰하게 생활했습니다. 남편은 학위를 따기 위해 공부하고, 큰 아이는 어린이집에 해당되는 교육기관에 다닙니다. 저자도 일 년 동안 살면서 많은 사람들을 만나고 좋은 관계를 유지합니다. 영국에서 학위를 따서 몸값을 높이면 한국에 돌아와 더 나은 삶을 살 수 있겠죠. 집도 다시 구하고 직장도 구해야 하는데 그런 건 어떻게 해결했는지, 직장에서는 더 좋은 대우를 받았는지, 아이들의 시야는 더 넓어졌는지 등이 궁금한데 이 책은 영국에서의 마지막 날을 기록하면서 끝이 납니다. 그 부분이 아쉽네요.평범한 사람들이 영국에서 유학하면서 여행도 다니며 평범하게 살다 온 이야기입니다. 저자는 작은 것에 감사하며 많은 것을 기쁘게 받아들이는 성격이라 낯선 곳에서도 잘 적응하고 온 것 같습니다. 해외에 살면서 현실적으로 해결해야 하는 문제들, 여행 추천 장소, 날씨나 옷차림 팁들이 나와있어서 영국 여행이나 유학을 준비하는 사람들에게 특히 도움이 될 것 같네요.",9791188167357
14,우리의 리즈 시절을 위하여 - 우리는 영국에서 일 년 동안 살기로 했다,5,5,anthem99,2020-09-20,"해외 출장을 자주 나가기도 하고, 외국에 계신 선교사님들과 소통을 많이 하는 편이라 해외에서 생활하는 것에 대한 동경이 있습니다.하지만 영어가 부담스럽기도 하고, 아내가 해외생활에 대해 부정적이기 때문에 꿈을 실현하지는 못하고 있지요.그러던 차에 이 책 '우리는 영국에서 일 년 동안 살기로 했다'를 만났습니다.코로나 이전에 외국에서 '한달살기'가 유행인 적이 있었는데 단기간인 1년동안 살아보는건 어떤 느낌일까 궁금해졌습니다.저자는 그 흔한 어학연수나 워킹홀리데이 한 번 가본 적 없는 토종 한국인인데, 결혼 후에 꿈으로만 그리던 영국 유학을 떠나게 됩니다.남편이 영국 석사과정에 합격하고 드디어 온 가족이 영국으로 떠나게 되는데요, 준비하는 과정이 만만치 않습니다.영어성적, 비자신청, 이사, 영국에서 살 집 알아보기 등 넘어야 할 산이 엄청 많은데요, 모든것이 기적처럼 딱딱 맞아떨어져서 무사히 영국으로 가게 됩니다.영국에서 사계절을 보내며 그 곳에서 좌충우돌 살아가는 진솔한 모습을 보면서 마치 내가 영국에 와 있는듯한 느낌을 받았습니다.막연히 동경했던 낭만적이 외국생활이 아니라 생활속에서 실제로 부딪히고 해결해야만 하는 부분들을 하나하나 이야기해주니 진짜 유학을 준비하는 사람들에게는 도움이 많이 될 것 같아요.영국하면 물가가 비싸고 음식이 맛없다는 편견이 있었는데 실제 살아보니 식재료는 훨씬 싸고, 맛있는 음식도 많았다고 합니다.역시 경험이 중요하다는걸 느끼게 되네요. 물론 낯선 타국에서의 생활이 좋은 날만 있지는 않았겠지만, 항상 긍정적으로 생각하고 좋은 사람들을 만나서 좋은 관계를 가진 이 가족의 이야기가 참 따스하게 느껴져서 좋았습니다.1년간 더 단단해지고, 넓어진 시각과 도전하는 자세 등 이들의 변화를 보며 이 가족을 응원하고 싶어졌습니다.또한 우리도 할 수 있겠다는 자신감이 생겼습니다.'영어보다 중요한건 용기'라는 말처럼 이 가족이 했던 도전에 용기를 얻어 우리의 삶에 작은 변화가 일어나길 바래봅니다.우리의 리즈시절을 위하여~영국유학 또는 해외생활을 준비하는 분들이나 무료한 일상에 자극이 필요한 분들에게 추천하고픈 책입니다.  [해당 출판사로부터 책을 제공받아 주관적으로 작성하였습니다]",9791188167357
0,"나를 찾아 떠나는 길 - 50대 중년, 산티아고에서 길을 묻다",5,5,anthem99,2020-10-05,"제 인생의 버킷리스트가 몇 개 있습니다.- 번지점프 하기- 에베레스트 등반하기- 사막마라톤하기그리고 산티아고 순례길 걷기왜 사람들은 산티아고 순례길을 걸을까요?여러가지 이유가 있겠지만 아마 대부분의 사람들이 인생을 돌아보고 길을 걸으며 앞으로의 인생을 생각해보는 시간을 가지기 위해서가 아닐까 합니다.저자 역시 30년의 직장생활에서 갑작스런 해촉으로 삶의 의미를 찾기위해 순례길을 찾았다고 합니다.'주님을 만나고 하나님의 음성을 듣는 놀라운 경험을 하는 것'을 목표로 걷고 또 걸었습니다.과연 그는 목표하는 바를 이뤘을까요? 이 길에서 참 다양한 사람들을 만나게 됩니다.20대부터 60대에 이르기까지 많은 사람들이 스쳐가고 만남과 헤어짐을 반복합니다.각자 저마다의 이유로 길을 걷고 있는데 적지 않은 나이임에도 자신만의 보폭으로 길을 걷는 모습이 매력적으로 다가왔습니다.호텔리어 출신답게 그날그날 묵었던 알베르게의 정보들이 자세히 나와 있습니다.인기가 좋아서 미리 예약을 해야만 묵을 수 있는 숙소도 있고, 서로 빵을 나누며 자신들의 이야기를 들려주는 알베르게도 있는데요, 특히 엠마오 마을의 엠마우스 성당은 전날 도네이션으로 모여진 금액으로 저녁을 준비한다고 하는데 참 신선한 발상인 것 같습니다.자신만의 여행이 아니라 다음에 올 사람들을 위한 배려를 자연스럽게 배울 수 있어서 아주 인상적이었습니다.이 책은 프랑스길의 처음 시작점인 '생장 피에드포르'부터 산티아고 광장까지의 여정을 재미있게 그리고 있는데요, 읽으면서 자연스럽게 그 길을 함께 걷고 있는듯한 느낌이 들었습니다.저자의 실수담과 경험을 통해 순례길을 준비하는 분들이 현지에서 헤매지 않도록 많은 도움이 될 것 같습니다. 순례길을 마친 후 저자에게 기적은 일어나지 않았고 삶 역시 드라마틱한 변화는 일어나지 않았습니다.하지만 내면과 태도의 변화에서부터 일상의 작은 변화들이 시작되었다고 합니다.우리 역시 마찬가지 일 것 같습니다.뭔가 대단한 변화가 일어나진 않지만 내가 무엇을 모르는지를 아는 것.'I konw that I know nothing, I know one thing that I know nothing'소크라테스의 말처럼 진정한 앎은 자신의 자신의 무지를 깨닫는 것 부터 시작하는거 아닐까 하는 생각이 들었습니다.이제 곧 50대로 들어서는 저도 순례길을 준비하면서 꼭 가보고 싶네요.함께 걸으실래요?[해당 출판사로부터 책을 제공받아 주관적으로 작성하였습니다]",9791166030468
1,끝까지 갈 수 있을까?,5,4,퀘스천텔러별혜,2020-10-02,"10년 전, 직장생활에는 적당히 이골이 나고이제는 더 이상 청년이 아니라고 생각되는 나이,그럼에도 아직 미혼이라 앞날이 불투명하기만 하던 그시절새파란 하늘을 배경으로 두팔 활짝 벌리고 걸어가는 여행자의 뒷모습이 찍힌책 표지를 만났습니다.시원스런 필체로 적힌 [camino de santiago]여행자의 뒷모습은 자유를 향해 벅차게 한걸음씩 걷고 있는 느낌이었습니다.그 표지에 이끌려 저는 꿈을 꾸기 시작했던 것 같습니다.산티아고 순례길 걷기! 버킷리스트에 새롭게 추가된 또 하나의 꿈!그러나 사는 게 바쁘다는 핑계로 어느새 산티아고는 기억 저편으로 넘겨버렸네요. [50대 중년, 산티아고에서 길을 묻다]에서 '산티아고'라는 단어를 보자 가슴이 두근거렸어요.이제 중년이 되어버린 제게 '산티아고'는 지나가버린 젊은 날의 꿈같았으니까요.게다가 10년 전에 본 표지의 순례자와는 달리 이 책의 표지에 보이는 순례자의 모습은뭔가 삶의 무게를 잔뜩 지고 등산용 스틱 두 자루에 의지한 결연한 발걸음이었습니다.50대 중년, 한창 내달려야할 시기에 길을 잃어버린 저자 앞에 나타난 산티아고 순례길.그에게 산티아고는 어떤 의미였을까요?저처럼 사는 날까지 살면서 가슴에 담아두기만 하던 꿈의 실현이었을까요?아니면 치유와 영적의 깨달음을 찾아 떠나야하는 운명의 여정이었을까요?어떤 의미로든 요즘 같은 코로나 시대가 들이닥치기 전에 떠날 수 있었던 그 행운이 마냥 부럽습니다.그가 떠나간 길에서 만난 많은 순례자들 역시 살면서 마주하는 비슷한 문제들로 고민하기에서로를 응원하며 함께 걷기도 하고 인사를 주고 받으며 스쳐가기도 합니다.작가의 여정을 따라가며 책 곳곳에 수록된 순례길의 풍광을 보고 있노라면그 길의 끝에 만날 수 있는 것은 인생의 문제에 대한 답이 아니라 또다른 질문이 아닐까 합니다.  책장을 덮으며 산티아고 순례길, 그 길을 꼭 걸어보고 싶다는 생각이 듭니다.이제는 '갈 수 있을까?'라는 생각보다 '끝까지 완주, 완보(?)할 수 있을까?'라는 걱정이 드네요.그래도 꿈이 있는 사람은 늙지 않는다고 했으니 산타아고를 걸을 수 있게 되는 날이 올때까지저는 젊게 살 겁니다. (웃음)그리고 그때는 저혼자가 아닌 우리 가족이 모두 함께 걷게 되길 바랍니다.저는 산티아고에 무엇을 물으러 떠날까요?",9791166030468
2,"50대 중년, 산티아고에서 길을 묻다",5,5,냠냠아하,2020-10-02,"50대 중년 산티아고에서 길을 묻다.     산티아고를 갔다오는 것은 분명 대단한 결심이라고 생각한다. 스페인하숙을 시작으로 주변에 산티아고에 대한 열풍은 확실히 부는 듯하다. 많은 한국인들이 산티아고를 찾고 있고, 그만큼 이 살기 팍팍한 세상을 어떻게든 극복하려는 사람들이 많다는 반증일 것이다.     이 책을 읽으면서 저자의 인생에 있어서 전환점이 필요한 시기에 산티아고를 갔다 오면서 책을 엮었다. 사진을 보면서 산티아고를 갔던 상황들, 어디를 갔는지를 상세히 기술해 놓으니 한편의 일기를 보는 듯하고, 나도 같이 여행을 하고 있구나 하는 생각이 들 정도였다. 나중에 내가 산티아고를 간다면 저자의 책을 가지고 다니면서 동선을 같이 해도 되겠구나 싶다.     아직 나는 50대 중반은 겪어 보진 않았다. 그러나 분명 나도 겪어야 하는 나이이기도 하고, 회사를 열심히 다니고 있지만 저자처럼 한순간에 회사에서 나오게 되는 불상사를 겪을 지도 모른다. 그렇기에 이 책을 처음부터 끝까지 저자에 이입을 하면서 읽었던거 같다. 저자는 산티아고를 걸으면서 많은 사람들을 만나고, 다양한 사연들을 듣고, 스스로도 깨달아 가는 과정을 읽으면서 정말로 한번 쯤 가보고 싶게 만들어주었다.      [그러니 이제부터는 기꺼이 방랑을 하자. 이미 테두리가 사라진 세상에서나를 담아내기 위해 규격을 정하고 포장하는 수고로움을 더 이상 견디지 말자.너무 일찍 닫혀버린 나의 또 하나의 성장판을 더듬어 찾노라면혹시 누가 알겠는가, 그곳에 미처 보지 못했던 새싹이 돋아나고 있을지,저기 작고 말라비틀어진 포도나무들에도 저렇듯 파릇한 새잎이 돋아나고 있지 않는가혹시 누가 알겠는가? 나 또한 그러할지붉은 포도밭을 지나며 서러운 울음을 실컷 울었다.] p121      저자의 마음이 이 글에 핵심적으로 담겨있다고 본다. 이 땅의 중년들에게 주는 의미도 여기에 담겨 있다고 생각했다. 인생이 길다고 하면 긴 인생에 중년이라는 나이는 아직은 인생에 중반밖에 살지 않은 나이이다. 그러기에 산티아고가기위한 순례자의 길을 걸으며 인생의 중반을 어떻게 살아야할지, 어떤 것을 배울 수 있을지 많은 생각을 하게 만드는 듯한다.     이 책에서는 수 많은 길 위의 친구들을 만나며 그리고 헤어진다. 그러면서 길 위의 스승도 만나게 된다. 우리네 인생도 이와 같다는 것을 저자와 같이 산티아고를 상상으로 걸으면서 나도 같이 느끼게 되었다. 그리고 나 스스로도 저자의 책을 읽으면서 스스로의 인생에 대해 다시 생각해보는 계기가 되었다.     솔직히 그동안 나는 산티아고에 큰 관심이 없었고, 인생에 대해 깊숙이 생각을 해보지 않은 듯하다. 하지만 이 책은 그러한 나를 한층 더 깊숙이 생각할 수 있게 만들어준 책이었다. 처음에는 산티아고 견문록이라고 생각했지만 우리네 인생길을 이 산티아고 순례길을 걸으면서 저자는 자신의 경험을 묵묵히 이 책에 아낌없이 담았다는 것을 알게 되었다. 그리고 산티아고에 같이 걷는 사람들 또한 나이 ,인종, 성별이 달라도 그들이 부딪히는 문제들은 다들 비슷하기에 서로를 응원하며, 한걸음씩 나아가고 있었다. 지금은 아니더라도 나도 저자의 나이대가 될 것이고, 인생에 큰 전환점을 맞이하게도 될 것이다. 그리고 그때 문뜻 산티아고에 가고 싶다는 생각도 들 것이다. 그럴 때가 온다면 저자의 책을 다시한번 읽어보고, 도전해보고 싶다. 저자처럼 순례자들을 만나며 마음의 울림을 있는 대화도 나눠보고 싶고, 깨달아가는 여정을 하고 싶다.  ‘부엔 까미노!’    1. 좋은 글귀, 마음에 드는 가사 인상 깊은 영화 대사 등을 메모해 주세요. 2. 출처를 넣어주세요.  ex) 234page, 4번 트랙<사랑해>, <브리짓존스의 다이어리>에서 브리짓의 대사",9791166030468
3,"50대 중년, 산티아고에서 길을 묻다",5,5,kkandol32,2020-10-02,"생장에서 오리손 산장까지는 거리는 8km 정도 밖에는 안 되지만 600 미터의 고도 차이가 난다. 중간에 음식물을 판매하는 곳은 한 군데도 없다.특히 '오리손 5km 팻말이 보이는 지점을 지나면서부터 이어지는 가파른 오르막길 구간은 체력소모가 심했다.오리손 산장에 도착한 시각이 9시 20분, 생장에서 꼬박 두 시간 반이 걸렸다.쉬지 않고 온 것 치고는 시간이 많이 걸린 셈이다. (-37-)그렇구나,그러하구나,너희 이십대들아,그리하여 너희가 이 먼 땅을 누비고 있구나!산티아고길을 걷고 있는 대한민국의 이십대와 오십대정도의 차이는 있겠지만, 같은 고민이 있기에 우리는 길을 나섰을 것이다.구할 수 없는 해답이라도 찾을 양으로,많은 사람들이 이 길을 걷고 삶이 변화되었다 하니 내 인생도 한번 변화시켜 달라고.그렇게 우리는 한 걸음 내 디딜 때마다 기도하기 위해 이 길을 온것일게다. (-79-)한국에서 올 때 비상약품을 챙긴다고 챙겼지만 붙이는 파스까지 준비할 생각은 못했는데 ...여성들은 참 대단하다. 고맙다는 인사를 전하며 말을 붙이니 의외로 싹싹한 아가씨다.이름은 수현이라 했다.생장에서 언제 출발했냐는 나의 물음에 22일 출발했는데 걸음이 느려 원래 출발했던 일행들보다 늦어졌다고 한다. 22일이라면 내가 나폴레옹에서 조난당했던 날이다. (-114-)이어 내가 ""사실 이 길을 걷기 시작할 때는 하나임이 나에게 뭔가 메시지를 주실 거라는 기대가 있었는데 솔직히 잘 모르겠다.당신처럼 평화를 누리지도 못하고 그저 들개처럼 들판을 걷다가 배고프면 먹다가 또 걷는다.""라고 푸념 비슷하게 늘어놓으니.(-156-)궁금했던 스페인 순대는 보티요 botilli 라고 하는데 순대에 양념을 해서 튀긴 음식이다. 음식들은 맛도 잇고 푸짐해서 맥주나 와인과 함께 하기에 좋았다. 11시간을 걸어 힘들게 입성한 부릇고스,이 도시에서 저녁을 이렇게 멋진 친구들과 함께 보낼 거라고는 상상하지 못했다.' (-182-)그래서 다행이다.지극히 위험한 이 순간 브라질 여성이가.그런데 이 여성 걸음이 매우 빠르다.빠른 보폭에 맞춰 리드미컬하게 스틱을 치고 나간다.나라는 존재에 대해서는 별 관심이 없는 것 같다. 뭐 따라올 테면 오라는 식이다.한참을 별 말없이 자나와 보조를 맞춰 걸었다.40대 중반(?)으로 브라질 국가기관에서 근무하는 공무원이라 했다.어떻게 그렇게 걸음이 빠르냐고 했더니 자깃가 빨리 걷는 거냐고 웃으며 되묻는다.그러더니 아마도 마라톤을 해서 그런가 보다고 한다. 아,그러고 보니 이 여성은 걷는 게 아니라 실상 뛰고 있었구나. (-218-)담담히 자신의 과거 얘기하고 있는 그의 얽둘을 가만히 쳐다보았다.담담히 자신의 과거 얘기를 털어 놓으면서도 그의 표정은 웃고 있었다.순간 그 어느 길에선가 함께 걸었던 피터 선생이 떠올랐다.그래 영국 화가 피터 선생,집도 절도 없이 이 자연이 다 자기 것이라며 행복해하던 괴짜 화가 선생,피터 선생도 크리스티앵과 마찬가지로 느리게 걷고 있었다. (-271-)산티아고가 가까워져 오면서 길옆에 세요를 찍어갈 수 있는 곳이 많아졌다.작은 마을 하나에서만 대여섯 개의 세요를 찍어잘 수 있을 것 같다.시리아에서부터 100km 를 걷는 사람들을 위한 배려일까? 그뿐만 아니라 마을 차원에서의 적극적인 숙박 유치활동도 눈에 띄는데, 아르수아 다음 마을인 베베데리아 마을을 지날 때 한국어로 적힌 마을 성당의 미사안내를 쪽지를 전해준다. (-333-)호텔리어 출신인 저자는 ,10년간 몸답았던 직장에서 해촉하고 곧바로 산티아고로 자신의 걸음을 옮기게 된다. 순례의 시작점이 되는 생장 피에르포르,그곳에서 다양한 사람들과 함께 순례길을 동행하게 되었고,한류 열풍으로 인하여 한국에 대해 궁금해 하는 외국인과 동행하게 된다.사람에 대해서 배우고 있었다.순례를 통해서 그동안 갇혀 있었던 소외된 자아에서 벗어나 스스로 새로운 길을 선택하게 된다. 낯선 이방인으로서,그들과 함께 하면서, 사막 위에서 나침반 하나로 길을 다시 찾아가는 기분이었을 것이다. 전혀 처음 보는 것득ㄹ,그 안에서 낯헌 이방인과 또다른 낯선 이방인이 마주하게 된다. 서로 족심스럽고,거리를 두게 되는 그 순간에도 , 같은 길을 함께한다는 이유만으로 길동무를 자쳐하게 된다. 돌이켜 보면 산티아고 순례는 우리가 놓치고 있었던 무형의 가치를 주워담아가는 순례길이었다.사람과 동거동락 하면서, 놓치고 있었던 일상, 정서, 당연한 것들과 소중한 것들, 그러한 것들을 나에게 익숙하 곳에서 낯선 곳으로 바뀌면서,스스로 새롭게 자신을 설정하고자 하였다.산티아고 순례길에서 만나게 된 길동무,그들을 통해서 나 자신을 점검하게 되고,스스로 부족한 것들, 가지고 있는 것들을 갸늠하게 된다.나 중심적인 사고 방식에서 벗어나, 나보다 더 행복한 사람들을 보면서,스스로 행복의 조건들을 찾아가게 된다. 외로운 길 위에서 홀로 걷다가 만나게 된 사람과 친밀하게 수다를 떨 수 있는 그 곤간이바로 산티아고 순례길이었으며, 사로의 안부를 여쭙고, 같이 동행하기로 자쳐할 수 있는 이유는 여기에 있다.살아가기 위해서 함께 해야 한다는 것, 하루 30여 km 의 거리를 걸으면서, 높고 낮은 땅위에서 발자국을 남기면서,추억을 담아가고. 서로 깊은 인연도 남기게 된다.",9791166030468
