,Title,ConRate,DesRate,Author,Date,Content,BookCode
0,반도체 면접 준비 시작하기,4,5,-,2020-10-05,관련 지식이 없어서 면접 준비를 위해 구매했습니다. 내용이 다양하게 있어서 반도체 관련한 직군을 준비하고 있다면 도움이 많이 될 것 같습니다. 자소서 쓰고 직군 알아볼 때 막막했는데 미리 알고 있었다면 좀 더 도움이 됐을 것 같아요! 엔지닉에서 무료 온라인 스터디를 하기 위해 구매했는데 도움이 많이 되는거 같아요!! 구매 하셨다면 함께 이용하는거 추천합니다! 찾아서 이용해 보세요!!,9791161980911
1,반도체 공부에 최적화된 교재,5,5,첫번째안개꽃,2020-09-29,현재 대학교에 재학중이면서 동시에 반도체 공부를 하기 위해 구매한 책입니다. 핵심 내용이 잘 정리되어 있어 학업중에도 지장이 없고 최신 트렌드도 반영되어 있어 흐름에 뒤쳐지지 않는 내용을 모두 갖고 있습니다. 전자공학을 전공하고 있더라도 취업을 위해 배우는 반도체와는 조금 다른 특징을 가지고 있습니다. 따라서 취업 준비를 위해 교재 구매를 고민하시는 분들에게 권장드립니다.,9791161980911
2,엔지닉 반도체 전공면접 합격의 모든 것,5,4,쪙스,2020-09-29,"면접 준비위해 구매했고 상반기부터 사용중입니다. 생각보다 내용이 굉장히 다양해요! 최신 기술도 나와있어서 좋아요. 다만 조금 더 자세한 설명있었음 좋겠다 하는 부분이 좀 있긴 해요그래도 면접 준비, 반도체 공부하는데 매우 추천합니다(학부때 진즉에 알았음 좋았을텐데 ㅠㅠ)엔지닉에서 진행하는 무료 온라인 스터디 함께 이용하면 도움이 됩니다! 면접 준비위해 구매했고 상반기부터 사용중입니다. 생각보다 내용이 굉장히 다양해요! 최신 기술도 나와있어서 좋아요. 다만 조금 더 자세한 설명있었음 좋겠다 하는 부분이 좀 있긴 해요그래도 면접 준비, 반도체 공부하는데 매우 추천합니다(학부때 진즉에 알았음 좋았을텐데 ㅠㅠ)엔지닉에서 진행하는 무료 온라인 스터디 함께 이용하면 도움이 됩니다!",9791161980911
3,취업 준비 및 반도체 공부를 위해 구입했습니다.,5,5,-,2020-09-29,"전공에서 배우는 반도체 기초부터 취업시 필요한 최신 미세공정에 따른 반도체 산업의 변화까지 모든 내용을 압축해놓은 좋은 참고서입니다. 이 책 덕분에 이론적으로만 알고있던 반도체에서 현실적인 내용, 앞으로 준비해야할 내용을 알 수 있었으며 취업 준비에 더욱 도움이 될 것 같습니다!! 전공자의 시선에서 바라본 것이지만 비전공자 입장에서도 천천히 여유를 갖고 읽기에 적당할 만큼 내용 설명도 쉽게 되어있으니 부담없이 읽기 좋은 책이라고 생각합니다!!",9791161980911
4,반도체 비전공자에게 도움이 되는 책,5,5,njkimas,2020-09-29,반도체 면접에 대비해 공부하고 있습니다.꼭 삼성전자가 아니더라도 다양한 반도체직군에서 유용하게 쓰일 것으로 기대중이고다양한 취업정보도 함께 있는 것 같아 도움이 됩니다. 이미지 그림형식도 많아서 한 눈에 반도체가 들어온다는 점이 이 책에 가장 큰 장점인 것 같습니다.전공자에겐 모르겠지만 초보자들에게는 강추합니다!!! 취업준비에 다들 힘내셔서 취뽀하시길 빌며..(저도 화이팅! ㅠㅠ),9791161980911
5,취업 준비를 위해 구매하였습니다.,5,5,lmk969,2020-09-27,"대학교 전공 수업을 통해 반도체에 배우긴 하였으나 정리되지 않은 채로 머릿속에 엉켜있어 반도체 공부 겸 취업 준비 겸, 겸사겸사 책을 구매하였습니다. 반도체의 이론에 대해 완벽히 정리되어 있어 매우 도움이 되었고 취업을 위한 준비에 큰 도움이 될 것 같습니다. 반도체 관련 전공자들은 이 책을 통해 내용정리를, 반도체 비전공자들이더라도 이 책을 통해 반도체 이론을 정복할 수 있을 것이라 생각되네요.",9791161980911
6,반도체 공부하기 위해 구매했습니다!!!,5,5,gnzmrud5215,2020-09-26,반도체 공부를 하기 위해서 구매했습니다. 주변에서 추천도 많이 하고 서점에서도 순위권이 높은 것도 구매하는데 영향을 미쳤습니다.    반도체 관련 지식이 없는 사람도 쉽게 이해할 수 있게 잘 구성되어있는 것 같습니다. 반도체 공부를 하면서 면접준비도 함께 할 수 있다는게 큰 메리트인 것 같습니다!!!!              하나하나 쉽게 설명이 잘 되어있고 필요한 부분을 딱 정리가 잘 되어있습니다. 반도체 지식을 쌓는데 큰 도움이 될거같습니다.,9791161980911
7,"비전공자, 입문자들까지 반도체 취업 준비에 적합한 완성도 높은 책 구매후기",5,5,모건,2020-09-21,"화학공학과 출신이지만 반도체 기업으로 취업준비과정을 넓히게 되면서 기초 이론과합격 전략을 공유받고자 책을 구매하게 되었습니다. 생각한 것보다 이론 뿐만 아니라 pt 면접 기출이 반영된 내용과, 핵심 용어집, 그리고 입문자를 위한 강의까지 제공해주어 책 한 권 값에 강의까지 모두 저렴하게 구매한 기분이 드네요. 공정은 물론 산업 이해와 기술 동향까지 책에 담겨 있어 한 권만 잘 파악해도 자기소개서 및 면접 준비 끄떡 없을 것 같습니다. 엔지닉 반도체 전공면접 합격의 모든 것 이론 완성편으로 면접까지 고고하겠습니다.",9791161980911
8,반도체에 관한 전반적인 내용을 담은 책!,5,5,guswjd94,2020-09-20,"반도체 8대 공정이 무엇인지도 몰랐던 취업 준비생으로, 막연히 반도체 업체에 취업을 하고 싶었던 사람들에게 길라잡이가 될 수 있는 교재입니다. 반도체가 무엇인지부터 8대공정, 마지막으로 반도체 시장 분석까지 전반적인 지식을 함양할 수 있는 교재로 저와 같은 사람들에게 추천합니다. 각 공정의 내용 소개와 더불어 실제 직무 역량 면접 기출문제와 답변이 수록되어 있어 면접 준비까지 할 수 있는 좋은 책입니다.",9791161980911
9,엔지닉 교재 리뷰,5,5,eqsdyh,2020-09-20,편집과정에 참여했던 취준생으로서 반도체에 대한 기본부터 심화까지 모든 것이 담겨있는 책이었습니다. 저는 학교에서 메모리에 관련된 과목이 없어 학습에 어려움이 있었고 관련 교육자료가 절실했습니다. 편집과정에서도 한번 보고 후에 책을 미리 받아서도 계속 보고있습니다.이런 분들에게 추천합니다.반도체 관련 학과가 아니라서 반도체 지식을 쌓고 싶은 분들반도체 관련 학과지만 심화된 내용을 공부하고 싶은 분들최신 기술이나 이론에 대해 공부하고 싶은 분들,9791161980911
10,엔지닉 반도체 전공면접 합격의 모든 것 이론 리뷰,5,3,donna0830,2020-09-19,"반도체 관련 지식이 별로 없으신 분들도 수월하게 처음부터 공부할 수 있는 기초부터 각 분야별 심화 내용까지 잘 정리 되어 있습니다. 하지만 중간중간 오타가 보입니다. 수정 부탁드립니다.엔지닉 반도체 강의와 들으면 더욱 더 정리가 잘 됩니다. 그리고 기출 문제와 접근전략, 판서팁, 모법답안까지 정리되어 있어서 매우 도움이 많이 됩니다.  정말 추천쓰 합니당",9791161980911
11,리뷰,5,5,delliy,2020-09-18,반도체에 대해 잘 모르는 초심자도 잘 볼 수 있게 하나부터 열까지 설명이 되있습니다. 추가로 책 앞에 있는 쿠폰번호를 이용하여 시작이 어려우신 분들을 위한 인터넷 강의도 있습니다.반도체 기업 취업을 목표로 하는 준비생들에게 아주 강추합니다!저도 반도체에 대해 하나도 모르지만 반도체 전문가들이 만들어주신 이 책으로 차근차근 공부하고 있습니다!이 책으로 코로나 때문에 힘든 이 시기에 모두 취업문을 두드릴 수 있도록 기원합니다.,9791161980911
12,2020 엔지닉 반도체 전공 면접 합격의 모든 것이 있습니다!,5,5,fhemapdlxm99,2020-09-18,"엔지닉 반도체 7일 완성 스터디를 하기 위해 책을 구매했습니다.반도체 관련 전공을 했지만 부족한 점이 많았는데, 알기 쉽게 구성되어 있는 것 같아 비 전공자 또한 쉽게 접할 수 있을 것 같습니다.반도체 사업의 정보, 이슈 등 설명과 공정별 그림과 설명이 이해하기 좋을 것 같습니다 서적과 함께 공부하면서 열심히 스터디 참여해보려고 합니다  :)반도체 이론 공부를 하시는 분들에게는 필수로 추천 드려요!!",9791161980911
13,2020 엔지닉 반도체 전공면접 합격의 모든 것 이론 완성편,5,5,tjgmlskfro,2020-09-18,"엔지닉 반도체 2주 스터디를 위해 책을 구매했지만 책 구성이 좋아 비전공자도 공부할 수 있을것같습니다. 학부시절 배웠던 반도체를 까먹어서 어려움이 있었는데 많은 도움이 되었습니다. 반도체 사업의 기초부터 구성되어있어 사업의 관계도를 알기 쉽고, 또한 공정별로 그림으로 자세하게 설명되어있어 이해하기 쉽습니다. 이번 하반기에 사업부 바꿔서 마지막으로 도전합니다. 인적성, 면접대비 열심히해서 후회없는 결과를 얻을 수 있도록 열심히 하겠습니다!",9791161980911
14,책,5,5,HARDSKY,2020-09-17,"비전공자가 기초부터 공부하기 좋은 상세한 책입니다. 상세한 내용을 원하면 선택할 만합니다. 이번에 엔지닉 반도체 강의를 듣게 되면서 교재도 구매해서 본격적으로 공부하려고 구매했습니다. 실제 보면서 너무 상세해서 어려운 내용도 있지만, 차근차근 설명을 따라가고 강의를 본 후 순서대로 따라간다면 반도체에 대해 잘 배울 수 있었습니다. 반도체 공부 필수 이론 공부를 원한다면 추천합니다.",9791161980911
15,[도서] 2020 엔지닉 반도체 전공면접 합격의 모든 것 이론 완성편,5,5,dongb123,2020-09-14,"반도체에 대한 설명이 잘되어있고 반도체 회사에 지원하기 위해서는 기본적으로 가지고 있으면 좋은책 같습니다. 덕분에 반도체에 대해도 알게 되었고 전공 면접을 준비할 수 있을 것 같습니다. 기존 모호했던 반도체 소자 구성 원리나 시스템 반도체, 메모리반도체의 신기술 동향에 대해서도 준비할 수 있는 좋은 서적입니다.  이 책으로 꼭 이번에 삼성전자에 붙겠습니다!",9791161980911
16,엔지닉 반도체 2주 리뷰,5,5,sks3676,2020-09-13,"엔지닉 반도체 2주 스터디를 위해 책을 구매했지만 반도체 공채 처음 준비하는 저로서 많은 도움이 되었습니다. 이번 하반기 마지막일지도 모를 공채에 최선을 다해 후회없는 결과를 얻을 수 있도록하겠습니다. 그러는데 있어 이번 책이 많은 도움이 되었습니다.또한 반도체 장비 회사가 어디가 있는지 알게 되었고, 관련해서 준비해가도록 하겠습니다.그리고 관련 책을 다른 책도 구매해보았는데 엔지닉 책이 공정에 대해선 그림과 설명이 비교적 좋았습니다.",9791161980911
17,덕분에 반도체 스터디 잘하구 있습니다!,5,5,rori0108,2020-09-13,"우연히 엔지닉 반도테 스터디를 시작하게 도어반도체 스터디를 이 책으로 동시에 진행하고 있는데요 덕분에 반도체 소자와 반도체의 원리, mosfet 관련 내용, 반도체 공정 관련 지식을 정리할 수 있어서 너무 좋았어요!이 책과 더불어 엔지닉애서 진행하는 스터디도 직무분석과 가업분석도 같이 해주셔서 취업 준비하기 편하네욤이 책으로 취업 준비해서 삼성전자나 하이닉스 가고 싶어요!",9791161980911
18,비전공자여도 두려워말고 도전!,5,5,ownsgks,2020-09-11,"엔지닉 반도체 스터디를 통해 알게 된 교재입니다.비전공자라 반도체 공부에 두려움이 있었습니다만, 처음 공부할 때 어려운 회로도, 화학식, 전자에 대한 개념 등을 잘 공부하고 넘어간다면, 이후 공정에 대한 내용들은 이해가 수월했습니다.스터디 인터넷 강의 자체는 책의 모든 내용을 다루진 않고, 핵심적인 내용만 다루었는데, 이 외의 내용들은 스스로 공부해야 했습니다. 그럼에도 불구하고, 크게 어려운 부분이 없었습니다. 용어들이 많이 생소했지만, 반도체 산업 관련 용어집이 함께 소책자로 포함되어 있어 다양한 반도체 용어들을 배우기 편했습니다. 전체적으로 교재의 내용 뿐 아니라, 디자인도 보기 편하고, 깔끔하게 되어있습니다.이 교재로 열심히 공부해서 다들 좋은 소식 들을 수 있길 바랍니다.",9791161980911
19,반도체 전공 면접 기본서로 제격인 것 같아요!!,5,5,인기공,2020-09-11,"엔지닉 스터디로 인해 책으로 함께 공부하고 있는데 좋아요이전에 샀던 반도체 전공면접 책은 오탈자도 많고 번역해놓은 느낌이 강해서 어려웠었는데, 이 책은 되게 자세하게 나와있더라구요!스터디는 아직 시작 전이지만, 열심히해서 2주동안 빠지지 않고 잘하고 싶습니다.서류 붙고 면접 준비할 때 더 유용하게 쓸 것 같습니다.꼭 지금 스터디 열심히해서, 면접장의 모든 질문을 대답할 수 있었으면 좋겠네요 ㅎㅎ",9791161980911
20,2020 엔지닉 반도체 전공면접 합격의 모든 것 이론 완성편,5,4,-,2020-09-11,"반도체에 대해 취업준비생이 궁금해 할만한 모든 내용이 담겨있다고 생각합니다. 반도체를 생산하는 기업들에 대한 내용부터 기본적인 반도체 소자와 공정에 대한 자세한 지식이 담겨있었습니다다. 특히 겉핥기 식으로 소자와 공정의  내용을 소개한 것이 아닌, 전공적인 측면에서 수식과 그 의미까지 충실하게  담겨있어서 많이 유용하다고 생각합니다. 뿐만 아니라 최근 발전되는 기술의 동향과 미래에 대해서도 소개를 하고있어, 반도체에 대한 지식을 쌓는 것 부터 면접에 대비해 업계에 대한 인사이트를 늘려주는, 굉장히 훌륭한 책이라고 생각합니다.",9791161980911
21,엔지닉 반도체 전공면접 교재,5,5,danny1481,2020-09-10,엔지닉 반도체 스터디를 통해 구매한 교재입니다. 반도체 공정과 소재를 모르시는분은 물론 반도체 공부하신 분들도 리뷰를 포함하여 심화내용도 공부하기 좋게 정리가 잘되어있어서 좋습니다.생각보다 훨씬 세세하게 설명이 되어있어서 정말 좋은 교재 같습니다.또한 각 단원마다 면접 기출문제도 나와있어 공부 했던 내용들을 다시 한번 나만의 것으로 정리할 수 있어서 정말 좋았습니다.반도체 관련 분야로 취업하시는 분들께 정말 추천하는 교재입니다.,9791161980911
22,반도체,5,5,lsuh29,2020-09-10,엔지닉 반도체 스터디를 통해 알게 된 교재입니다. 반도체 소재와 공정에 대해 자세하게 설명되어 있어 공정에 대해 모르는 사람도 쉽게 공부할 수 있고 이미 배운 사람도 복습하기에 좋은 교재입니다. 면접 기출 문제도 있어 기출문제를 이용해 면접 대비하기에도 좋은 교재 같습니다. 반도체 관련 취업하시는 분들께 추천하는 교재 입니다. 관련 스터디를 통해 강의를 들을 수 있다는 점도 좋았습니다.,9791161980911
23,반도체 취업 준비한다면 추천,5,5,did443,2020-09-09,엔지닉 스터디로 함께하고 있는데 좋아요 반도체 전공면접 책은 처음 사봤는데 생각보다 책에 하나하나 되게 자세하게 나와있더라구요!스터디는 아직 2일차지만 열심히해서 2주동안 빠지지 않고 잘하고 싶어요 ㅎㅎ서류 붙고 면접 준비할 때 더 유용하게 쓸 것 같습니당 학교에서 반도체 공부하신 분들은 리뷰용으로 공부하기 좋으실 것 같고 안 배우신 분들도 공부하기 좋을 것 같아욤! ㅎㅎㅎ,9791161980911
24,덕분에 반도체 스터디 잘하구 있습니다!,5,5,rori0108,2020-09-08,"우연히 엔지닉 반도테 스터디를 시작하게 되었습니다.반도체 스터디를 이 책으로 동시에 진행하고 있는데요 덕분에 반도체 소자와 반도체의 원리, mosfet 관련 내용, 반도체 공정 관련 지식을 정리할 수 있어서 너무 좋았어요!이 책과 더불어 엔지닉애서 진행하는 스터디도 직무분석과 가업분석도 같이 해주셔서 취업 준비하기 편하네욤이 책으로 취업 준비해서 삼성전자나 하이닉스 가고 싶어요!",9791161980911
25,엔지닉 반도체 책으로 취뽀하자!!,5,5,게트,2020-09-07,"반도체 기업에 취업하고 싶지만 알고 있는 정보가 너무 없어서 이 책을 구매하게 되었습니다. 이 책을 통해서 반도체 기업을 분석하고, 반도체에 관한 기본 지식을 습득하여 취뽀하도록 노력하겠습니다. 책은  제일 앞쪽에는 기업이 분석되어있으며, 반도체 관련 용어를 정리한 소책자가 있는 것이 좋은 것 같습니다. 그리구 책 초반부를 넘어가면 반도체에 관한 기초 내용부터 시작해서 반도체 소자, 반도체 공정으로 차레로 나뉘어져서 잘 정리되어 있는것을 확인할 수 있었습니다. 학과에서 배운 내용과 취업할때 필요한 내용이 잘 요약되어 담겨져 있는 것 같습니다.  잘 사용하겠습니다!!",9791161980911
26,엔지닉 반도체,4,5,취뽀개,2020-09-07,취업준비를 시작하며 반도체에 대한 공부가 막막하였는데 이번기회로 확실히 하게 되었습니다. 책을 받아보고 공부를 해본 후 다시 리뷰를 작성하겠습니다. 반도체 산업이 핫한 만큼 그에대한 준비가 필요하다고 생각합니다. 막막하신 분들은 엔지닉을 통해 준비해보는 것도 좋다고 생각합니다. 저도 엔지닉을 통해 스터디를 진행하고 후기를 다시 남기러 오겠습니다. 다들 취업 화이팅~!!,9791161980911
27,취준,4,4,cyl302,2020-09-06,"처음으로 반도체회사 취준을 위해 구입했어요! 대학에서 수업시간에 조금씩 배우긴 했지만, 반도체에 대한 정보가 완벽하게 정리되지않은 상태인데 자세히 설명되어 있어서 좋은거같고, 기출문제로 적용시킬수 있어서 면접대비에도 좋은거같아요! 스터디하면서 강의와 함께 들으면 더 이해하기 쉬울거같아서 기대중입니당 아직 자세히 보지는 않았지만 이 책으로 열심히 공부해서 꼭 취뽀하고싶습니다,,,",9791161980911
28,반도체 지원을 하신다면 꼭 보면 좋아요!,5,5,jimteen,2020-09-06,"상반기 반도체에 관한 아무런 지식도 없이 준비하였다가 쓰디 쓴 맛을 보았습니다. 하지만, 이번 하반기를 준비함에 있어 엔지닉 반도체 이론 완성편을 구매하게 되었습니다. 반도체에 관한 기초 이론이 없던 저였지만, 이 책이 초심자가 접근하기 좋을 뿐만 아니라 기초부터 심화 이론까지 탑재되어 있어 정말 알차게 공부할 수 있었습니다. 또한, 최신 트랜드 기술도 알 수 있었으며  면접 준비하는데도 무척 도움이 될만한 책이라고 생각합니다.",9791161980911
29,반도체 부문 취업준비 도서로는 최고!,5,5,때지,2020-09-05,스터디를 위해 책을 구매하게 되었습니다.전자전기공학부라서 아주 기초적인 반도체 지식은 있었습니다. 비록 공부안한지 2~3년이 다되어가서 남아있는게 거의 없었지만 천천히 따라가고자 스터디하면서 열심히 공부했습니다.솔직히 말하자면 이 책은 비전공자에게는 조금 어려운 내용이 많습니다. 전공자라도 기초적인 지식이 있어야 이해할 수 있는 내용들도 많아요.하지만 그걸 이겨내고 이해하려한다면 이만큼 좋은 책도 없다고 생각해요. 디테일이 상당하거든요.너무너무 좋은 책이에요ㅠㅠ,9791161980911
30,엔지닉 반도체 전공면접 책 리뷰,5,5,tkdgus1027,2020-09-04,"취업 준비하느라 신경쓸것도 많고 스트레스도 많이 받고 있었는데최근 이슈나 면접, 공정 전반에 대해서 써있는 책이라이 책 하나만 봐도 반도체 공정 직종에 지원할 수 있을거 같네요구성이 괜찮습니다.반도체에 관심 있으신 분들은 하나 사서 보셔도 괜찮고엔지닉에서 하는 스터디에서도 쓰이는 책이니까만약 이 걸 사시는데 스터디를 안하신다면 효율적인 공부를 위해 스터디까지 하시는걸 권장드립니다.",9791161980911
31,경쟁력 있는 최고의 반도체도서!,5,5,shim608,2020-09-04,여러 반도체 직무도서를 사서 공부해봤습니다. 하지만 현재 가장 자주 보고 있는 책은 단연 엔지닉 책입니다. 깔끔한 구성과 상세한 설명이 차별화된 점입니다. 반도체 공정공부가 막막했던 찰나 이렇게 좋은 책을 만들어 주셔서 감사할 따릅니다. 한편으로는 모두 이 책을 공부해서 입사경쟁이 심해질까 걱정입니다. 그 정도로 내용은 알차고 필요한 부분을 정확하게 설명하고 있습니다.,9791161980911
32,취업준비용 반도체 도서 중 최고!,5,5,jimilinia23,2020-09-04,스터디를 통해 책을 구매하게 됐는데 생각보다 내용이 깔끔하게 정리되어 있어서 놀랐습니다!이 책의 가장 좋은 점은 실제 면접 기출이 수록되어 있다는 점입니다면접기출을 보고 공부방향에 대해 감을 잡을 수 있고 비전공자가 보기에는 조금어려운 내용도 있지만 그만큼 디테일한 내용까지 수록되어 있습니다공부하다가 모르는 내용은 카페에 질문하는 것도 가능해서 전반적으로 매우 만족스러운 도서 구매였습니다,9791161980911
33,반도체 전공,5,5,-,2020-09-03,반도체에 대해 아무런 지식이 없었던 하반기 면접을 대비하여 공부하기 위해 책을 구매했습니다. 이 책을 구매하고 온라인 강의와 함께 공부한 뒤로 처음에는 이해하기 어렵고 힘든 부분이 있었지만 계속 꾸준히 2주간 공부하다보니 조금씩 반도체에 대해 이해하기 시작했습니다! 아직 한참 모자르지만 앞으로도 더 열심히 공부해서 완벽한 공정을 이해할 수 있도록 노력할 것입니다!,9791161980911
34,책 리뷰,5,5,kguuun,2020-09-03,"반도체 전공면접 합격의 모든 것 - 이론 완성편반도체 업계로 취업준비를 하기 위한 필독서 입니다. 개괄적인 내용부터 심화적인 내용까지 반도체 업계 입사준비를 위한 모든 것을 담았습니다. 전공자, 비전공자 누구나 맞춤형 학습이 가능하도록 단계별로 이론이 구성되어 있어서 이용자의 편의성에 초점을 맞춘 것으로 보입니다. 특히, 실제 전공면접 사례나 합격자 분석으로 지원자의 상황에 맞는 취업 가이드 라인을 제시한 부분이 인상깊습니다.",9791161980911
35,반도체 전공면접 합격 후기,5,5,fbsk75456,2020-08-31,"스터디 강의에 사용할 책을 찾다가 엔지닉 내용이 잘 구성되있고, 독학하기에 쉬울거 같아서 구입하였습니다. 내용별로 잘 되어있고 이해하기 쉽게 되어있는것 같습니다. 스터디와 병행하여 실력을 늘리기에 좋은 책인갓 같습니다. 그리고 글자가 작지 않아 읽기 쉽고, 공부하기 좋습니다! 면접 대비 책을 찾다가 다른 출판사와 고민하였지만, 엔지닉이 아무래도 내용이 더 잘 정리되어있고, 심화와 기본을 함께 다루어 더욱 유용한것 같습니다.!",9791161980911
36,반도체 도서 리뷰,5,5,꿀벌,2020-08-29,이번에 반도체 2주완성 스터디를 하게  되면서 이 책으로 강의를 들으면서 반도체에 대한 자세한 내용과 반도체에 다양한 공정들도 쉽게 설명이 되어 있고 글로만 설명을 해놓은게 아니라 그림으로 반도체 공정들에 대해 자세히 그려져 있고 책 한 권만 봐도 반도체에 대한 것들을 공부할 수 있었고 책 한 권으로 반도체에 대한 기본적인  지식을 알 수 있어서 좋았습니다. 책을 펼쳐보면 반도체 핵심 용어집이라는 작은 부록으로 된 책이 수록 되어 있는데 가지고 다니면서 봐도 될 정도의 크기로 유용하게 사용할 수 있습니다.,9791161980911
