,Title,ConRate,DesRate,Author,Date,Content,BookCode
304,거대한 분기점 - 폴크루그먼 外,3,3,짱가,2020-10-06,"세계에서 가장 영향력 있다고 인정받은 경제학의 권위자, 저널리스트, 유명 저술가 7명을 인터뷰한 책이다. (최배근 교수의 글은 원본 인터뷰와는 상관없이 한국출판본에서 추가된 내용임) 미래의 경제는 어떤 모습일까를 예측해보고자 한다면 그래도 제일 뛰어난 학자나 전문가의 전망을 들어보는 게 참고가 될 거다. 그런데, 과거 서브프라임 모기지 사태로 촉발된 2008년 세계 금융위기를 그 누구도 예상하지 못했듯 저명한 학자라고 해도 미래가 어떤 모습일지 예측하는 것은 아예 불가능할지도 모른다.  일단, ‘세계적인’이라는 타이틀을 달고 있는 전문가들의 특징은 나 같은 일반 독자에게는 그리 친절하지 않다는 거다. 개인적으로 만날 일이 없으니 그들의 사교성을 얘기하는 것은 아니고, 글과 말이 그렇다는 거다. 노벨상을 받거나 뛰어난 업적으로 이름을 날린 사람은 기본적으로 자신의 분야에 매우 전문적인 사람이다. 제너럴리스트로서 넓게 아우르기보다는 스페셜리스트로서 깊게 파는 쪽에 더 가깝다. 깊게 파기 위해서는 넓게 파기 시작해야 한다는 철학자(아마 스피노자던가?)의 말도 있지만, 전달하는 것은 아는 것과는 또 다른 분야니까 말이다. 나에게는 오히려 대중 저술가로서 인정받는 사람의 글을 읽는 것이 훨씬 유익하다. 그런 면에서 뛰어난 학자이기도 하지만 베스트셀러 저자로도 친숙한 장하준 교수나, 로버트 라이시와 같은 저자의 글을 선호한다. 그들도 전문가이기는 하지만 제너럴리스트의 면모를 가지고 있다. 대중들에게 어떻게 설명하면 쉽게 전달되는지를 잘 안다. 그리고 글이 재미있다. 그 분야에서 커뮤니케이터와 같은 역할을 하고 있다고나 할까. 그에 비하면 이 책은 재미가 덜하다. 게다가 이 책은 일본 인터뷰어가 진행한 내용이라 별로 관심 없는 일본 이야기가 책에 자주 등장한다. 7명의 경제 전문가들이 예측하는 미래 경제의 공통점을 들자면, 4차 산업혁명으로 인해서 일자리는 줄어든다. 남아있는 일자리조차 기존 제조업에서 보장됐던 안정적이고 괜찮은 일자리에 비하면 질적으로 떨어진다. 노동이 소외되고 위축된다. 제조업이 쇠퇴하면서 빈부의 격차가 커지고, 기업들의 실적도 소수에게 집중된다. 일자리가 줄어들면 개인의 소득이 감소하고 수요부족에 따른 불황에 빠지게 된다. 성장의 관점에서는 경제가 잘 굴러가지 않게 되는 것이다.  해법으로 제시되는 것이 ‘기본소득’인데, 이 이슈는 최근에 많이 쟁점화되어서 웬만한 찬반 의견은 다 외울 정도다. 반대하는 측의 논리는 기본소득을 도입하면 누가 일을 하겠느냐는 거다. 종일 티브이만 보거나, 놀 궁리만 하게 될 거라는 주장이다. 이에 대한 간단한 반론은 오히려 4차 산업시대에는 창조적 혁신이 괜찮은 일자리를 창출할 것이라는 거고, 창의성은 잘 노는 문화에서 오히려 싹이 트고 잘 자란다는 거다. 인류는 원래 놀면서 문화를 만들어왔고, 상상력은 놀이를 즐길 때 비로소 풍성해진다. 호모 루덴스, 놀이가 인간의 본질이다. 또 한 가지 의견으로 경제 성장이라는 신화에서 벗어나야 한다는 주장이 있다. 중세와 근대에 이르기까지 인류 역사 대부분의 기간 동안 경제성장이란 건 거의 없었다. 오히려 산업혁명 이후 지금까지 2백 년 동안 성장한 것이 인류 전체의 역사를 놓고 보면 예외적인 경우다. 어린아이가 육체적으로는 20세까지 성장하고 그 이후에는 더 이상 자라지 않듯이, 경제성장도 어느 시기까지는 지속되지만, 성숙해진 인류는 성장이 되지 않아도 충분히 다른 방식으로 잘 살아갈 수 있다. 오히려 경제성장으로 인해 신음하는 지구와의 관계를 회복하고 함께 살아가는 방법을 찾는 계기가 되지 않을까.",9791160075014
305,거대한 분기점,5,4,kkandol32,2020-08-29,"분기점이란 하나의 큰 길에서 여러갈래 나뉘어질 때, 그 지점을 분기점이라 말한다.그건 앞으로 잘 나가던 자동차가, 여러갈래의 길 위에서 지도나 방향성을 모를 때, 그로인해 생기는 문제들이 우리 앞에 봉착할 수 있으며, 분기점에 서 있을 때, 선택과 결정에 있어서, 중요한 판단이 필요하다.그건 경제도 마찬가지이며,사회도 마찬가지이다. 이 책에는 저명한 경제학자로 손꼽히는 폴 크루그먼, 토머스 L. 프리드먼, 최배근, 데이비드 그레이버, 토마스 세들라체크, 뤼트허르 브레흐만, 빅토어 마이어 쇤베르거, 타일러 코웬, 오노 가즈모토는 우리의 미래는 어떻게 바뀔 것이며,그 미래에 우리가 무엇을 준비하고, 무엇을 변화시켜야 하는지,중요한 방향점을 제시하고 있었으며,나에게 필요한 경제학적인 지혜와 통섭을 느끼게 된다.데이터, 그리고 기본소득, 이 두가지가 필요한 이유는 앞으로 인간의 노동력이 점차 줄어드는 시대로 나아가고 있기 때문이다. 굳이 인간이 직접 학습하지 않아도 되는 시간, 컴퓨터가 자동적으로 학습하고, 패턴을 읽어내는 시대가 우리앞에 놓여지고 있다.개미와 베짱이 우화 안에서 ,지금 우리가 선호하는 캐릭터가 개미라면,앞으로 미래엔느 베짱이를 선호하는 세상이 우리가 마주하고 있는 미래의 현실이다.홀로세가 지고, 인류세가 뜨게 되는 과정하나 하나 분석해 보면,우리가 무엇을 선호하고 무엇을 혐오하고 있는지 분석해 나갈 수 있으며, 창의성과 코딩을 선호하는 미래상, 우리 삶을 우리 스스로 현명하게 선택해야 하는 시대가 우리 코앞에 놓여지고 있다. 이제 우리는 일에 대해서 연연하지 않게 된다. 삶과 일의 균형감각, 적게 일하고,창의적인 일에 몰입하는 세상이 앞으로 우리가 마주하는 세상이다.그리고 노동력은 점차 줄어들지만, 그렇다고 모든 일자리가 로봇기술과 인공지능으로 대체되지 않을 것이다.바로 우리 앞에 놓여져 있는 인생의 분기점에서 우리의 최대의 고민이 일자리와 노동력인 이유는 여기에 있으며,현실적인 불안과 엮이면서, 우리 삶에 적응하게 된다.즉 이 책은 데이터 사회가 우리 삶을 어떻게 바꿀 것인지,경제학적인 지식으로 분석하고 있다.빅데이터 사회 안에서,우리의 기술력과 과학은 획기적인 변화를 겪게 된다.획기적인 전환점인 인새의 변곡점이기도 하다. 더군다나 코로나 바이러스 이후 우리 삶은 대면 접촉에서 비대면 접촉으로 바뀌고 있으며,새로운 삶과 새로운 인생을 추구할 가능성이 커져가고 있다. 삶 속에 여유로움이 느껴지지만, 그 안에서 우리가 감당해야 할 몫은 무엇인지 심도 있게 고민해야 하는 이유는 여기에 있다.",9791160075014
306,●충격! 코로나19이후 극적 전환이 없다면 공멸할 수밖에 없다... 거대한 분기점...●,5,5,북러브,2020-07-30,"""하루에 1시간밖에 일하지않는 사람도 있고, 심지어 일주일에 1시간밖에 일하지않는 사람도 있었습니다. 출근한 사무실에서 페이스북의 프로필을 갱신하거나 컴퓨터 게임을 하며 하루를 보낸다고 합니다. 바로 《Bullshit Jobs》 입니다. (75~76쪽)""나는 폴 크루그먼님 외 일곱분의 석학들께서 저술하시고 한스미디어에서 출간하신 이책 <거대한 분기점>을 읽다가 데이비드 그레이버교수께서 말씀하신 윗글에 신선한 충격을 받았다.아니 지금도 이렇게 회사에서 놀고 먹으며 지내면서 월급도 따박따박 받는건 물론 오히려 더많이 받아가는 관리직 사원들이 많이 있다니 정말 깜짝 놀랐다.그것도 21세기가 20년이나 지난 2020년인 이시기에...사실 우리나라를 보면 IMF 외환위기 전후가 우리나라 경제변혁의 전환점이었다.물론 IMF직전인 1990년대 초중반부터 우리나라에도 <명예퇴직>이라는 제도가 도입되어 회사들은 같은 동기들끼리도 끝없이 무한경쟁해야했다.그러다가 1997년 IMF 외환위기로 인한 구제금융신청으로인한 국가환란으로 산업구조 및 경제시스템이 확바뀌었다.특히, 기업들도 상시 구조조정과 희망퇴직, 금융권 퇴출, 기업인수합병 등이 계속 뒤따랐다.그후 김대중정부의 외환위기극복으로 한국경제는 어느 정도 회복국면을 넘어 정상궤도에 와있는데 영국 런던정치경제대학교 문화인류학과교수이며 월가 점거운동의 이론적 지도자로 유명하신 데이비드 그레이버교수께서 들려주신 윗글은 정말 충격적으로 다가왔다.아니 아직도 서구 기업들에서 저렇게 놀고 먹는 관리직 사원들이 있다니 정말 깜짝 놀랐다.예전에도 우리나라를 보면 점심식사후 자기 자리에서 꾸벅꾸벅 조는 부장, 외근을 핑계로 자리를 많이 비는 과장, 차장들도 많았다.또 심지어는 본사와 떨어져있는 공기업 직원들은 출근해서 TV보고 점심먹고 노닥거리다가 5시면 칼퇴근하는 경우가 많다고 들었는데...참으로 안타까운 기업현실들이었다.하인형폭력배형이삭줍기형관료형중간 관리자형이렇게 《Bullshit Jobs》도 5가지 유형이 있다니 정말 실소를 금할 수 없다.데이비드 그레이버교수께서 말씀하시길 앞으로 직업의 절반이 사라지고 저러게 놀고먹는 헛된 일자리가 늘어날 수도 있다하니 이에 기업들도 발빠르게 대처해 《Bullshit Jobs》가 안생기게 해야할 것이다.이제 그런 사원이나 임원들은 즉시 퇴출되는 세상이 되야할 것이다.인류는 지금 거대한 분기점에 서있다.무너질 것인가, 더 발전해나갈 것인가?코로나19까지 겹친 최악의 글로벌 위기속에서 붕괴되는 경제시스템, 중산층의 몰락, 직업의 소멸, 기본소득 논의까지 인류의 미래를 성큼 내다보는 세계석학 8인이 예측한 자본주의와 경제의 미래...정말 궁금하지않을 수 없었는데 222쪽에 달하는 이한권의 책으로 속시원히 알 수 있어 참좋았다.이렇게 이책은 세계에서 가장 영향력있다고 인정받는 경제학의 권위자, 세계를 깜짝 놀라게한 저술로 주목받고있는 신진학자와 저널리스트 등이 자본주의와 경제의 미래를 전망한 논설집이다.나는 폴 그루그먼 등 8명의 저자께서 저술하시고 한스미디어에서 출간하신 이책 아주 잘읽었다.나는 특히 홀로세가 끝나고 인류세가 시작된다는 토머스 프리드먼, 테크놀로지가 노동자의 격차를 벌린다는 타일러 코엔, 기본소득과 하루 3시간 노동이 사회를 구한다는 뤼트허르 브레흐만, 코로나19는 근대 산업문명의 수명소진을 확인시켜주었을뿐, 극적 전환이 없다면 공멸할 수밖에 없다는 최배근 건국대학교 교수님의 말씀 등이 더욱 확와닿았다.글고 요즘은 코로나19로 더욱 변화난측의 시대가 되고있다.그런 의미에서 코로나19가 전세계를 휩쓸고있는 이시기에 세계 석학 8인이 자본주의와 경제의 미래를 어떻게 전망하고 있는지 궁금한 분들께서는 이책 놓치지않고 꼭읽어보시길 권유드리고싶다.지금도 생각나네...격차의 원인을 경제학이 아니라 정치의 문제에서 찾아야한다는 폴 크루그먼님의 다음의 말씀이...""그는 부의 집중완화, 저소득층에 대한 사회안전망 강화, 부유층에 대한 과세강화 등은 민주주의와 정치강화로 해결할 수 있다고 역설했다.(209쪽)""#거대한분기점 #폴크루그먼 #한스미디어#데이비드그레이버 #폴크루그먼 #최배근#코로나19 #김대중",9791160075014
307,거대한 분기점,4,3,umba,2020-07-23,"미국에
정통한 국제 저널리스트 오노 가즈모토씨가 세계적인 석학들과 나눈 인터뷰를 정리한 책입니다. 일본에서
발간되었을 때의 제목은 「Mikan No Shihonshugi 미완의 자본주의」입니다. 거대한 분기점이란 제목도 나쁘지는 않지만, 저자가 노린 것은 지금의
자본주의 체제에 대한 세계적인 석학들의 생각에 포커스를 맞췄습니다. 이 어려운 분들을 모시고 나눈 대담집의
정리이지만, 지금 한국에서 벌어지는 일들이 지구상의 소위 선진국이라는 국가들이 모두 함께 고민하는 문제이기에
그렇게 먼 주제들이 아니기 때문에 책은 오히려 재미있습니다. 흥미진진합니다. 
24살
대학교 재학시절에 체코 초대 대통령 바츨라프 하벨의 경제고문으로 선정되시고, 2006년 예일대학의 「예일
이코노믹 리뷰」에서 가장 촉망받는 경제학자 5명중 한 명으로 선정되신 토마스 세들라체크 교수님과의 인터뷰를
담은 제 4장에 기억에 남는 구절이 있어 인용해 봅니다. 
Q. 당신이 생각하는 가장 이상적인
자본주의는 어떤 모습입니까.A. 사고 나서도 아주 만족하는
상품 같은 상태가 이상적입니다. 불만도 없고 반품할 생각도 없는 그런 상품이요……. 개인적으로 완벽한 천국이란 누구나 게임을 즐기는 사회가 아닐까 합니다. 우리
인간은 경쟁하는 것을 좋아합니다. 자본주의라서가 아니라 모든 일이 그렇게 돌아가죠. 스키든 음악이든 누가 최고이고 누가 팬이 많은지 경쟁하지요. 두
아이를 방에 두면 무언가 경쟁을 시작합니다. 이것은 경제학과 아무런 관계가 없는 일이예요. 
+우리가
지금처럼 손에 핸드폰을 손에 쥐고 다닌 지 약 25년 가깝게 흘렀습니다. 그 사이 매년 핸드폰은 새로운 모델이 나왔고, 이제는 전화기인지, 카메라인지, 노트북인지, 게임기인지
알 수 없는 제품이 되었습니다. (TV광고만 놓고 보면 전화가 되는 카메라인 듯 합니다) 단순한 제품 하나도 완성의 끝을 알 수 없는데, 반품할 필요가 없는
상품 같은 자본주의, 과연 누가 어디까지 상상이 가능할까요. 게임을
즐기는 사회란 답은 범인들에게는 오히려 반전에 가깝습니다. Respect!!! 모든 나라는 모두 같은
문제를 갖고 열띤 토른을 하고 있습니다. 이론은 많습니다. 어느
이론도 틀린 것 같지 않습니다. 확실한 것은 이제 나이와 상관없이 계속 공부해야 시대인 것은 분명한
것 같습니다.",9791160075014
308,거대한 분기점,5,5,chochma3,2020-07-22,"코로나19가 한창 폭발적일 때도 이만큼 큰 영향을 줄지 몰랐다. 언제나처럼 그 시기를 잘 넘기면 곧 잊힐 거라 생각했는데 이제는 더 이상 코로나 이전으로 돌아갈 수 없게 되었다니 예기치 못한 상황에서 여전히 혼란스럽기만 하다.코로나로 순식간에 생활패턴이 바뀌고 오랜 시간 지켜온 시스템이 변화하고 있다. 이후 변화에 집중하다 보니 알게 되는 것들.지금의 시대는 그 외에도 다양한 변화를 준비해야 할 시기다.8인의 석학이 예측한 자본주의와 경제의 미래.평소 익숙지 않은 영역이지만 코로나 이후 실감하는 사회 변화에 놀라면서 보지 않았던 세상 이야기에 자연히 관심을 가지게 되었다.국제 저널리스트 오노 가즈모토가 세계적으로 인정받는 석학 7인과 자본주의와 경제에 대한 인터뷰를 수록해 놓은 책이다. 스페셜 챕터로 경제학자인 최배근 교수의 종합적인 견해를 들을 수 있다.세계의 흐름과 변화, 그리고 발전방향에 대한 석학들의 의견을 한 권에서 만나볼 수 있어 아주 유익하고 새로웠다. 무심코 지나치는 또 다른 세상이 이렇게 펼쳐지고 있구나 또 느끼게 된다.2008년 노벨 경제학상을 수상한 폴 크루그먼.AI로 인한 대량 실업문제는 현재의 로봇 생산성을  고려했을 때 아직 먼 미래의 일이다.세계적으로 문제가 되는 부의 편중은 적정한 임금 보장(선분배))과 세금과 자본이전(재분배)으로 해결해야 하기에 경제가 아닌 정치 문제. 토머스 프리드먼은 현대 세계는 평평할 뿐만 아니라 빠르고 스마트해졌다고 한다.초연결, 기술발전이 가속화된 테크놀로지 시대에 살아남으려면 평생학습자가 되어야 한다. 부의 격차 완화를 위해 근로 소득세 공제액을 늘리거나 평생학습자가  될 수 있는 도구를 제공하는 방법으로 부를 재분배할 증세가 필요하다고 주장한다.문화 인류학자 데이비드 그레이버.기계화되며 오히려 무의미한 일이 늘어나고 있다. 자신이 하는 일에 사회적 가치를 느끼고 못하고 전체적인 생산성은 떨어뜨리는 고위관리직이 대개 여기에 해당한다.Caring Labor(남을 돌보는 노동)에 대한 정당한 보수가 보장되어야 한다. 자동화가 진행될수록 더 요구되는 일이 케어링 레이버다. 일의 소중한 의미가 무엇인지 되짚어봐야 할 때.체코공화국 경제학자 토마스 세들라체크.그의 책 《프로이트의 소파에 누운 경제》에서 자본주의를 정신분석학 이론으로 풀어간다.자본주의의 문제는 인간의 탐욕과 안 좋은 본성에 있으며 정신과 영혼을 무시한 경제학의 결함이 문제를 일으키고 있다고 지적한다.육체는 실물경제, 영혼은 법률이나 화폐 같은 제도, 정신은 무언가를 원하는 것.가격을 붙일 수 없는 것을 숫자로만 계산하면 오류가 생긴다. 성장을 전제로 한 경제학은 잘못된 설계로 이어지고 사회를 붕괴시킬  위험에 빠지게 된다.인간의 선의가 실현되는 본성을 기반으로 경제를 이해할 수 있어야 한다. 경제학자인 타일러 코웬은 테크놀로지 실업에 대해 'AI의 도입으로 발생하는 가장 큰 위험은 기술 보유 여부에 따라 격자가 벌어지는 것이다. 고용 기회가 줄어들 것이라는 점은 그렇게 걱정하지 않아도 된다.'라고 한다. 역사적으로 어느 시기라도 50년, 100년 단위로 기간을 잘라보면 경제가 성장할수록 많은 일자리가 사라지고 다른 일자리로 대체되었다.지금 세계에서 가장 주목받는 젊은 논객, 뤼트허르 브레흐만은 사람이 AI나 로봇과 경쟁하고 격차가 벌어지는 시대에서 기본소득과 하루 3시간 노동이 필요하다고 한다.기본 소득을 주제로 많은 과학적 실증 작업을 통해 인간은 빈곤선을 넘어서면 돈을 효율적으로 활용한다는 사실을 확인했다. 노동시간이 짧을수록 자원봉사 활동에 참여하고 어린아이나 고령자를 돌보고 예술 분야에서 활약하는 사람이 많다. 인생 최대 과제는 '삶의 의미'를 찾는 것이다.미래의 교육은 '어떻게 의미 있는 삶을 살 것 것인가'를 가르치고 더 좋은 삶을 살기 위한 준비를 해야 한다.빅데이터 연구 분야의 세계적인 권위자인 빅토어 마이어 쇤베르거는 데이터 자본주의를 제시한다.모든 알고리즘이나 기계 학습 시스템도 인간의 행동을 기반으로 한 데이터라 어떤 종류든 편향되어 있다. 자신의 편향을 수정하지 않으면 컴퓨터가 사람보다 더 현명한 결정을 하기 어렵다. 데이터 중심 시장에서는 가격보다 매칭이 중요. 추천 기능이 매칭 구조다. 아마존 데이터를 개방하면 스타트업이 늘어나고 시장도 지금보다 훨씬 나이질 것이다.스페셜 챕터에서는 경제학자 최배근 교수가 세계 경제를 진단하며 앞서 나온 석학들의 이론에 대한 견해도 제시한다.어려울 것 같았지만 의외로 술술 잘 읽힌다.세계 경제의 새로운 패러다임을 읽으며 일깨워주는 게 참 많았다.한 번 더 읽어야겠지만 일독만으로도 새로운 세계를 경험할 수 있었다.",9791160075014
309,거대한 분기점,4,4,마니,2020-07-20,"코로나19로 전 세계가 멈추며 거대한 분기점을 맞이하고 있다. 코로나19이전에도 저성장, 소극 불균형, 고령화, 인공지능과 빅테이터를 이용한 신기술의 영향으로 세상은 큰 변화를 맞고 있다는 예측들이 있었지만, 전문가들의 영역이라고 였다면, 코로나 이전과 이후라는 말이 나올 정도로 코로나는 세상이 변하고 있음을. 세상이 어떻게 바뀌어야 할 것인지에 대한 생각을 일반인들에게도 심어주고 있다. 경제부양책으로 세계 각국에서 시행하고 있는 재난지원금은 기본소득에 대한 필요성을 불러왔고, 비대면 접촉이 일상이 되면서 화상진료와 같은 IT 기술을 활용한 서비스가 본격적으로 논의되기 시작했다. 질병 하나가 이렇게나 많은 변화를 불러일으킨다는 사실이 놀랍기만 하다.코로나로 인해 그 변화가 가속화되고 있음은 사실이지만, 많은 석학들은 이미 이런 변화들을 예측했다. 책은 다양한 배경과 전문지식을 가진 폴 크루그먼, 토머스 프리드먼, 데이비드 그레이버, 토마스 세들라체크, 타일러 코웬, 뤼트허르 브레흐만, 빅토어 마이어 쇤베르거이. 최배근. 이렇게 8명의 석학들이 내놓은 자본주의가 어떻게 변화할지에 대한 예측을 들려준다. 흥미로운 것은 그 예측이 모두 다 같은 방향은 아니라는 점이다. 앞서 언급한 기본소득에 대한 문제도 그렇다.얼마 전까지만 해도 전 국민에게 최소한의 소득을 보존해 주는 것에 대해 대다수의 사람들은 회의적이었다. 폴 크루그먼 또한 보편적 기본소득에 대하여 막대한 비용 문제로 반대 의견을 제시했다. 반면 데이비드 그레이브는 보편적 기본소득으로 무의미한 일자리를 없앰으로써 좀 더 가치 있는 일을 할 수 있는 환경을 만들어야 한다고 주장했다. 이 주장을 AI가 인간의 일자리를 빼앗아간다는 우려와 맞물려 생각하면(물론폴 크루그먼 교수는 그런 일은 절대 일어나지 않을 것이라고 단언하지만) 시사하는 바가 크다.토머스 프리드먼의 주장도 눈여겨 볼만하다. 그는 가속화하는 시대에 살아남으려면 평생 학습자 능력이 중요함을 강조한다. 평생직장이 사라진 것은 물론. 빠르게 변화하는 시대에 적응하기 위해서는 모든 노동자들은 끊임없이 공부하고 훈련해 변화에 적응해야 생존할 수 있다는 의견이다. 변화를 거스를 수 없다면 준비하고 적응하는 것이 최선일 것이다.전 세계적으로 고착화되고 있는 빈부격차와 부의 재분배에 대해서는 경제논리보다는 정치논리로 접근해야 한다는 의견도 눈여겨봐야 한다. 즉 개인이 아닌 시스템의 문제로 접근해야 해결책을 찾을 수 있다는 말이다. 기본소득(혹은 사회 배당금)처럼 국가가 어느 정도의 삶을 유지하게끔 보장해 주고, 사람들은 평생 개발자가의 자세로 더 의미 있는 일자리를 찾고, 의미 있는 활동에 집중하며 삶의 질을 높여야 한다는 주장. 어떤가. 매우 공감 가는 주장이지 않나.변화할 것인가. 도태될 것인가. 거대한 분기점 앞에서 어떤 길을 선택할지는 우리 모두의 고민이다. 분명한 것은 더 나은 삶을 위한 고민과 결단이 필요한 시점이라는 것이다.전문가들의 의견을 모은 책이지만, 인터뷰방식이라 어렵지 않게 읽어나갈 수 있다. 각각의 견해는 다르기도 하고, 같기도 하지만, 공통점은 모두 삶의 질에 집중해야한다는 의견이다. 그냥 ""잘"" 사는 것보다 ""어떻게""에 방점이 찍힌 의견들. 충분히 의미있는 답변들이다.#거대한분기점 #한즈미디어 #경제",9791160075014
