,Title,ConRate,DesRate,Author,Date,Content,BookCode
19,[서평] 일본에서 한 달을 산다는 것,5,5,yachi,2019-07-03,"해외 여행을 하다보면 짧은 기간안에 많은 곳을 둘러봐야한다는 욕심에, 여행을 며칠 마치고 돌아오면 늘 아쉽고 몸은 힘들었었다. 누구나 마찬가지기에 몇년전부터 한달살기가 유행처럼 되어버린것같기도 하다. 가깝게는 제주 한달살기부터 일본,치앙마이, 하와이, 뉴욕 등 여러 관련 책들을 구경한 적이 있다.그 중에서 일본은  요모조모 고려해볼때 가성비 좋은 ,한달살기에 좋은 곳이라는 생각이 든다.책 속에서 20명의 저자가 있는데, 다양한 한 달의 기록을 전해주고 있다. 어학연수를 하거나, 유학을 하거나, 워킹 홀리데이를 하거나 첫 한 달의 기억은 누구에게나 선명하다.그중 디지털 노마드에 걸맞는 프리랜서는 번역가나 디자인 관련 일을 하는 사람들로 노트북을 가지고 도쿄의 스타벅스나 이쁜 카페에 들어가 일하고 돈도 벌고 여행도하고 정말 이상적이라는 생각이 들었다. 또 추천하고픈 케이스는 대학생활중 교환학생으로 가서 현지 대학교에서 공부도하고 일본어도 익히면서 현지인처럼 살면서 여행다니기였다. 돌이켜보면 나의 대학생활은 열심히사는듯하면서도 허술했고 아쉬움과 허점이 많이 남았던듯하다.일본 한 달살기, 직장인신분이라 이젠 정말 언제 실현될지 알수 없는 로망이 되어버렸지만 관광객과 현지인의 중간에 걸쳐져있는 그 자유로움이 문득문득 생각날것같다.참, 책속  곳곳에 숨어있는 팁들이 있어 숙소 구하기나 일본어 학습에 관한 방법, 일본인 친구 사귀기의 노하우 등 활용할 수  있는  다양한 길이 소개되어 있어 알찬 느낌이 든다.",9791187316497
20,꼭 가보고 싶네요. 일본 한달살기,5,5,수친니,2019-07-03,36개월 12개월 두 아들맘인데요. 학생 때부터 일본에서 사는 것이 꿈이었어요. 하지만 현실적으로 불가능했고 지금은 두 아이 엄마이자 회사원으로 살고 있는데 항상 가슴 한 켠에 지난 내 꿈이 새록새록 떠올라 지금이라도 이루고 싶다는 생각이 들어요. 그래서 일본 한달살기를 목표로 세우고 준비중인데요. 이 책을 읽으며 용기를 얻고 나도 꼭 해야지 라는 다짐과 각오를!!! 넘 기분좋아지는 책입니다.,9791187316497
21,일본에서 한 달을 산다는 것,5,5,책은사랑이다,2019-07-02,"일본에서 한 달을 산다는 것     일본에서 한 달을 산다면 어떨까? 나는 사실 이렇게 생각한 적이 많았다. 왜냐하면 일본이 방사능이 있지만 방사능이 높지 않은 지역으로 가면 괜찮고 중요한 건 미세먼지를 피할 수 있다는 것이기 때문에 일본에서 살고 싶은 마음이 들었던 적이 있었다. 지금도 이것은 유효하다. 단지 형편이 안돼 못가는 것일 뿐이다.     이렇게 일본에서 한 달을 살아본 20명의 한국 사람들이 이 책에서 나와 여행과 일본에서의 이야기를 펼친다. 이 책을 보면 일본에 가고 싶다는 생각도 할 것이고, 아니면 잠시 고민하는 사람도 있을 것이다. 시종일관 이 책의 메시지는 일본에 살면서 여행하는 것이 나쁘지 않다는 것이다.      물론 자잘한 어려움들이 있을 것이지만 그것은 일본에서 사는데 있어 아무것도 아니다. 이 책을 보고 있으면 잔잔한 일상속에 일본의 풍경이 들어온다. 유학으로 온 학생부터 일적으로 온 사람들 여행자로 온 사람들 각기 일본에서 한 달을 산다는 것의 이야기를 풀어가는 이 책은 참으로 매력적인 일본으로 다가온다.     우리와 비슷하지만 비슷하지 않은 일본을 알기 위해 한 사람이 아닌 20명의 한국인들이 일본에서 겪은 이야기들을 묶어 말해주기에 여행 그 이상의 모습들을 확인할 수 있다. 도쿄 오키나와 히로시마 교토 이바라키 고베 와카야마 대마도 다양한 지역들에서의 일본의 이야기는 설레게 하는데 부족함이 없다.     우리는 일본여행을 하고 돌아온 이야기 일본에 유학간 이야기는 많아도 일본에서 일하며 또는 일본에서 잠시 사는 이야기는 잘 들어보질 못했다. 그들의 기질과 인간에 대한 기본 예의와 타인에게 피해를 주지 않기 위한 일본 특유의 개인주의 특성을 고려하면 여기에 부합하는 많은 국내인들이 있을 것으로 보인다.     아무튼 일본에서 생활을 하고 싶은 이들에게 오랜만에 추천하고 싶은 책이라는 건 분명하다. 나 또한 오키나와를 비롯 홋카이도를 가고 싶은 마음이다. 일본 시골에서 살아보고 싶은 마음도 당연히 든다. 누구도 줄 수 없는 삶의 정보들과 일본에서 일을 하며 살아가는 도움을 미리 확인하고 준비할 수 있는데에도 이 책은 도움이 많이 된다.",9791187316497
22,일본에서 한 달을 산다는 것,5,4,사이,2019-07-02,"우리나라에서 제일 가깝고 여행을 많이 가는 나라 일본.저는 예전에 일본에서 어학연수를 보내고 한국이 너무 그리워 왔지만 문득 일본 생활이 그리울 때가 많아요.그래서 몇 년 전에는 일주일 동안 게스트하우스에서 지내면서 이곳저곳을 혼자 돌아다녀 봤는데일주일은 확실히 시간이 촉박하다는 걸 알았답니다.아직 일본은 무비자로 3개월까지 체류할 수 있어 편하게 머물다 가기 좋은 곳 같습니다.너무 궁금하여 택배가 오자마자 뜯어서 보게 된 책인데요.  이 책은 독특한 게 저자가 여러 명 있다는 것이 남달랐습니다.각각 일본의 한 지역이 아닌 오사카, 도쿄, 오키나와, 와카야마, 대마도, 히로시마 등다양한 곳에 지낸 이야기가 펼쳐지고 단편식으로 들어있습니다.책 제목이 일본에서 한 달을 산다는 이야기이길래 작가들이 한 달 살았던 이야기인 줄 알았으나한 달, 이주, 일 년, 삼 년 다양하게 살았던 분들의 이야기를 모아둔 것이었어요.처음에는 한 달 산 사람만 모아서 추려 글을 옮기려고 했으나얼마나 머물렀냐가 큰 의미가 없다는 생각이 들었다고 합니다. 한 달 이상 머무는 여행에서는 관광객도 아니고 그렇다고 완벽한 현지인도 아닌반쯤 걸쳐져 있는 생활을 경험할 수 있습니다.마치 그곳에 살고 있는 사람이 된 듯한 기분도 느껴진다고 합니다. 책에서 특히 부러웠던 부분은 프리랜서로 일을 하면서 일본에 갔었던 이야기입니다.보통 일본에 살면은 일을 그만두고 가는 게 일반적인데 프리랜서의 장점을 살려 거기서도 일을 계속하면서생활을 하는 게 참 부럽고 보기 좋았어요.나도 그렇게 생활해보고 싶었어요~   어떤 분은 오키나와에서 살아본 글이 있었는데 그분은 처음에 게스트하우스에 살다가거기서 일하는 스태프 중 한 명이 일본어로(한국인 싫어)라는 이야기를 옆에서 듣게 되어서그 게스트 하우스에서 갑자기 생활이 불편해지고 일본 생활이 급격히 하기 싫어진 경우도 있다고 합니다. 또 오키나와에는 차가 없으면 절대 일상생활이 불편하다는 것!음식은 대부분 맛이 없었고~~ 매일 이만 보 이상 걷는 생활을 해서 그다지 행복해 보이지 않았던 글도 있었어요.이 책은 일본에서 한 달을 살아보면서 좋았던 가게나 일본인 친구를 사귀게 된 계기.살면서 느낀 점들을 고스란히 전달이 되는 책이라 저의 일본 생활이 더욱 그리워지게 되더군요.지금은 당장 한 달을 사는 게 어려울지 모르지만 조만간 일본에서 한 달 살기를 실천해보려고 합니다.  우선 이 책에서 알려주는 건 다양한 가게를 혼자 들어가 보거나 뭔가 해보는 것!일본어를 잘 하지 못하지만 혼자 당당하게 메뉴를 주문하는 자신감이 필요해 보였습니다.그러고 보니 혼자서 색다른 가게에 가서 뭐를 시켜본 적이 없는 거 같아요.그래봤자 규동 집에 가서 혼 박하고 오는정도..ㅎㅎㅎ책에는 좋은 점만 적혀있는 게 아니고 단점과 주의해야 할 점 등 일본에서 살기 전에 읽어두면정말 좋은 책인 거 같아요. 직접 겪어보지는 않았지만 책을 통해 간접적으로 일본에 다녀온 느낌이 들어서좋았고, 다양한 작가의 글 스타일이라 지루하지 않게 읽을 수 있었습니다.예전에 일본 살았을 때의 좋은 점만 기억이 났는데 이 책을 보니""아 맞아 이런 게 참 안 좋았지~""라는 생각도 떠오르고 했어요 ㅎㅎ그래도 가깝고 가격도 그리 비싸지 않아 한 번쯤 한 달 살기에 도전하고 싶은 나라이긴 해요.읽어보니 일본에서 한 달 사는 게 아니더라도 잠시 여행을 떠나는 사람에게도잘 알려지지 않은 장소와 현지인 맛집을 알 수 있어 도움이 많이 될 거 같아요.책 재질도 좋고 경험을 바탕으로 쓴 일기 같은 느낌이라 술술 익혀서 일본에 관심 있는 분도 부담 없이 볼 수 있을 거 같습니다~",9791187316497
23,일상같은 여행,5,5,bluemel,2019-07-01,"표지에도 써있지만 많은 이가 바라는 로망같은 삶을 시도한 사람들이 있다. 그 용감하고 부러운 스무명의 글이 책으로 만들어졌다.직업도 다르고 나이도 성별도 다른 이들. 직업상 업무적으로 간 사람, 어학연수, 일본 생활에 대한 동경, 일본에 대한 궁금증과 호기심, 버킷리스트 등 저마다 이유와 목적도 다 다르게 그들은 일본을 택하고 그곳으로 갔다. 도쿄, 오키나와, 오사카, 고베, 교토, 대마도, 와카야마, 이바라키, 히로시마 등 일본의 각지에서 그렇게 그들은 자신들의 일상같은 여행을 한다. 실제로 한달만 살고 온 사람부터 한달의 계획이 수년째 이어지는 사람까지 남의 나라에서 이방인으로 겪은 20인20색의 이야기들.그래서 20개의 단편소설을 읽는듯 배경만 일본일 뿐 글의 느낌과 색깔은 모두 다르다. 그들의 한 달은 각양각색으로 바쁘게 지내다 온 이가 있는가 하면 힐링하듯 지낸 사람도 있다. 흡사 옴니버스 영화를 보는것 느낌이다.그들의훌훌 떠날수 있음에, 실제로 그것을 실행해 낸 그들의 용기가 대단하기도 하고 색다른 일상들이 부럽다. 책을 읽으면서 나도 떠나고 싶다는 충동을 일으킨다.예전 다녀왔던 일본 여행의 추억들이 떠오르기도 한다. 아주 짧은 기간 철저히 관광객인 이방인으로 보고 겪은 내 경험은 이들과는 다르다. 반쯤은 현지인처럼 지낸 이들은 보다 그들속에 들어가 있다. 그래서 생동감이 느껴진다.하지만 어쩔수 없는 이방인의 한계도 느껴진다. 태어나고 자라지 않은 이상 타국에서 온 사람일수 밖에 없는 한계.그래도 참 부럽다는 생각을 들게 한다.",9791187316497
24,일본에서 한 달을 산다는 것,5,5,하늘땅,2019-07-01,"여행은 늘 소망이자 그리움이다.거기다 여행지에서 한 달을 살아 보는 것은 꼭 이루고 싶은 버킷리스트이기도 하다.이번에 <일본에서 한 달을 산다는 것> 이 책을 읽으면서 미리 일본에서 한 달을 살아보는 간접 체험을 한 느낌이 들었다.   무엇보다 '여행같은 일상, 일상 같은 여행' 이라는 이 책의 부제가 참 맘에 들었다.기회가 오면 우선 저지른 다음 고민하라는 조언도 확~!!! 마음에 와 닿는다..늘 마음과 달리 행동으로 이어 지지 못하는 지라 더 그런가 보다..ㅠㅠ<일본에서 한 달을 산다는 것> 이 책에서는 프리랜서 번역가, 취업 준비생, 그래픽 디자이너, 한국어 강사, 디지털 노마드 등 20인의 저자들이 한 달에서 12년까지 실제 체류 기간도 제각각이지만, '한 달 살기'를 했던 그 순간의 이야기를 풀어내고 있다. '한 달 살기'는 일상과 여행 그 중간 어딘가에 있는 것 같다는 어느 여행자의 말처럼 낯설음을 익히고 여행같은 일상의 기회를 찾아 누리는 맛을 즐기면 된다.원데이 클래스를 통해 일본 생활를 풍성하게 즐길 수도 있고 고베와 같은 도시에서 다도를 즐기며 슬로우 라이프를 느껴보는 것도 좋다.아니면 언젠가 가보고 싶은 곳을 가 보거나, 마음 속 고향같은 곳에서 그리운 사람을 만나 추억을 되짚어 보는 그들의 여행같은 일상이 새롭게 느껴지기도 했다.일본 직장인처럼 살아 보기 위해서 일본 직장인이 많이 모여사는 지역 카페에 자리잡고 일을 하며 현지인의 일상을 경험하기도 한다.오키나와 한 달 살기에서는 '나하'지역에서 겪은 불편함과 부정적 경험도 있었지만, 그 것을 상쇄할만한 이국적인 자탄, 아기자기한 요미탄 등 오키나와의 다양한 매력을 새삼 느낄 수 있었다.특히, <일본에서 한 달을 산다는 것> 이 책에서는 도쿄, 오사카, 쿄토, 고베, 이바라키, 오키나와, 대마도 등  체류지역도 다양해서 일본 여행지 선택을 하는 데에도 그들의 한달 살기 경험들이 많은 도움이 되었다.도쿄가 그렇게 서울 느낌을 가지고 있는 줄 처음 알았고, 생활비와 학비를 충당하면서 일본 유학을 할수 있는 곳도 도쿄라는 것도...진짜 돈 없어도 자신의 힘으로 일본 유학이 가능 하다니.. 놀라웠다.암튼, 살아보면서 경험해야만 알 수 있는 그런 현실 정보도 있어서 아주 유익했다. 확실히 여행지에서의 '한 달 살기'가 주는 여유와 일상 경험들은 짧은 여행에서 느낄 수 없는 소중한 경험을 주는 거 같다.그래서 '한 달 살기'가 어느 새 1년이 되고, 4년이 되고.. 또 그렇게 12년이 되는가 보다......  ‘이 포스팅은 해당업체로부터 도서를 받아 주관적으로 작성한 후기입니다’",9791187316497
25,일본에서 한 달을 산다는 것,5,5,어린왕자꿈을,2019-07-01,"낯선 곳에서 한달살이가 유행이고 나 역시 로망을 가지고 있지만 일본에 한 달을 산다고 생각해보지 않았다. 몇 번 여행해봤고, 아무리 가깝고 친숙한 나라지만 글쎄. 당장 머릿속에 떠오르는 숙박비, 교통비 생각에 절레절레. 아는 사람이 있지 않는 한 한달살이는 불가능할 것 같은데?그런데 이 어려운걸 해 냅니다.[일본에서 한 달을 산다는 것]은 20명의 작가가 일본에서 한달살이한 경험을 토대로 쓴 여행 에세이다. 도쿄, 오키나와, 오사카, 고베, 교토, 대마도, 와카야마, 이바라키, 히로시마 등일본 구석구석 이야기를 20개의 시선으로 볼 수 있다. 성별, 처한 상황이 다르고, 문체도 제각각이라 읽는 재미가 쏠쏠하다.예전엔 여행 가이드북을 보면서 가고 싶은 곳을 정하고 정보를 얻었는데 최근 들어서는 여행 에세이를 보면서 뽐뿌를 받는다. 20대에 읽었던 여행 에세이가 몇 권 떠오른다만 제목과 표지 정도만 떠오를 뿐,그 안의 내용은 1도 기억이 안 난다. 헌데 지금 감성으론 그렇게 지나간 책들도 다시 보면서 작가의 시선으로 보는 여행지를 느껴보고 싶다.[일본에서 한 달을 산다는 것] 안에 대단한 여행 정보는 없다. 허나 진짜 사람 사는 일본 느낌이 가득하다. 동네 이자카야 사장님의 기억력, 어학원 기숙사에서 전기, 가스료를 정산하는 방식, 자전거 전용 주차장이 유료라니! 같은 시시콜콜한 디테일 쩌는 이야기들을 만날 수 있다.'여행과 일상을 교묘하게 섞으면 어떤 느낌일까?' 이 물음을 잘 표현해놓은 책이라고 하고싶다. 궁금하면 기꺼이 펼쳐들고 읽어보라.",9791187316497
26,[서평] 일본에서 한 달을 산다는 것...세나북스,5,5,유미,2019-06-30,"*해외에서 한 달 살기가 유행이다. 실행에 옮기는 사람도 있고, 사정이 여의치 않은 경우는 한달 살기를 하는 사람들이 만들어내는 콘텐츠로 대리만족을 하기도 한다. 내 주변에도 실제로 유럽이나 동남아 지역에서 한 달 동안 지내고 온 분들이 있다. 아쉽지만 나는 후자에 속한다. 시간은 있으나 자금이 없다...;ㅁ; *만약에 내가 해외에서 한 달 살기를 한다면 지역은 당연히(!) 일본, 그 중에서도 도쿄가 될 것이다. 약 10년 전 워킹홀리데이로 1년이 좀 안되는 시간을 도쿄에서 보냈고, 이후 여행으로 두 번 도쿄에 방문했다. 도쿄 여행을 갔을 때는 두 번 모두 5박6일의 일정을 택했는데, 짧았다. 흔히들 도쿄 여행은 2박3일 정도가 적당하다고 하는데, 나에게는 짧고도 짧았다…;ㅁ; 출발 전에는 나도 5박6일 정도면 넉넉하겠거니 생각했는데, 역시 짧더라. 그럼 얼마 정도의 기간이 적당한가를 생각했을 때 내린 결론이 한달이었고, 그래서 다들 해외로 한 달 살기를 하러 가는구나 싶었다. 물론 실제로 실행할 수 있을지 여부는 별개의 문제다. ㅠㅅㅠ. *일본 여행에 대한 갈증은 블로그에 올라오는 여행기나 워킹홀리데이 생활 포스팅으로 조금이나마 해소하고 있다. 보통 사진과 함께 글을 올려주시기 때문에 어느정도는 대리만족이 된다. *-ㅅ-* 그러던 차에 세나북스에서 '일본에서 한 달을 산다는 것'을 출간한다는 소식을 듣고 이건 꼭 읽어야겠다는 생각을 했었더랜다.  ㅅ *<일본에서 한 달을 산다는 것>에는 작가 20분의 한 달 살기 기록이 담겨있다. 모든 작가분들이 딱 한 달 동안만 일본에서 생활한 것은 아니다. 한 달만 일본에서 산 경우도 있지만, 예전에 장기간 일본에 머물렀다가 다시 한 달 살기를 한 경우도 있고, 워킹홀리데이를 가서 한 달째 되는 시점에 원고를 작성한 경우, 수년째 일본에 살고 있지만 매달 한 달 살기 같은 기분으로 살고 있는 경우 등 다양한 케이스가 있다. 지역도 도쿄, 교토, 오사카, 히로시마, 이바라키 등으로 다양하다. 당연한 말이지만 일본이라는 나라에는 다양한 도시가 있고 각 도시들은 각각의 매력을 지니고 있는데, 이 책을 통해 여러 도시의 매력 포인트를 조금씩 엿볼 수 있어서 좋았다. (p.14) 프롤로그현대인의 가장 큰 문제는 자기 자신을 찾지 못한다는 데 있다. 내가 진정 원하는 것이 무엇인지를 깨닫는 순간, 그동안 우리를 괴롭히던 많은 문제는 저절로 해결된다.한 달의 여행은 일상과 현재의 모든 굴레에서 벗어나는 시간이 된다. 집을 나서는 순간, 내가 서 있는 길은 여행길로 변하고 다음 날 일본에서 놀러가고 싶은 장소를 오늘 정할 수도 있다. 오랜만에 가슴 두근거리는 신나는 경험을 할 수 있다. 색다른 환경에서 새로운 사람들을 만나고 신선한 경험을 해보는 시간. 이 시간은 치유와 발전의 시간이자 스스로를 돌아볼 수 있는 명상의 기회다. 그러기에 지금의 일상이 지루하고 힘든 누군가에게 한 달의 여행은 선택이 아닌 필수인지도 모른다. (p.52) 오키나와, 바다가 있는 한달...김민주난 서울로 돌아왔다. 그리고 여느 때처럼 살아가고 있다. 납기에 맞춰 번역을 하고 일감을 따기 위해 노력한다. 가끔 일상이 버거울 때면 오키나와의 바다가 떠오른다. 그러면 다시 열심히 앞으로 나아갈 힘을 얻는다. (p.93) 한 달 동안의 도쿄 홈스테이...임지현현재 난 한국에서 하반기 취업을 준비 중이다. 가끔은 넘기 힘든 벽을 마주한다. 이때마다 일본으로 한 달 동안 떠나기를 결정하고 실행에 바로 옮겼던 작년(2018년) 12월의 내 모습을 떠올리며 마음을 다잡곤 한다. 또한 일본 취업에도 관심을 가지게 되어 필요한 자격을 갖추기 위해 노력 중이다. 또 다른 도전을 하도록 발판이 되어 준 한 달간의 시간을 소중히 간직하며 글을 마무리한다.(p.273) 지금 만나러 갑니다, 와카야마...김세린떠나와 보니 알 수 있었다. 나를 옭아맸던 건 프로젝트가 끝나면 언제 다시 들어올지 기약 없는 번역 일감에 대한 걱정이 아니었다. 내게 부족했던 건 인생에서 쉼표를 만들 용기였다.  한국을 떠나면서 일정 때문에 어쩔 수 없이 일을 거절하면, 다시 일감을 수주할 수 없게 되거나 프로젝트에서 밀려나게 될지도 모른다고 생각했다. 하지만 실제로는 그렇지도 않았다.오히려 내가 소멸되고 있다는 느낌으로 보낸 일상과 조금 거리를 둘 수 있었다. 이 일을 오래 하기 위해서는 어떤 마음가짐을 가져야 할지를 속삭이는 마음의 소리에도 더욱더 귀 기울일 수 있었다. 와카야마를 다녀오고 나는 조금 달라졌다. 일을 열심히는 하되, 내가 어찌할 수 없는 부분까지 신경쓰면서 속앓이하던 버릇을 조금씩 내려놓기 시작했다. 봄이 되면 꽃이 피고, 여름이 되면 더위가 찾아옴이 순리라는, 자연스러운 시간의 흐름을 와카야마에서 배웠다. 마음속 고향인 와카야마를 가슴에 품고 다시 갈 수 있는 날을 기다려본다. *작가분들의 상황은 각각 다르지만 글에서 공통적으로 느껴지는 것이 있다. 바로 숨돌리기를 하고 다시 앞을 바라보는 모습이다. 모두 한 달이라는 시간을 단순히 휴식만을 위해 보내는 것이 아니라, 또 다른 한 발을 내딛기 위한 숨돌림의 기회로 삼으신 것 같아서 부러운 마음이 들었다. *<일본에서 한 달을 산다는 것>은 막연하게 낭만적인 이야기만 늘어놓는 책이 아니다. 집구하기부터 공과금 지불, 식사와 생필품 구매 등 실제로 한 달 살기를 하는 과정에서 마주치게 되는 여러가지 어려움들에 대한 내용이 담겨 있어서, 실제로 한 달 살기를 준비하는 사람들에게 유용한 실용서가 되어줄 수 있을 것 같다. 지금 당장은 떠나기 힘들겠지만, 언젠가 일본에서 한 달을 보내는 그 날을 기대하며 즐거운 마음으로 책을 읽었다. 'ㅡ')!",9791187316497
