,Title,ConRate,DesRate,Author,Date,Content,BookCode
129,에듀테크 FOR 클래스룸,5,5,pms060423,2020-09-21,"온, 오프라인 수업에서 실현하는 에듀테크의 모든 것온/오프라인 수업에 에듀테크를 더하면 더 편리하게 흥미로운 수업을 실현할 수 있어요.2020년 COVID-19로 사상 초유의 온라인 개학이 이루어지고 있어요.처음엔 낯설고 힘들었지만, 결과적으로 언택트 교육 혁신과 성장의 계기를 맞게 되었답니다. <책의 목차를 살펴보면~>                                    PART 01 수업에 맛을 더하는 온라인 퀴즈 도구                                  PART 02 온라인 수업에서의 상호작용 도구                                  PART 03 실시간 쌍방향 수업을 도와주는 도구                                  PART 04 수업에 집중하는 만드는 동영상 제작 도구                                  PART 05 영상 편집 도구                                  PART 06 수업자료에 날개달기                                  PART 07 구글 플랫폼 활용하기에듀테크(EduTech)란?  교육(Education) +기술(Technology)의 합성어에요.이 책은 에듀테크 정보와 도구들을 한 권에 담아 누구나 쉽게 활동할 수 있는 실용서랍니다. COVID-19의 확산으로 교육부에서는 2020년부터 디지털 뉴딜의 교육분야 추진을 위해 막대한 예산을 투입하겠다고 밝혔어요. ^^블렌디드 러닝(Blended Learning) -> 혼합형 학습이라고도 하며, 일반적으로 비대면과 대면 학습이 혼합된 학습을 말해요.플립트 러닝( Flipped Learning) -> 블렌디드 러닝의 한 형태로, 교사가 사전에 제공한 동영상을 학생이 보며                                            사전에 학습하고 오프라인 수업에서 학습과 연관된 활동에 참여하는 방식.디지털 리터러시(Digital literacy)란?디지털 정보를 이용해 올바른 정보를 이해하고, 표현하여 상호 작용하고 활용할 수 있는 능력을 말해요.학생들이 온라인에서 잘못된 정보를 접하는 빈도가 증가하면, 그 정보를 근거로 잘못된 판단을 할 수 있는 가능성도 커집니다.따라서 디지털 리터러시 교육의 중요성이 강조되고 있어요.융복합 시대를 맞아 디지털 리터러시 교육에는 학생들이 올바른 정보를 검색하고, 문제를 파악하며, 의사 결정을 하고, 창의적인 정보를 만들어 내는 전 과정이 담겨 있어야 해요. ^^디지털 리터러시를 강화하기 위한 교육은 아래 세 가지 능력을 키울 수 있어야 합니다.1. 올바른 정보를 선별하고 이해할 수 있는 능력 키우기2. 올바른 정보를 근거로 자기 생각을 표현하는 능력 키우기3. 정보를 활용하여 상호 작용할 때 디지털 도구를 활용하는 능력 키우기 *수업에  맛을 더하는 각종 도구들 * 도   구 설   명 이 책의 관련 챕터 시각화 도구  학습자가 개념이나 현상을 이해하기 위해   스키마에 상을 구축하고 시각화 함  영상녹화 / ppt녹화/ 윈도우 게임 녹화/ 곰캠  OBS / zoom it/ 무료음원/ 무료 폰트/ 오캠  미리캔버스, 무료 이미지 조직화 도구  학습자가 문제 상황에 대해 생각,분석하고   조직하는 사고의 길을 활발하게 함  카훗/ 팅커벨/ 패들렛/ 멘티미터 효율화 도구  학습 수행 지원 도구로, 학습 과제 제출과   평가를 효율적으로 구성, 필터링 제공 함  클로버더빙/ 브루/ 곰믹스/ 유튜브/ 구글 프레젠테이션  구글 설문/ 구글 스프레드시트/ 구글 사이트 도구 에듀테크를 활용한 온/오프라인 수업의 효과를 높일 수 있는 다양한 디지털 도구들이 소개되어 있어요. <실시간 쌍방향 수업을 도와주는 도구>(책에는 쌍방향 수업이 가능한 zoom, 구글 Meet, 카카오TV를 자세히 소개하고 있어요. )-zoom- 이미 많은 분들이 이용하는 쌍방향 수업이라 패스할게요^^;;-구글 Meet의 경우 한 번에 최대 100명까지 참여 가능한 화상 회의 프로그램이래요.(현재 사용 시간은 무제한이지만, 10월 부터 60분만 무료 서비스를 제공한다고 해요)- 카카오TV는 학생들의 얼굴이나 배경이 노출되지 않아요. 학생들과의 소통은 채팅으로만 가능하답니다.전교생을 대상으로 하는 방송도 가능할 만큼 한 번에 많은 사람이 접속할 수 있다고 해요.(책에는 각 프로그램마다의 장, 단점 및 사용 방법들이 상세히 담겨져 있어요) 이 외에도 온라인 퀴즈 도구 및, 포스트를 게시하며 상호작용할 수 있는 '패들렛', 설문, 투표, 워드 클라우드 등 많은 학생들의 의견을 한눈에 볼 수 있게 해주는 '멘티미터'와 같은 온택트 시대에 활용할 수 있는 쉽고 다양한 수업 도구를 알려주고 있어요. 동영상 제작 방법은 물론, 영상 편집 도구인 클로바 더빙, 브루, 곰믹스 프로, 유트브 영상 올리기까지..뭐하나 중요하지 않은게 없을 정도입니다. ^^또한, 구글에서 다루는 다양한 플랫폼을 활용하는 방법들도 상세히 나와 있어 수업자료 만들때 날개를 달 것 같아요. ^^ 어디서 들어는 봤지만 정확히 어떻게 사용하는지 방법을 몰라 했던 것이 많아,저에겐 너무 유익한 책이 될 것 같아요. ^^요즘 전문가들의 이야기를 들어보면 코로나 이후는 온택트 활동이 많아 질거라 예상하고 있어요.※ 온택트(Ontact)란? -> 비대면을 일컫는 '언택트(Untact)'에 온라인을 통한 외부와의 '연결(On)'을 더한 개념으로,온라인을 통해 외부활동을 이어가는 방식을 말해요.그러려면 <에듀테크 FOR 클래스룸> 책과 같은 다양한 온라인 수업 도구들을 배워두면 좋을 것 같단 생각입니다. 온. 오프라인 수업에서 에듀테크를 실현할 수 있는 실용적인 지침서!!<에듀테크 FOR 클래스룸> 추천합니다~~ ^^",9791186742860
130,한권으로 끝내는 에듀테크 FOR 클래스룸,5,5,ling1017,2020-09-20,"요즘 코로나바이어스로 인해 아이들이 학교 못가고 모두 비대면 온라인수업이 많아지고 있어요!도서관이나 이런 저런 강좌들도 줌으로 수업을 진행되고 비대면 온라인 세상이 열리니 다양한 프로그램에 대해 알아둘 필요가 있어요!!이책은 에듀테크 정보와 두구들을 한 권에 담아 누구나 쉽게 활용할 수 있는 실용서로 학교선생님, 학원강사님 등등에게 유용한 정보가 많아 더욱 좋아요!수업 전 어떻게 아이들 수업에 집중 향상 시키는지 바로 퀴즈입니다!퀴즈를 어떻게 만든지 여기 자세히 잘 설명해주고 있어요!!!학생들과 상호작용 시 필요한 도구 바로 아래----패들렛아이 과제를 올리는 공간, 서류 상호작용할 수 있는 공간입니다!!방법은 책에서 아주 자세히 쉽게 설명해주고 있습니다!!또한 구글 MEET !!!그리고 카카오 TV~~그리고 한 장에 광고-템플릿 - 미리캔버스 그리고 영상 편집도구 1. 클로바더빙2. 브루3. 곰믹스 프로4. 유튜브 영상 올리기이 한권 책으로 따라하면 진짜 온라인 수업 끝낼 수 있음!!너무 유용하고 빠른 시일내에 습득하고 응용한 사람은 미래 시대 걱정없습니다!!",9791186742860
131,에듀테크 for 클래스룸,5,5,tato9,2020-09-18,"코로나19가 많은 것을 변화 시켰다. 그중에서도 학교 교실은 비대면 온라인 수업으로 바뀌면서 그에 맞는 콘텐츠 만들기에 교사도 열을 올리고 있다. 줌이 뭔지 몰랐던 때가 언제였던가? 온라인 수업에 내실을 기하기 위해 수업 영상편집과 다양한 프로그램을 다루는 방법도 겸비해야 되는 이때에 참 적절한 책이 나왔다. 그리고 알차게 구성돼 있어 '이 한 권만 있으면' 싶을 정도로 든든해졌다.     이 책은 에듀테크 정보와 도구들을 싣고 있으며 누구나 쉽게 활용할 수 있는 실용서로 기획, 제작되었다. 온/오프라인 수업을 업그레이드할 수 있는 다양한 방법들을 활용하여 흥미로운 수업이 될 수 있도록 설계하고 운영하길 바라는 저자의 의도가 담겨 있다.    책의 서두에 플립트러닝에 대한 소개가 나온다. 플립트러닝은 거꾸로 교실이라고도 칭하는데 교수자가 수업자료를 사전에 제시하고 학생이 온라인을 통해 먼저 학습한 후 오프라인에서 토론과 같은 활동 수업을 진행하는 것이다. 단점은 학습자가 사전학습을 해 오지 않으면 본 수업에서 수업 진행 시 애로사항이 있다. 그러나 장점은 사전학습으로 인해 본 수업에서 보다 학습자 중심의 활동 수업, 토론 수업 등으로 진정한 학습자 중심의 수업이 이루어진다는 것이다. 코로나19 이전에는 거꾸로 교실이 학생들에게 낯설었다. 그러나 현재는 너도 나도 온라인 수업에 익숙해져 있기에 플립트러닝을 활용하기에 용이해졌다.   실시간 쌍방향 수업을 도와주는 도구로 Zoom 이 많이 사용된다. 그 외에도 구글 Meet, 카카오 TV가 있기는 하지만 현재 주로 사용되는 Zoom에 대한 설명이 눈에 더 들어왔다. 프로그램 다운로드부터 각각의 기본 메뉴 사용법이 자세히 설명돼 있다. 스마트폰을 통해 접속하는 학생들도 많은데 이때 '장치 오디오를 통해 통화'버튼을 활성화하는 것이 실수도 많고 질문사항도 많은 부분임을 강조하며 안내하고 있다.    처음 줌 수업을 통해 화면을 공유하면서 소리도 같이 학생들에게 송출되는 줄 알았는데 반응이 없다면 '컴퓨터 소리 공유' 체크를 했는지 확인해 봐야 한다. 또 소회의실의 개설을 통해 모둠학습을 유도할 수 있고, 소회의실의 유효시간 설정을 통해 학습자들의 학습활동이 늘어지지 않도록 하는 기술도 사용해 볼 만하다.                                  패들렛은 담벼락에 포스트잇을 붙이듯이 누구나 쉽고 자유롭게 포스트를 추가하며 상호작용할 수 있는 프로그램이다. 메모뿐 아니라 사진, 동영상, 링크도 업로드할 수 있으며 협동수업도 가능하게 한다. '다음 글을 읽고 자신의 생각을 한 줄 메모로 남겨 보세요.' 이때 학생들이 자신의 의견을 그때그때 남길 수 있어 유용하다. 학생들이 올린 글에 다른 학생들이 '좋아요'를 누를 수도 있고, 댓글을 달 수도 있다. 물론 교사의 피드백도 바로바로 가능하다. 교사가 제시하는 url만 따라들어오면 학생들의 회원가입은 필요하지 않다.                                             수업 동영상을 만들 때 예전에는 중간에 틀리면 다시 처음부터 찍었다. 그러나 동영상 편집을 하게 되면 그냥 이어서 찍고 나중에 편집을 할 수 있다. 물론 이 부분에 대해 기존부터 잘 알고 있는 사람이라면 편집이 너무나 쉽겠지만 처음 접하는 사람들은 한마디로 '어렵다'를 연발할 것이다. 이번에 파워포인트 프로그램으로 동영상 편집이 가능함을 처음 알게 되었다. 슬라이드 쇼를 통해 동영상으로 만들고 mp4 파일로 저장하는 것을 따라 해 보면서 마치 그동안 뷔페집에 가서 김밥만 가져다 먹은 꼴은 아니었던가 싶었다.  그 외에도 영상 편집 도구로 많이들 쓰는 곰믹스 프로에 대한 설명은 유익했다.                '수업자료에 날개 달기' 파트에서는 수업 영상을 만들 때 무료로 제공되고 있는 폰트, 이미지, 음원, 디자인 등에 대한 소스를 알려 주고 있어 다양한 썸네일을 만들 수도 있고 가져다 쓸 수도 있었다. 또한 구글 플랫폼 중에서 설문지는 내가 직접 만들어서 사용해 볼 수 있도록 안내되어 있어 따라해 보았다. 2학기 회장, 부회장 선출 시 줌을 통해 후보자들의 공약을 듣고, 구글 플랫폼 설문지로 투표를 실시하였는데 코로나19가 가져온 새로운 온라인 선출 방식이었다.                이렇듯 실제 학교에서 실시되고 있고 가장 많이 사용하는 프로그램, 그 외에 이용하면 좋은 유사 프로그램 등을 소개하였고 평소 조금 더 자세히 알았으면 하는 부분을 가려운 곳 긁어주듯 알려줘서 많이 배우는 기회가 되었다. 물론 그전에 수업 자체의 질에 대한 노력이 있은 후 다양한 프로그램으로 주변을 정비해야 할 것은 두말할 나위 없다. 이렇게 비대면으로 수업하는 일수가 등교일수에 비해 많은 요즘 참 알찬 내용으로 장비적 문제를 겪고 있는 많은 선생님들에게 힘이 되는 내용들로 알차게 구성되어 있어 이 책을 적극 추천하고 싶다.                   *책을 출판사로부터 제공받아 작성하였습니다.",9791186742860
132,[서평] 한 권으로 끝내는 원격 수업 도구의 모든 것 :  에듀테크 FOR 클래스룸,5,5,bottles,2020-09-18,"중국 우한에서 시작된 코로나19 바이러스로 인하여 전세계가 활동이나
이동에 제한을 받고 있습니다. 우리나라에서도 거리두기를 실시하고 있으며, 다수가 모이는 모임이나 장소의 출입이 금지되었습니다. 따라서, 학교에서도 최소한의 인원만 등교를 하게 되었으며, 비대면 온라인
교육을 전격적으로 실시하였습니다. 하지만, 충분한 준비없이
익숙하지 않은 온라인 수업을 실시하면서 처음에는 어려움도 있었습니다. 반면에, 많은 교수자들과 학생들 및 부모들이 언택트 기술에 대한 관심과 능력이 향상되는 긍정적인 면도 생겼습니다. 이런 과정에서 모두에게 좀 더 효과적인 에듀테크 정보와 기술들을 활용하는데 도움이 되기 위해 이 책이 도움이
될 것입니다.

책에서는 7파트로 구성되어 있습니다.
온라인 수업 할 수 있는 프로그램은 물론이고 수업 중 퀴즈를 내거나 상호작용을 할 수 있는 프로그램이나 사이트의 사용 및 활용법에
대해서 설명하고 있습니다. 또한, 저작권이 중요하기 때문에
무료 소스나 디자인을 구하고 이용할 수 방법에 대해서도 다루고 있습니다. 그리고, 구글 플랫폼을 이용하는 경우에는 이미 익숙하게 알고 있는 프레젠테이션, 설문지
및 스프레드시트 등을 활용하는 부분도 만날 수 있습니다. 

책에서는 소개된 프로그램이나 사이트를 처음 이용하시는 분도 어려움 없이 따라할 수 있도록 회원가입하기부터 그림이나
화면을 이용하여 단계별로 설명하고 있습니다. 동시에 해당 부분에서 수업에 어떻게 활용할 수 있는지도
여러 유형별로 설명하고 있어서, 책의 사례를 따라하는 것만으로도 그 기능을 충분히 익힐 수 있을 것입니다. 비슷한 기능의 다양한 프로그램을 충분히 소개하고 있기 때문에 소속된 단체나 개인의 니즈에 맞게 선택적으로 사용
가능할 것입니다.

저자들은 올 초와 같이 단순한 교실 수업과 비슷한 일반적이면서 단순한 수업 형태에 이러한 온라인 기술을 활용함으로서
오프라인에 비하여 부족한 부분을 보완하고 몰입도를 높이는 효과를 기대하고 있습니다. 또한, 학습자들에게 학습에 집중하여 참여하거나 완료할 수 있는 외적인 동기로 작용할 수 있다고 합니다. 온라인 수업을 좀 더 재미있고 다양하게 진행하고 싶으셨던 분들에게는 이 책 한 권만으로도 원하는 거의 모든
활용이 가능할 것으로 생각됩니다. 교육과 온라인 기술의 만남은 이번 한 번으로 끝나는 것이 아니라, 이제부터 본격적인 시작이라고 생각하기 때문에, 책 속의 모든 것이
도움이 된 유용한 시간이었습니다. :)

(출판사로부터 도서를 제공받아 작성한 리뷰입니다.)",9791186742860
133,에듀테크 FOR 클래스룸> 에듀테크를 실현할 수 있는 가장 실용적인 지침서네요~ ^^,5,5,skql94,2020-09-18,"에듀테크/ 다빈치Books/ 실시간쌍방향수업/ 영상녹화/ 영상편집/ 무료이미지/ 구글플랫폼 박 찬, 김병석, 전은경, 전수연, 진성임, 정선재, 강윤진, 변문경 지음요즘 코로나바이러스로 비대면 온라인 수업이 많아지고 있어요~도서관이나 이런저런 강좌들도 ZOOM으로 온라인 수업을 하기에ZOOM프로그램에 대해 알아두면 좋겠더라고요.더불어 비대면 온라인 세상이 열리니 다양한 프로그램에 대해 알아둬야할 듯해인터넷으로 관련프로그램들을 검색해보곤 했는데 이번에 <한권으로 끝내는 에듀테크 FOR 클래스룸> 책을 알게되어 한권으로 쉽게 살펴보았답니다. ^^이 책은 에듀테크 정보와 도구들을 한 권에 담아 누구나 쉽게활용할 수 있는 실용서로 기획.제작 되었다고 해요.학부모, 학생들에게도 좋지만 학교 선생님, 학원 강사님 등등 에게 유용한 정보가 많아  더욱 좋겠더라고요. IT용어들이 생소한 분들이 있으실텐데 잠깐 정리하자면..요즘 많이들 들어보셨을.. 그리고 위에서 제가 말한 단어인 에듀테크..교육 혁신의 사조들 중 하나인 에듀테크는 교육과 기술의 합성어라고 해요.에듀테크는 4차 산업혁명에 따른 교육 혁신의 하나로 첨단 기술을 기존 학습 시스템에통합하는 전 과정을 포함한다고 하네요.블렌디드 러닝(Blended Learning)은 혼합형 학습이라고도 하며 두 가지 이상의 학습 방법을 결합하여 이루어진 것을 말해요.일반적으로 비대면과 대면 학습이 혼합된 학습을 가리키는 경우가 가장 많답니다.블렌디드 러닝은 미국의 교육기업인 스티런 사의 교수설계자이자 부사장인 주디스 박사가 처음소개하였는데 e-러닝의 한계를 극복하고 교육 효과를 향상하기 위해 앞으로 주목해야 할 방법이 블렌디드 러닝이라고 강조한 바 있다고 해요.블렌디드 러닝의 강점은 학습자가 주도적으로 학습 시간을 설계하고콘텐츠를 선택하여 융합된 지식을 구성할 수 있다는 것이랍니다.플립트 러닝(Flipped Learning, Flipped Classroom)은 블렌디드 러닝의 한 형태랍니다.플립트 러닝은 우리나라에서 거꾸로 교실이라는 이름으로 많이 알려져 있어요.교수자가 수업자료를 사전에 제시하고 학생이 온라인을 통해 과제를 먼저 학습한 후오프라인에서 토론과 같은 활동 수업을 진행하는 것이랍니다.오프라인에서 주로 학생 주도적인 활동을 하게되므로 교실 수업의 주체가 교사가 아닌 학생이 된다는 점이가장 큰 특징인데 교수자드의 수업 준비에 대한 부담이 커지고 준비 시간이 길어진다는 단점이 있어요. 디지털 리터러시(Digital literacy)란 디지털 정보를 이용해서 올바른 정보를 이해하고,표현하여 상호 작용하고 활용할 수 있는 능력을 말해요. 수업에 맛을 더하는 온라인 퀴즈도구로 띵커벨(ThinkBell), 카훗(Kahoot) 프로그램을 소개하고 있었어요.띵커벨은 교사 인증 절차를 거치면 유료회원이 아니어도 띵커벨을 용도에 맞게필요한 만큼 충분히 활용할 수 있었어요.카훗은 영어 버전의 외국 프로그램이며 무료로 사용할 수 있는 퀴즈 유형은 두가지밖에 안되지만 무료 회원일때 100명까지 퀴즈 참여 인원을 지원해주고, 플레이 방식에 다양한 변화를' 줄 수 있는 설정 기능들이 있다고 해요.둘다 학습지도에 유용하게 활용할 수 있는 프로그램이었답니다.회원가입 및 홈 메뉴 이해, 퀴즈 만드는 방법들이 자세히 설명과 함께쓰여있어 초보자도 따라하기 쉬웠어요. 온택트 수업에서의 상호작용 도구로 패들렛(Padlet)과 멘티미터(Mentimeter) 프로그램을 책에서 소개하고 있었는데 패들렛은 메모판이나 칠판에 포스트잇 노트를 붙이는 것처럼 누구나 쉽고 자유롭게포스트를 추가하여 상호작용할 수 있는 프로그램이였고멘티미터는 다양한 사람들의 의견을 수합하고 다양한 유형으로 활용할 수 있는 참여프로그램이였어요.책에는 자세히 프로그램 사용법과 수업에 활용하는 방법들이 담겨있었답니다. ^^ PART 3에 담겨있던 실시간 쌍방향 수업을 도와주는 도구로는ZOOM, 구글 Meet, 카카오 TV가 소개되었어요.ZOOM은 그렇지않아도 궁금해하던 프로그램이였는데다운로드 방법부터 수업을 시작하고 예약하는 방법, 화면 공유, 소회의실 기능 활용 등다양한 기능에 대해 사진과 함께 설명이 되어있어 어렵지않게 따라할 수 있었어요. 아이가 평소 유투브 채널을 만들어서 자기만의 영상을 올리고 싶다고 했었는데사용방법을 몰라서 한번 해보자고 말만 해놓고 시도하지 못했었는데이 책에는 유투브 영상 올리는 방법도 포함하고 있었어요~~~ ^^아이와 책보고 차근히 따라하면서 아이만의 유투브 채널을 만들어보기로 했답니다.  요즘 온라인 수업하면서 아이가 클로바 더빙이라며 소개하는 말을 듣고 클로바 더빙은 어떤 방식으로 하는건지 궁금해했었는데책에 그 부분도 있더라고요.저도 궁금해하던 부분이였는데 책을 통해 제작 방법등 자세히 알게되었답니다.  온라인으로 많은 자료들을 만들다보면 이미지나 디자인들을 사용해야할 때가 있는데저작권때문에 아무거나 쓰면 안된다고 들어서무척 조심스러웠는데, 책에서 무료 소스, 디자인들을 활용할 수 있는 사이트들도 알려줘서 너무 좋았어요~~책 한권을 통해 다양한 프로그램들에 대해 알 수 있었답니다.그동안 사회의 급격한 발달이 적응도 안되고자꾸 외면하게되는 부분도 있었는데 코로나로 인해이제는 빠르게 변하는 세상을 저도 적응해가야된다는 생각에 들어요.이 책이 많은 도움이 될것 같아요. 추천합니다. ^^",9791186742860
