,Title,ConRate,DesRate,Author,Date,Content,BookCode
1,2021 에듀윌 9급 공무원 6개년 기출문제집 한국사,5,5,mean1111,2020-10-03,"한국사 기본서로 학습한 경험은 없지만 다른 과목 기본서를 보고 교재의 구성과 내용이 마음에 들어 한국사 기출문제집을 구입해 보았습니다.한국사 기본서가 3권으로 이루어졌다면 기출문제집은 1권으로 구성되어 있습니다.두께는 기본서 1권과 비슷한데 엄밀히 말하면 1권이 아닙니다.무슨 소린고 하니 9급 기출문제 + 답안지 + 고난도 기출문제(6회 분)편이렇게 3개로 분리가 되어있다는 말입니다.책속의 책이라고 표현하면 이해가 될까요?보통 답안지와 문제집이 분리되는 경우는 많았는데이번 기출문제집은 고난도 기출문제를 따로 책으로 묶어내었고9급 문제를 학습 후 실전과 가장 비슷한 환경에서 풀어보도록 만들었습니다.한줄소감에도 적어놓았지만 과거 유형의 문제가 사라지고 있는 만큼 6개년 정도면알찬 구성이라고 생각합니다.국가, 지방직, 서울시와 법원직, 교육행정직까지 30회분의 기출세트가 담겨 있습니다.기출문제집의 유형은 크게 단원별 문제와 연도별 구성이 있는데단원별 구성은 기본서 회독 후 심화적으로 이론을 채워갈 때 필요하다면연도별 구성은 시험을 앞두거나 전체적인 이론을 채우고 실전 경험이 필요할 때 사용하는게 좋다고 생각합니다.문제집을 구입하실 때 참고하면 좋을 것 같아 남겨봅니다.다시 구성으로 돌아와서 기출문제야 말로 회독이 필요한 책인만큼 OMR카드가 내장되어 있습니다.앞서 언급한 다양한 시험종류의 OMR카드가 모두 있어서 어떤 시험을 보시건적응하는데 도움이 될 것이라 생각합니다.에듀윌 홈페이지 가입하면 기출 해설도 무료로 제공된다고 하니 독학하시는 분들께 추천합니다.QR코드로 채점을 할 수도 있으니 펜이 없거나 문제를 깨끗하게 보고 싶을 때 이용하면 좋겠네요더불어 해당 방법으로 채점하면 영역별 취약 부분을 판별해주기도 합니다.오답노트 역시 PDF로 제공을 해준다고 하니 문제풀이 표시가 되었다고 따로 지울 필요 없이 해당 파일을 다운받아 이용하면 좀 더 편하게 공부할 수 있을 듯 합니다.자세한 건 더 사용해봐야 느끼겠지만 기본서에 워낙 만족해서 기출도 믿고 갑니다“본 후기는 에듀윌 온라인 스터디 참여하여 솔직하게 작성한 후기입니다.”",9791136006837
2,공무원 한국사 기출문제집 추천 - 에듀윌 6개년 기출문제집,5,5,jsb0717,2020-09-28,"공무원 영어 기출문제집 에듀윌 6개년 기출문제집 추천합니다.당당하게 215%합격자라는 이름으로 내건 이 도서는 과연 어떤 도서일까요?소개해보겠습니다.먼저 위에 사진처럼, 문제지와 해설지 분리가 가능합니다.공부하기에 편합니다.  에듀윌 6개년 기출문제집 구성입니다!2015~202년도 6개년 기출문제집 고난도 기출문제 부록OMR&빠른 정답표모바일 자동채점 서비스무료 해설강의오답노트PDF이 모든것이 무료입니다. 에듀윌 기출문제집은 봉투 모의고사처럼, 실제 기출시험지를 풀면서 공부할 수 있어서 좋습니다.에듀윌 기출문제집 장점 모바일 자동채점 분석서비스.QR코드로 찍으면, 모바일로 채점 가능합니다.따로 노트에 일일히 1번부터~20번적거나, OMR인쇄하거나 그럴 필요가 없습니다.나중에 최종적인 시험 감각을 위해서야 당연히 OMR쓰는데, 당장에는 편리한 모바일이 있지요.    최근6개년 영역별 출제문항에 대해서 설명이 자세하게 되어 있으며, 우리는 이걸 보면서,기출이 왜 중요하며, 2021 대비 기본서 공부포인트 집중에 참고가 됩니다.정답해설과 오답해설, 당연히 정답뿐만 아니라 오답에 대해서도 모든 해설이 자세합니다.에듀윌 홈페이지에 무료회원가입하면, 모든 연도 기출 해설 무료강의가 제공됩니다.   2021 에듀윌 6개년 기출문제집 좋은 점 정리1. 모바일 자동채점 서비스&수험생 점수대 분포&성적분석서비스2. 실제 시험지로 풀어보는 흑백기출문제집3. 문제 해설강의 무료4.오답노트 제공5. 회독증강에 도움기출문제집을 1회독 할 때는 책을 더렵혀서는 안 된다. 다시 풀어야 하니까. 그런점에서 에듀윌 기출문제집은 더욱 좋다. 공무원 직렬이 엄청 많은데, 국,지,서,법,교, 이정도기출6개년치, 일일히 프린트하는것보다 책 사는 것이 훨씬 좋다고 생각한다.추가적으로 소방,경찰 기출을 공부하고싶다면 따로 프린트하자.최근 시험 난이도는 오히려 소방,경찰에서 만점방지용이 나오곤 한다. 제가 타 공무원 수험서도 둘러봤지만 모바일 자동채점 서비스, 저는 에듀윌에서 처음 봤습니다.지금은 어떤지는 모르겠지만요.“본 후기는 에듀윌 온라인 스터디 참여하여 솔직하게 작성한 후기입니다.”",9791136006837
3,2021 에듀윌 6개년 기출문제집 한국사,5,5,맛조은사과,2020-09-27,"기출문제의 중요성은 어느과목이나 똑같지만 특히 한국사 같은 암기과목들은 기출문제가 더 중요한 것 같아요. 아무래도 기출 경향을 다른 과목보다 더 많이 따라가기도하고 어느정도 문제 패턴이 정해져있어서 문제를 많이 풀어보는게
확실히 도움이 되는 과목이 한국사인 것 같아요. 그런 만큼 기출을 많이 풀어봐야하는데, 적합한 책이 바로 이 에듀윌 6개년 기출문제집이었어요. 사복직부터 시작해서 법원,지방직,국가직
행정등 다양한 직렬의 문제들을 수록하고있고 수능부터 7급까지 문제의 폭이 다양해서 기출을 접하기에 좋았던
것같아요. 또 기출을 그대로 재현하고 있어서 실전처럼 풀어보기에도 적합한 교재인 것 같아요.이 후기는 에듀윌 온라인 스터디에 참여하여 솔직하게 작성한 후기입니다",9791136006837
4,공무원 한국사 기출문제집의 선택은 에듀윌,5,5,hanyejee,2020-09-27,"한국사 기출문제를 파악하기에 좋은 교재인 것 같습니다.책 구성을 보면서, 정리가 잘 되어있어서, 공부하기에 편할 것 같다라는 기대감도 있었는데, 정말 그렇더라고요! 이제 2021년을 목표로 공무원 공부를 이 책을 통해서 하려고 합니다.기출문제집답게 여러 직렬의 문제를 풀 수 있어서 좋아요!이 교재를 통해서, 기본기를 확실히 잡아서 2021년에는 꼭 합격하고 싶습니다본 후기는 에듀윌 온라인 스터디 참여하여 솔직하게 작성한 후기입니다",9791136006837
5,2021 에듀윌 9급 공무원 기출문제집 한국사,5,5,왓섭,2020-09-27,"작년에 2020년 기출문제집을 사서 풀었고, 올해 2021년까지 2번째 구매입니다. 국가직, 지방직, 서울시등 최신 시험인 20년부터 15년도까지 년도별로 깔끔하게 정리되어있어서  실전 시험처럼 시간재고 풀기 좋아요!    기출문제집만 따로 뗄 수 있어 가지고 다니기 아주 편리합니다.또  작년 교재와는 다르게 QR코드를 이용해서 공부할 수 있는 점도 큰 메리트라고 생각합니다.깔끔한 문제구성을 원하신다면 이 책을 추천드립니다! 본 후기는 에듀윌 온라인 스터디 참여하여 솔직하게 작성한 후기입니다.",9791136006837
6,2021 에듀윌 9급 공무원 6개년 기출문제집 한국사,5,5,**01 22 2020  9:45PM**,2020-09-27,"공무원 시험을 준비하면서 기출의 중요성에 대해 여러번 언급해도 부족할 정도로 체감하고 있어요.주요 빈출개념은 반드시 반복 출제되고 매년 출제되는 유형은 정해져 있어요. 기출문제를 통해서 출제 경향과 패턴을 파악하고 실전 문제풀이 능력을 향상시키도록 노력해야해요.에듀윌 기출문제집의 특징은 먼저 특별부록으로 7급 고난도 기출문제가 수록되어 있고, OMR과 빠른 정답표를 통해 실전처럼 문제를 풀 수 있어요. 그리고 1초 합격예측 서비스를 통해 자동채점과 성적결과분석서비스를 받을 수 있고 최근 3개년 주요 직렬 해설강의가 무료로 제공되고 있어요. 그리고 오답노트도 PDF를 통해 다운받아서 틀린 문제나 헷갈리는 문제를 정리할 수 있어요.문제 편에서는 기출문제 6개년 31회분이 수록되어 있고 해설편에서난 직렬별 기출분석 REPORT와 수준&약점 체크 가능한 해설이 제공되고 있어요.- 본 후기는 에듀윌 온라인 스터디 참여하여 솔직하게 작성한 후기입니다. -",9791136006837
7,에듀윌 9급 공무원 6개년 기출문제집 한국사,5,5,벨벳,2020-09-27,"이미 여러 번 풀어보았지만 다음 년도에 확실한 합격을 위해 이번 에듀윌 기출 교재를 구매했습니다. 시중에 너무 많은 책이 있어서 어떤 책으로 공부를 할지 고민을 했고, 어플로도 공부할 수 있지만 굳이 수험서를 구매해서 보는 까닭은 그만한 메리트가 있기 때문이라고 생각해요.우선 에듀윌 9급 공무원 6개년 기출문제집은 교재가 수험생을 배려한 점이 가장 돋보입니다. 같이 가지고 다니면 무거운 문제집을 해설지와 분리할 수 있게 되어있고 각 직렬(법원직, 사회복지직, 일반행정직 등) 해설도 굉장히 꼼꼼하게 나와 있습니다.이번 시험 한국사로 고배를 마시고 절치부심 했는데 2021년에는 닥공사 기출문제집으로 좋은 성과를 거둘 것 같아요. 꼼꼼한 해설과 구체적인 학습 계획을 일구어 나갈 수 있게 목차에 매뉴얼 정리가 되어있어서 아주 즐겁게 학습하고 좋은 결과 얻을 것 같습니다. 좋은 교재 만들어주셔서 감사합니다 에듀윌!본 후기는 에듀윌 온라인 스터디 참여하여 솔직하게 작성한 후기입니다.",9791136006837
8,2021 에듀윌 9급 공무원 6개년 기출문제집 한국사,5,5,rcpc,2020-09-27,2021 에듀윌 9급 공무원 6개년 기출문제집 리뷰:)에듀윌 9급 공무원 기본서로 지금 공무원 시험을 준비하고 있어서 에듀윌 9급 공무원 6개년 기풀문제집을 구매했어요! 에듀윌 9급 공무원 6개년 기출문제집의 장점은 7급과 9급을 준비할 수 있어요. 9급 기출 문제를 모은 모의고사이지만 7급 고난도 기출문제도 따로 정리해서 7급 기출문제도 풀 수 있어요. 두번째는 7급 기출모의고사와 9급 기출모의고사를 따로 분리해 놔서 굳이 분권화를 할 필요가 없어요. 공부하고 싶은 교재만 분리할 수 있어서 가볍구요! 세번째는 가독성이 좋아요. 종이 재질이 가볍고 문제를 배치한 구성이나 배열도 적절해요. 문제와 문제 사이에 공간도 넉넉히 배열해서 오답을 정리할때도 좋았어요.  “본 후기는 에듀윌 온라인 스터디 참여하여 솔직하게 작성한 후기입니다.”,9791136006837
9,2021 에듀윌 9급 공무원 기출문제집 한국사,5,5,ssomj,2020-09-27,"에듀윌 공무원 기출문제집은 기출문제보다 해설지가 더 두껍다.해설이 보기문항문항마다 자세히 설명이 되어있고 무료해설강의도 이용할 수 있어 혼자 공부하기에도 충분히 이해할 수 있다.기출문제 순서는 최신순으로, 국가직, 지방직, 서울시 순이어서 난이도가 점점 어려워져서 점점 실력을 올릴수 있을것같다. Qr코드도 굉장히 잘 쓰고 있는데 문제를 풀때 시간재면서 답을 입력할 수 있고 입력하면 1초만에 맞은 갯수, 점수, 합격여부예측(전체,상위10%평균, 백분위, 영역별정답률 등)을 해준다.  영역별틀린개수를 확인해줘서 취약영역체크를 할 수있다.9급문제를 다 풀고 심화를 원하면 7급문제도 부록으로 있으니 다른 자료필요없이 이용할 수 있을것같다.또 문제집에도 분석된걸 표시 할 수있어 2회독 할 때도 좋을것 같다.에듀윌 온라인 스터디 참여하여 솔직하게 작성한 후기입니다.",9791136006837
10,최신기출을 빠르게 풀고 체크할 수 있어요,5,5,살구주스,2020-09-27,초시생이 아니라서 최신기출이 필요했는데 이 문제집으로 해결했어요 :) 기존에 보던 기출문제집은 해설이 길어서 회독시간이 너무 오래걸리는게 단점이었어요 ㅠ 그래서 빠르게 회독할 문제집이 필요했는데 딱이에요~ 국가직/지방직/서울시/경찰/사복직으로 나뉘어서 2015~2020년도까지 기출문제랑 해설이 수록되어 있어요 문제도 시험장이랑 똑같이 4쪽으로 되어있고 OMR 카드도 있어요 QR 스캔하면 모바일 OMR 자동채점으로 점수도 확인할 수 있고 성적표도 나와요  무료해설강의도 제공하고 최근 2개년 7급 고난도 기출문제도 부록으로 있어서 만점방지용 문제도 공략할 수 있어요  최신기출문제집 뭐 사야하나 고민하는 분들 추천합니다 본 후기는 에듀윌 온라인 스터디에 참여하여 솔직하게 작성한 후기입니다,9791136006837
11,에듀윌 9급 공무원 6개년 기출문제집으로 기출문제 ALL KILL!,5,5,161956,2020-09-27,"2021 에듀윌 9급 공무원 6개년 기출문제집 한국사 후기9급 합격자 215% 성장!베스트 셀러 1위에 빛나는 2021 에듀윌 9급 공무원 6개년 기출문제집기본서를 통해 개념을 익히고 기출문제를 통해 실제 개념을 문제에 적용해보며 문제가 어떤 식으로 출제되는지 시험을 대비하기 위해서는 기출문제가 중요해요!에듀윌 6개년 기출문제집은 최신 기출문제부터 6개년동안 어떤 유형이 자주 출제되었는지 출제 경향이나 출제 패턴에 대해서 소개해줘요.6개년 기출 문제를 통해 문제 유형을 익히고 직접 풀어봄으로써 시험 대비용으로 딱이에요.에듀윌만의 기출분석 노하우로 자주 나오는 출제 유형이나 문제를 파악하기에도 좋고 실제 문제를 풀어봄으로써 대비하기에도 좋아요.문제편만 따로 빼서 가지고 다닐 수 있어서 가볍게 들고 다닐 수 있어요.게다가 특별 부록으로 7급 고난도 기출문제를 제공하고 있어서 추가적으로 고난도 문제에 대비할 수 있어요.눈이 아프지 않게 차분한 구성으로 해설도 꼼꼼하고 오답정리를 쉽고 정확하게 되어있어서 독학하기에도 좋아요.한번 푸는 것으로 끝내지 않고 여러번 반복해서 오답을 정리하면서 확실히 내 것으로 만들었는지 확인하는 작업을 통해서 나중에 고난도 모의고사, 실제 공무원 시험에서 고득점을 받도록 열심히 공부할 거에요!“본 후기는 에듀윌 온라인 스터디 참여하여 솔직하게 작성한 후기입니다.”",9791136006837
12,나만의 2021 에듀윌 9급 공무원 6개년 기출문제집 한국사 리뷰~^0^♥♥♭,5,5,dls4552,2020-09-27,"안녕하세요.기본강의 수강이 거의 다 끝나가니까 이제 기출문제를 푸는 단계로 들어가야겠다는 생각이 들더라고요.그래서 일단 어떤 기출문제집을 선택하는게 좋을까 고민하다가다양한 출제처들의 문제가 수록된 기출문제집이면 좋겠다고 생각했는데요!한국사 기출문제집을 직접 살펴보니,9급뿐 아니라 7급 기출문제도 부록으로 딸려있어서 좀 더 고난이도의 문제를 풀고 싶을 때 도움이 되겠더라고요~~:) ♡♡문제를 풀고 해설을 보니, 그때 그 시험의 합격선이 어느 정도였는지 나와 있어서채점했을 때 내가 이정도면 합격선이었겠다! 예측해볼 수 있다는 점도 참 마음에 들었어요.그리고 교재 안에 OMR 카드가 수록되어 있다는 점을 이용해서실전인 것처럼 시간을 재면서 문제를 풀어보려고요!문제를 풀면서 내가 약한 파트가 어디인지 확인하고,그 약한 파트들을 계속 살펴보다보면약한 부분도 강한 부분으로 거듭날 수 있을 거라고 생각하며열심히 공부해야 겠어요!교재의 장점을 제대로 이용해서한국사 점수를 제대로 올려볼게요!아자아자 빠이팅~~♥♥♭     ""본 후기는 에듀윌 온라인 스터디 참여하여 솔직하게 작성한 후기입니다.""",9791136006837
13,2021 에듀윌 9급 공무원 6개년 기출문제집 한국사,5,5,adsfjkl,2020-09-27,"2021 공무원 시험 합격을 위해 기출문제집을 구매하게 되었습니다. 2020년부터 2015년까지 6개년 기출문제가 국가직, 지방직, 서울시, 법원직, 교육행정직 총 5개의 직렬 총 30회분이 담겨 있어 좋았습니다. 고난도 기출문제가 특별 부록으로 수록되어 있는데, 이 또한 분리해서 들고 다닐 수 있어 편리했습니다. 또한 해설지에 연도별 합격선이 표로 보기 쉽게 나와 있어 좋았고, 취약 영역을 확인할 수 있는 칸도 있어 좋았습니다. 최근 6개년 출제경향 및 출제비중에 대해서 분석해 놓은 표도 있어 최근 시험의 경향을 알아가는 데에도 좋았습니다. 또한 각 시험 문제 상단에 모바일 성적분석표를 확인할 수 있는 QR코드가 표시되어 있어 성적 분석을 쉽게 할 수 있었습니다.본 후기는 에듀윌 온라인 스터디 참여하여 솔직하게 작성한 후기입니다.",9791136006837
14,2021 에듀윌 9급 공무원 6개년 기출문제집 한국사,5,5,stormwarm,2020-09-27,"2021 에듀윌 공무원 6개년 기출문제집 한국사첫째, 모의고사의 가격이 만원 초중반대 가격이라서 가격 면에서 저렴해서 좋아요.두번째, 분권화가 되어있어서 공부하기 편해요.세번째는 기출문제를 연도별 역순으로 배치해서 최신 경향의 문제, 최근 기출문제를 먼저 풀어볼 수 있다는 점이 좋았어요! 네번째, 해설도 문제해설마다 연도별 문제유형과 주제가 잘 정리되고 있고, 시험의 경향이 잘 쓰여져 있어요다섯번째, 에듀윌 기출문제집를 풀어보면서 느낀 점은 문제 구성과 참신성이 인상적이었어요. 최신 기출유형을 유지하되 출제된 기출문제를 잘 배치해서 갈수록 로운 문제를 정말 푸는 느낌이라서 좋았어요.""본 후기는 에듀윌 온라인 스터디에 참여하여 솔직하게 작성한 후기입니다""",9791136006837
15,에듀윌 기출 문제집으로 쉽게 공부하는 공무원 한국사,5,5,에리,2020-09-27,"사실 에듀윌 교재는 알찬 구성,상세한 해설 등 장점이 많아 늘 믿고 사용하는 교재입니다. 이번 기출문제집 역시도 받아보고 너무 만족했습니다. 먼저 6개년 기출로 구성된 9급 문제는 깔끔하게 년도별로 나와있어 풀기에 편하고, 7급 기출도 들어있어 9급 기출에 더해 고난도 문제를 접할 수 있어 좋았습니다. 또한 OMR 카드도 있어 실제 시험장에서 풀듯이 연습할 수 있어 실수를 줄일 수 있습니다. 여러 방면으로 도움이 많이 되는 교재라는 생각이 듭니다. 본 후기는 에듀윌 온라인 스터디 참여하여 솔직하게 작성한 후기입니다.",9791136006837
16,2021 에듀윌 9급 공무원 6개년 기출문제집 한국사 리뷰!,5,5,whelmx,2020-09-27,"2021년 9급 공무원 시험을 준비하기 위해 기출문제집을 구매했습니다. 7급 문제랑 9급 문제가 분리되어 있어서 편리하고, OMR카드 또한 구비되어 있어서 실제 시험보는 것처럼 공부할 수 있습니다. 국가직, 지방직, 서울시, 법원직, 교육행정직 5종류의 시험과 각 시험파트에는 시험이 어떻게 나왔는지 분석 또한 상세하게 되어있어 각자 준비하고자 하는 시험에 알맞게 공부할 수 있을거라 생각이 듭니다. 이번 기출문제집을 통해 점수 끌어올릴 수 있도록 하겠습니다^^본 후기는 에듀윌 온라인 스터디 참여하여 솔직하게 작성한 후기입니다",9791136006837
17,2021 에듀윌 9급공무원 6개년 기출문제집 한국사,5,5,alrysid,2020-09-26,"2021 에듀윌 9급 공무원 6개년 기출 문제집 한국사는 2020~ 2015년도까지 6개년 기출문제를 30회분 국가직, 지방직, 서울시, 경찰직 1,2,3차, 사회복지직 5개의 직렬별로 있습니다. 제가 하고자 하는 직렬이 아니라 다른 직렬들의기출 문제도 풀어볼수 있어서 좋았고 OMR카드도 넉넉히 있어서 실제 시험처럼 쳐 볼 수 있다는 것이 장점입니다. 또한 해설지를 보고 정답을 매길 수 있지만 정답만 있는 빠른 정답표가 있어서 빠른 채점이 가능한 것도 장점입니다. 해설지도 보기 좋게 잘 되어 있어서 이해하기 쉽습니다.해설편이 아니라 문제집이 떼어지는 편이라 빠른 정답표를 원한다면 잘라서 들고 다녀야 합니다. 사진을 찍는 것도 좋은 방법이라고 생각합니다.한국사의 방대한 양을 암기하고 이해하기 위해서는 처음에는 너무 많고 어려우니 기본서를 보면서 차근차근 풀어보면 암기하기 더 편리하다고 들었습니다. 많은 양이니까 문제를 그만큼 많이 풀어보고 익숙해지는것이 중요하다고생각하는데 문제가 많아서 좋습니다. 문제를 풀어보는것에 그치지 않고 오답노트를 하여 다시 틀리지 않도록 하는것도 중요하게 생각하는데 오답노트를 할 수 있게 QR코드를 이용하면 부가학습자료로 문제집의 문제가 있습니다(에듀윌 회원가입 필요) 필요한만큼 출력할 수 있으니 오답노트를 만드는것도 좋을 것 같습니다. 저는 문제 풀때 같이 있는 OMR카드를 이용하여 최대한 회독하여 문제를 풀려고 합니다. 아직 기본개념을 하고 있어서 자신이 없지만 문제에 익숙해지도록 노력할 것입니다.“본 후기는 에듀윌 온라인 스터디 참여하여 솔직하게 작성한 후기입니다.”",9791136006837
18,6개년 기출문제집,5,5,qhddiqhddiz,2020-09-26,기출문제집이 필요해서 보다가 이 책을 알게 되었는데 맘에 들어서 구매하게 되었어요.특별부록은 7급 문제도 들어가 있는데 2019와 2018의 문제가 있어서 필요로 할 때 따로 찾지 않고 바로 풀어 볼 수 있어서 좋은 거 같아요!그리고 6개년 기출을 매번 복사하거나 찾는 수고를 줄기 위해 책을 샀는데 해설도 너무 잘 되어 있고 좋은 거 같아요. 각 문제마다 어떤 영역에 속해 있는 문제인지 적혀있어 틀렸을 때 복습하기도 너무 좋은 거 같아요!본 후기는 에듀윌 온라인 스터디 참여하여 솔직하게 작성한 후기입니다.,9791136006837
19,2021 에듀윌 9급 공무원 6개년 기출문제집 한국사,5,5,이민우주,2020-09-26,"단원별 기출문제집은 구매해 본 적 있으나 6개년 기출문제집은 처음이라서 어떨지 엄청 궁금했었다.한 권인 줄 알았는데 9급 기출문제집, 7급 기출문제집, 해설집 총 3권으로 분리가 된다. 들고 다니가 편리할 것 같다. 그리고 빠른 정답 표기 있어서 빠르게 채점이 가능하고 기출문제집 뒤쪽에 OMR 카드가 있어서 실전 연습이 가능하다. 그리고 매회 QR코드가 있어서 문제 풀이 시간을 측정하고, 모바일 성적 분석 표도 발급받을 수 있다. 최신 3개년은 해설강의가 무료 제공된다.내가 제일 마음에 들었던 부분, 나의 취약 영역을 알 수 있다. 안 그래도 한국사는 나에게 힘든 과목인데... 이것으로 나의 취약 영역을 알고 부족하는 시간이 되길.. 본 후기는 에듀윌 온라인 스터디 참여하여 솔직하게 작성한 후기입니다.",9791136006837
20,기출 문제집 만족합니다,5,5,kmjmjk,2020-09-25,"9급 기출 문제집으로는 딱 깔끔하고 보기좋은 거 같습니다 고난도 기출 문제집도 수록 되어 있고 해설본도 합격예상, 취약영역 체크 해볼 수 있어서 스스로 공부하고 학습하기에 괜찮네요~!기출문제집이라 무난하고 좋습니다. 디자인도 깔끔하고 에듀윌은 국어 영어 한국사 표지가 다 통일돼서 좋네요본 후기는 에듀윌 온라인 스터디 참여하여 솔직하게 작성한 후기입니다.",9791136006837
